Session details: FF-2,No abstract available.
Style Separation and Synthesis via Generative Adversarial Networks,"Style synthesis attracts great interests recently, while few works focus on its dual problem ""style separation"". In this paper, we propose the Style Separation and Synthesis Generative Adversarial Network (S3-GAN) to simultaneously implement style separation and style synthesis on object photographs of specific categories. Based on the assumption that the object photographs lie on a manifold, and the contents and styles are independent, we employ S3-GAN to build mappings between the manifold and a latent vector space for separating and synthesizing the contents and styles. The S3-GAN consists of an encoder network, a generator network, and an adversarial network. The encoder network performs style separation by mapping an object photograph to a latent vector. Two halves of the latent vector represent the content and style, respectively. The generator network performs style synthesis by taking a concatenated vector as input. The concatenated vector contains the style half vector of the style target image and the content half vector of the content target image. Once obtaining the images from the generator network, an adversarial network is imposed to generate more photo-realistic images. Experiments on CelebA and UT Zappos 50K datasets demonstrate that the S3-GAN has the capacity of style separation and synthesis simultaneously, and could capture various styles in a single model."
Group Re-Identification: Leveraging and Integrating Multi-Grain Information,"This paper addresses an important yet less-studied problem: re-identifying groups of people in different camera views. Group re-identification (Re-ID) is very challenging since it is not only interfered by view-point and human pose variations in the traditional single-object Re-ID tasks, but also suffers from group layout and group member variations. To handle these issues, we propose to leverage the information of multi-grain objects: individual person and subgroups of two and three people inside a group image. We compute multi-grain representations to characterize the appearance and spatial features of multi-grain objects and evaluate the importance weight of each object for group Re-ID, so as to handle the interferences from group dynamics. We compute the optimal group-wise matching by using a multi-order matching process based on the multi-grain representation and importance weights. Furthermore, we dynamically update the importance weights according to the current matching results and then compute a new optimal group-wise matching. The two steps are iteratively conducted, yielding the final matching results.Experimental results on various datasets demonstrate the effectiveness of our approach."
OSMO: Online Specific Models for Occlusion in Multiple Object Tracking under Surveillance Scene,"With demands of the intelligent monitoring, multiple object tracking (MOT) in surveillance scene has become an essential but challenging task. Occlusion is the primary difficulty in surveillance MOT, which can be categorized into the inter-object occlusion and the obstacle occlusion. Many current studies on general MOT focus on the former occlusion, but few studies have been conducted on the latter one. In fact, there are useful prior knowledge in surveillance videos, because the scene structure is fixed. Hence, we propose two models for dealing with these two kinds of occlusions. The attention-based appearance model is proposed to solve the inter-object occlusion, and the scene structure model is proposed to solve the obstacle occlusion. We also design an obstacle map segmentation method for segmenting obstacles from the surveillance scene. Furthermore, to evaluate our method, we propose four new surveillance datasets that contain videos with obstacles. Experimental results show the effectiveness of our two models."
Video Forecasting with Forward-Backward-Net: Delving Deeper into Spatiotemporal Consistency,"Video forecasting is an emerging topic in the computer vision field, and it is a pivotal step toward unsupervised video understanding. However, the predictions generated from the state-of-the-art methods might be far from ideal quality, due to a lack of guidance from the labeled data of correct predictions (e.g., the annotated future pose of a person). Hence, building a network for better predicting future sequences in an unsupervised manner has to be further pursued. To this end, we put forth a novel Forward-Backward-Net (FB-Net) architecture, which delves deeper into spatiotemporal consistency. It first derives the forward consistency from the raw historical observations. In contrast to mainstream video forecasting approaches, FB-Net then investigates the backward consistency from the future to the past to reinforce the predictions. The final predicted results are inferred by jointly taking both the forward and backward consistencies into account. Moreover, we embed the motion dynamics and the visual content into a single framework via the FB-Net architecture, which significantly differs from learning each component throughout the videos separately. We evaluate our FB-Net on the large-scale KTH and UCF101 datasets. The experiments show that it can introduce considerable margin improvements with respect to most recent leading studies."
Feature Constrained by Pixel: Hierarchical Adversarial Deep Domain Adaptation,"In multimedia analysis, one objective of unsupervised visual domain adaptation is to train a classifier that works well on a target domain given labeled source samples and unlabeled target samples. Feature alignment of two domains is the key issue which should be addressed to achieve this objective. Inspired by the recent study of Generative Adversarial Networks (GAN) in domain adaptation, this paper proposes a new model based on Generative Adversarial Network, named Hierarchical Adversarial Deep Network (HADN), which jointly optimizes the feature-level and pixel-level adversarial adaptation within a hierarchical network structure. Specifically, the hierarchical network structure ensures that the knowledge from pixel-level adversarial adaptation can be back propagated to facilitate the feature-level adaptation, which achieves a better feature alignment under the constraint of pixel-level adversarial adaptation. Extensive experiments on various visual recognition tasks show that the proposed method performs favorably against or better than competitive state-of-the-art methods."
Fast and Light Manifold CNN based 3D Facial Expression Recognition across Pose Variations,"This paper proposes a novel approach to 3D Facial Expression Recognition (FER), and it is based on a Fast and Light Manifold CNN model, namely FLM-CNN. Different from current manifold CNNs, FLM-CNN adopts a human vision inspired pooling structure and a multi-scale encoding strategy to enhance geometry representation, which highlights shape characteristics of expressions and runs efficiently. Furthermore, a sampling tree based preprocessing method is presented, and it sharply saves memory when applied to 3D facial surfaces, without much information loss of original data. More importantly, due to the property of manifold CNN features of being rotation-invariant, the proposed method shows a high robustness to pose variations. Extensive experiments are conducted on BU-3DFE, and state-of-the-art results are achieved, indicating its effectiveness."
Explore Multi-Step Reasoning in Video Question Answering,"Video question answering (VideoQA) always involves visual reasoning. When answering questions composing of multiple logic correlations, models need to perform multi-step reasoning. In this paper, we formulate multi-step reasoning in VideoQA as a new task to answer compositional and logical structured questions based on video content. Existing VideoQA datasets are inadequate as benchmarks for the multi-step reasoning due to limitations such as lacking logical structure and having language biases. Thus we design a system to automatically generate a large-scale dataset, namely SVQA (Synthetic Video Question Answering). Compared with other VideoQA datasets, SVQA contains exclusively long and structured questions with various spatial and temporal relations between objects. More importantly, questions in SVQA can be decomposed into human readable logical tree or chain layouts, each node of which represents a sub-task requiring a reasoning operation such as comparison or arithmetic. Towards automatic question answering in SVQA, we develop a new VideoQA model. Particularly, we construct a new attention module, which contains spatial attention mechanism to address crucial and multiple logical sub-tasks embedded in questions, as well as a refined GRU called ta-GRU (temporal-attention GRU) to capture the long-term temporal dependency and gather complete visual cues. Experimental results show the capability of multi-step reasoning of SVQA and the effectiveness of our model when compared with other existing models."
Attention and Language Ensemble for Scene Text Recognition with Convolutional Sequence Modeling,"Recent dominant approaches for scene text recognition are mainly based on convolutional neural network (CNN) and recurrent neural network (RNN), where the CNN processes images and the RNN generates character sequences. Different from these methods, we propose an attention-based architecture1 which is completely based on CNNs. The distinctive characteristics of our method include: (1) the method follows encoder-decoder architecture, in which the encoder is a two-dimensional residual CNN and the decoder is a deep one-dimensional CNN. (2) An attention module that captures visual cues, and a language module that models linguistic rules are designed equally in the decoder. Therefore the attention and language can be viewed as an ensemble to boost predictions jointly. (3) Instead of using a single loss from language aspect, multiple losses from attention and language are accumulated for training the networks in an end-to-end way. We conduct experiments on standard datasets for scene text recognition, including Street View Text, IIIT5K and ICDAR datasets. The experimental results show our CNN-based method has achieved state-of-the-art performance on several benchmark datasets, even without the use of RNN."
Temporal Sequence Distillation: Towards Few-Frame Action Recognition in Videos,"Video Analytics Software as a Service (VA SaaS) has been rapidly growing in recent years. VA SaaS is typically accessed by users using a lightweight client. Because the transmission bandwidth between the client and cloud is usually limited and expensive, it brings great benefits to design cloud video analysis algorithms with a limited data transmission requirement. Although considerable research has been devoted to video analysis, to our best knowledge, little of them has paid attention to the transmission bandwidth limitation in SaaS. As the first attempt in this direction, this work introduces a problem of few-frame action recognition, which aims at maintaining high recognition accuracy, when accessing only a few frames during both training and test. Unlike previous work that processed dense frames, we present Temporal Sequence Distillation (TSD), which distills a long video sequence into a very short one for transmission. By end-to-end training with 3D CNNs for video action recognition, TSD learns a compact and discriminative temporal and spatial representation of video frames. On Kinetics dataset, TSD+I3D typically requires only 50% of the number of frames compared to I3D, a state-of-the-art video action recognition algorithm, to achieve almost the same accuracies. The proposed TSD has three appealing advantages. Firstly, TSD has a lightweight architecture and can be deployed in the client, eg., mobile devices, to produce compressed representative frames to save transmission bandwidth. Secondly, TSD significantly reduces the computations to run video action recognition with compressed frames on the cloud, while maintaining high recognition accuracies. Thirdly, TSD can be plugged in as a preprocessing module of any existing 3D CNNs. Extensive experiments show the effectiveness and characteristics of TSD."
Previewer for Multi-Scale Object Detector,"Most multi-scale detectors face a challenge of small-size false positives due to the inadequacy of low-level features, which have small receptive field sizes and weak semantic capabilities. This paper demonstrates independent predictions from different feature layers on the same region is beneficial for reducing false positives. We propose a novel light-weight previewer block, which previews the objectness probability for the potential regression region of each prior box, using the stronger features with larger receptive fields and more contextual information for better predictions. This previewer block is generic and can be easily implemented in multi-scale detectors, such as SSD, RFBNet and MS-CNN. Extensive experiments are conducted on PASCAL VOC and KITTI pedestrian benchmark to show the superiority of the proposed method."
Learning Discriminative Features with Multiple Granularities for Person Re-Identification,"The combination of global and partial features has been an essential solution to improve discriminative performances in person re-identification (Re-ID) tasks. Previous part-based methods mainly focus on locating regions with specific pre-defined semantics to learn local representations, which increases learning difficulty but not efficient or robust to scenarios with large variances. In this paper, we propose an end-to-end feature learning strategy integrating discriminative information with various granularities. We carefully design the Multiple Granularity Network (MGN), a multi-branch deep network architecture consisting of one branch for global feature representations and two branches for local feature representations. Instead of learning on semantic regions, we uniformly partition the images into several stripes, and vary the number of parts in different local branches to obtain local feature representations with multiple granularities. Comprehensive experiments implemented on the mainstream evaluation datasets including Market-1501, DukeMTMC-reid and CUHK03 indicate that our method robustly achieves state-of-the-art performances and outperforms any existing approaches by a large margin. For example, on Market-1501 dataset in single query mode, we obtain a top result of Rank-1/mAP=96.6%/94.2% with this method after re-ranking."
StripNet: Towards Topology Consistent Strip Structure Segmentation,"In this work, we propose to study a special semantic segmentation problem where the targets are long and continuous strip patterns. Strip patterns widely exist in medical images and natural photos, such as retinal layers in OCT images and lanes on the roads, and segmentation of them has practical significance. Traditional pixel-level segmentation methods largely ignore the structure prior of strip patterns and thus easily suffer from the topological inconformity problem, such as holes and isolated islands in segmentation results. To tackle this problem, we design a novel deep framework, StripNet, that leverages the strong end-to-end learning ability of CNNs to predict the structured outputs as a sequence of boundary locations of the target strips. Specifically, StripNet decomposes the original segmentation problem into more easily solved local boundary-regression problems, and takes account of the topological constraints on the predicted boundaries. Moreover, our framework adopts a coarse-to-fine strategy and uses carefully designed heatmaps for training the boundary localization network. We examine StripNet on two challenging strip pattern segmentation tasks, retinal layer segmentation and lane detection. Extensive experiments demonstrate that StripNet achieves excellent results and outperforms state-of-the-art methods in both tasks."
Emotion Recognition in Speech using Cross-Modal Transfer in the Wild,"Obtaining large, human labelled speech datasets to train models for emotion recognition is a notoriously challenging task, hindered by annotation cost and label ambiguity. In this work, we consider the task of learning embeddings for speech classification without access to any form of labelled audio. We base our approach on a simple hypothesis: that the emotional content of speech correlates with the facial expression of the speaker. By exploiting this relationship, we show that annotations of expression can be transferred from the visual domain (faces) to the speech domain (voices) through cross-modal distillation. We make the following contributions: (i) we develop a strong teacher network for facial emotion recognition that achieves the state of the art on a standard benchmark; (ii) we use the teacher to train a student, tabula rasa, to learn representations (embeddings) for speech emotion recognition without access to labelled audio data; and (iii) we show that the speech emotion embedding can be used for speech emotion recognition on external benchmark datasets. Code, models and data are available."
Personalized Multiple Facial Action Unit Recognition through Generative Adversarial Recognition Network,"Personalized facial action unit (AU) recognition is challenging due to subject-dependent facial behavior. This paper proposes a method to recognize personalized multiple facial AUs through a novel generative adversarial network, which adapts the distribution of source domain facial images to that of target domain facial images and detects multiple AUs by leveraging AU dependencies. Specifically, we use a generative adversarial network to generate synthetic images from source domain; the synthetic images have a similar appearance to the target subject and retain the AU patterns of the source images. We simultaneously leverage AU dependencies to train a multiple AU classifier. Experimental results on three benchmark databases demonstrate that the proposed method can successfully realize unsupervised domain adaptation for individual AU detection, and thus outperforms state-of-the-art AU detection methods."
Investigation of Small Group Social Interactions Using Deep Visual Activity-Based Nonverbal Features,"Understanding small group face-to-face interactions is a prominent research problem for social psychology while the automatic realization of it recently became popular in social computing. This is mainly investigated in terms of nonverbal behaviors, as they are one of the main facet of communication. Among several multi-modal nonverbal cues, visual activity is an important one and its sufficiently good performance can be crucial for instance, when the audio sensors are missing. The existing visual activity-based nonverbal features, which are all hand-crafted, were able to perform well enough for some applications while did not perform well for some other problems. Given these observations, we claim that there is a need of more robust feature representations, which can be learned from data itself. To realize this, we propose a novel method, which is composed of optical flow computation, deep neural network based feature learning, feature encoding and classification. Additionally, a comprehensive analysis between different feature encoding techniques is also presented. The proposed method is tested on three research topics, which can be perceived during small group interactions i.e. meetings: i) emergent leader detection, ii) emergent leadership style prediction, and iii) high/low extraversion classification. The proposed method shows (significantly) better results not only as compared to the state of the art visual activity based-nonverbal features but also when the state of the art visual activity based-nonverbal features are combined with other audio-based and video-based nonverbal features."
Cross-Species Learning: A Low-Cost Approach to Learning Human Fight from Animal Fight,"Detecting human fight behavior from videos is important in social signal processing, especially in the context of surveillance. However, the uncommon occurrence of real human fight events generally restricts the data collection for fight detection in machine learning, and thus hampers the performance of contemporary data-driven approaches. To address this challenge, we present a novel cross-species learning method with a set of low-computational cost motion features for fight detection. It effectively circumvents the problem of limited human fight data for data-demaining approaches. Our method exploits the intrinsic commonality between human and animal fights, such as the physical acceleration of moving body parts. It also leverages an ensemble learning mechanism to adapt useful knowledge from similar source subsets across species. Our evaluation results demonstrate the effectiveness of the proposed feature representation for cross-species adaptation. We believe that cross-species learning is not only a promising solution to the data constraint issue, but it also sheds lights on the studies of other human mental and social behaviors in cross-disciplinary research."
Personalized Serious Games for Cognitive Intervention with Lifelog Visual Analytics,"This paper presents a novel serious game app and a method to cre- ate and integrate personalized game content based on lifelog visual analytics. The main objective is to extract personalized content from visual lifelogs, integrate it into mobile games, and evaluate the effect of personalization on user experience. First, a suite of visual analysis methods is proposed to extract semantic informa- tion from visual lifelogs and discover the association among the lifelog entities. The outcome is dataset that contains augmented and personal lifelog images. Next, a mobile game app is developed that makes use of the dataset as game content. Finally, an experiment is conducted to evaluate user gameplay behaviors in the wild over three months, where a mixture of generic and personalized game content is deployed. It is observed that user adherence is heightened by personalized game content as compared to generic content. Also observed is a higher enjoyment level in personalized than generic game content. The result provides the first empirical evidence of the effect of personalized games on user adherence and preference for cognitive intervention. This work paves the way for effective cognitive training with user-generated content."
Drawing in a Virtual 3D Space - Introducing VR Drawing in Elementary School Art Education,"Drawing is an important part of elementary school education, especially since it contributes to the development of spatial skills. Virtual reality enables us to draw not just on a flat 2D surface, but in 3D space. Our research aims at showing if and how this form of 3D drawing can be beneficial for art education. This paper presents first insights into potential benefits and obstacles when introducing 3D drawing at elementary schools. In an experiment with 18 children, we studied practical aspects, proficiency, and spatial ability development. Our results show improvement in the children's 3D drawing skills but not in their spatial abilities. Their drawing skills also do seem to be correlated with their mental rotation ability, although further research is needed to conclusively confirm this."
CIRCE: Real-Time Caching for Instance Recognition on Cloud Environments and Multi-Core Architectures,"In the smartphone era, instance recognition (IR) applications are widely used on mobile devices. However, IR applications are computationally expensive for a single mobile device, and usually they are delegated to back end servers. Nevertheless, even by exploiting the computational power offered by cloud services, IR tasks are not executed in real-time (i.e., in less than 30ms), which is crucial for interactive mobile applications. In this work, we present caching for instance recognition on cloud environments (CIRCE), a similarity caching (SC) framework designed to improve the performance of mobile IR applications in terms of execution time. Additionally, we introduce a parallel version of the Hessian-Affine detector combined with the SIFT descriptor, and a novel cache hit threshold (CHT) algorithm. Finally, we present two new public image datasets that we create to evaluate CIRCE. By using a cache size of just few hundreds, we obtain a hit ratio of at least 66% and a precision of at least 97%. In case of a cache hit, our system performs IR tasks in at most 14ms on three different applications."
