VERSE: Versatile Graph Embeddings from Similarity Measures,"Embedding a web-scale information network into a low-dimensional vector space facilitates tasks such as link prediction, classification, and visualization. Past research has addressed the problem of extracting such embeddings by adopting methods from words to graphs, without defining a clearly comprehensible graph-related objective. Yet, as we show, the objectives used in past works implicitly utilize similarity measures among graph nodes. In this paper, we carry the similarity orientation of previous works to its logical conclusion; we propose VERtex Similarity Embeddings (VERSE), a simple, versatile, and memory-efficient method that derives graph embeddings explicitly calibrated to preserve the distributions of a selected vertex-to-vertex similarity measure. VERSE learns such embeddings by training a single-layer neural network. While its default, scalable version does so via sampling similarity information, we also develop a variant using the full information per vertex. Our experimental study on standard benchmarks and real-world datasets demonstrates that VERSE, instantiated with diverse similarity measures, outperforms state-of-the-art methods in terms of precision and recall in major data mining tasks and supersedes them in time and space efficiency, while the scalable sampling-based variant achieves equally good result as the non-scalable full variant."
Demarcating Endogenous and Exogenous Opinion Diffusion Process on Social Networks,"The networked opinion diffusion in online social networks (OSN) is governed by the two genres of opinions-endogenous opinions that are driven by the influence of social contacts between users, and exogenous opinions which are formed by external effects like news, feeds etc. Such duplex opinion dynamics is led by users belonging to two categories- organic users who generally post endogenous opinions and extrinsic users who are susceptible to externalities, and mostly post the exogenous messages. Precise demarcation of endogenous and exogenous messages offers an important cue to opinion modeling, thereby enhancing its predictive performance. On the other hand, accurate user selection aids to detect extrinsic users, which in turn helps in opinion shaping. In this paper, we design CherryPick, a novel learning machinery that classifies the opinions and users by solving a joint inference task in message and user set, from a temporal stream of sentiment messages. Furthermore, we validate the efficacy of our proposal from both modeling and shaping perspectives. Moreover, for the latter, we formulate the opinion shaping problem in a novel framework of stochastic optimal control, in which the selected extrinsic users optimally post exogenous messages so as to guide the opinions of others in a desired way. On five datasets crawled from Twitter, CherryPick offers a significant accuracy boost in terms of opinion forecasting, against several competitors. Furthermore, it can precisely determine the quality of a set of control users, which together with the proposed online shaping strategy, consistently steers the opinion dynamics more effectively than several state-of-the-art baselines."
Preferential Attachment as a Unique Equilibrium,"This paper demonstrates that the Preferential Attachment rule naturally emerges in the context of evolutionary network formation, as the unique Nash equilibrium of a simple social network game. In this game, each node aims at maximizing its degree in the future, representing its social capital in the ""society"" formed by the nodes and their connections. This result provides additional formal support to the commonly used Preferential Attachment model, initially designed to capture the ""rich get richer"" aphorism. In the process of establishing our result, we expose new connections between Preferential Attachment, random walks, and Young»s Lattice."
Modeling Success and Engagement for the App Economy,"While apps on the whole increasingly drive and shape present-day Web usage, they individually thrive and fall based on rich patterns of user adoption and long-term engagement. In studying these patterns at the population level, researchers remain curtailed by practical difficulties in accessing consistently detailed data covering large, representative cross-sections of apps. We address this challenge by proposing an empirical framework for analyzing an app»s patterns of adoption and engagement. Importantly, our approach requires obtaining only an app»s daily, weekly, and monthly usership time-series data, which are popular metrics tracked and made available for many apps. Modeling how the nuanced co-dynamics of an app»s daily, weekly, and monthly usership measures (DAU, WAU, and MAU) reliably reveal user adoption and repeat engagement, we extend and demonstrably improve on the predictive performance of prior install- or DAU-based methods. To further study the mechanisms by which successful apps cultivate their userbases, we position apps along the dual axes of viral adoption and retentive engagement as mechanisms to potentially explain success. Applying our approach to data on Facebook apps, we show that these apps over time became less viral and more engaging. Interestingly, despite their diminished virality, their improved user retention subtly and counter-intuitively boosted these apps' rates of new user adoptions through user-activity-based word of mouth, because an engaged user contributes to word of mouth over a longer period of time. In a final case application, we introduce evidence that developers of apps that learn to successfully retain their users carry this valuable experience over into their new apps."
Fully Dynamic k-Center Clustering,"Static and dynamic clustering algorithms are a fundamental tool in any machine learning library. Most of the efforts in developing dynamic machine learning and data mining algorithms have been focusing on the sliding window model (where at any given point in time only the most recent data items are retained) or more simplistic models. However, in many real-world applications one might need to deal with arbitrary deletions and insertions. For example, one might need to remove data items that are not necessarily the oldest ones, because they have been flagged as containing inappropriate content or due to privacy concerns. Clustering trajectory data might also require to deal with more general update operations. We develop a (2+ε)-approximation algorithm for the k-center clustering problem with ""small»» amortized cost under the fully dynamic adversarial model. In such a model, points can be added or removed arbitrarily, provided that the adversary does not have access to the random choices of our algorithm. The amortized cost of our algorithm is poly-logarithmic when the ratio between the maximum and minimum distance between any two points in input is bounded by a polynomial, while k and epsilon are constant. Our theoretical results are complemented with an extensive experimental evaluation on dynamic data from Twitter, Flickr, as well as trajectory data, demonstrating the effectiveness of our approach."
Listing k-cliques in Sparse Real-World Graphs*,"Motivated by recent studies in the data mining community which require to efficiently list all k-cliques, we revisit the iconic algorithm of Chiba and Nishizeki and develop the most efficient parallel algorithm for such a problem. Our theoretical analysis provides the best asymptotic upper bound on the running time of our algorithm for the case when the input graph is sparse. Our experimental evaluation on large real-world graphs shows that our parallel algorithm is faster than state-of-the-art algorithms, while boasting an excellent degree of parallelism. In particular, we are able to list all k-cliques (for any k) in graphs containing up to tens of millions of edges as well as all $10$-cliques in graphs containing billions of edges, within a few minutes and a few hours respectively. Finally, we show how our algorithm can be employed as an effective subroutine for finding the k-clique core decomposition and an approximate k-clique densest subgraphs in very large real-world graphs."
Fast Exact CoSimRank Search on Evolving and Static Graphs,"In real Web applications, CoSimRank has been proposed as a powerful measure of node-pair similarity based on graph topologies. However, existing work on CoSimRank is restricted to static graphs. When the graph is updated with new edges arriving over time, it is cost-inhibitive to recompute all CoSimRank scores from scratch, which is impractical. In this study, we propose a fast dynamic scheme, \DCoSim for accurate CoSimRank search over evolving graphs. Based on \DCoSim, we also propose a fast scheme, \FCoSim, that greatly accelerates CoSimRank search over static graphs. Our theoretical analysis shows that \DCoSim and \FCoSim guarantee the exactness of CoSimRank scores. On the static graph G, to efficiently retrieve CoSimRank scores $\mathbfS $, \FCoSim is based on three ideas: (i) It first finds a ""spanning polytree»» T over G. (ii) On T, a fast algorithm is designed to compute the CoSimRank scores $\mathbfS (T)$ over the ""spanning polytree»» T. (iii) On G, \DCoSim is employed to compute the changes of $\mathbfS (T)$ in response to the delta graph $(G øminus T)$. Experimental evaluations verify the superiority of \DCoSim over evolving graphs, and the fast speedup of \FCoSim on large-scale static graphs against its competitors, without any loss of accuracy."
Measuring and Improving the Core Resilience of Networks,"The concept of k-cores is important for understanding the global structure of networks, as well as for identifying central or important nodes within a network. It is often valuable to understand the resilience of the k-cores of a network to attacks and dropped edges (i.e., damaged communications links). We provide a formal definition of a network»s core resilience, and examine the problem of characterizing core resilience in terms of the network»s structural features: in particular, which structural properties cause a network to have high or low core resilience? To measure this, we introduce two novel node properties,Core Strength andCore Influence, which measure the resilience of individual nodes» core numbers and their influence on other nodes» core numbers. Using these properties, we propose theMaximize Resilience of k-Core algorithm to add edges to improve the core resilience of a network. We consider two attack scenarios - randomly deleted edges and randomly deleted nodes. Through experiments on a variety of technological and infrastructure network datasets, we verify the efficacy of our node-based resilience measures at predicting the resilience of a network, and evaluate MRKC at the task of improving a network»s core resilience. We find that on average, for edge deletion attacks, MRKC improves the resilience of a network by 11.1% over the original network, as compared to the best baseline method, which improves the resilience of a network by only 2%. For node deletion attacks, MRKC improves the core resilience of the original network by 19.7% on average, while the best baseline improves it by only 3%."
Low Rank Spectral Network Alignment,"Network alignment or graph matching is the classic problem of finding matching vertices between two graphs with applications in network de-anonymization and bioinformatics. There exist a wide variety of algorithms for it, but a challenging scenario for all of the algorithms is aligning two networks without any information about which nodes might be good matches. In this case, the vast majority of principled algorithms demand quadratic memory in the size of the graphs. We show that one such method---the recently proposed and theoretically grounded EigenAlign algorithm---admits a novel implementation which requires memory that is linear in the size of the graphs. The key step to this insight is identifying low-rank structure in the node-similarity matrix used by EigenAlign for determining matches. With an exact, closed-form low-rank structure, we then solve a maximum weight bipartite matching problem on that low-rank matrix to produce the matching between the graphs. For this task, we show a new, a-posteriori, approximation bound for a simple algorithm to approximate a maximum weight bipartite matching problem on a low-rank matrix. The combination of our two new methods then enables us to tackle much larger network alignment problems than previously possible and to do so quickly. Problems that take hours with existing methods take only seconds with our new algorithm. We thoroughly validate our low-rank algorithm against the original EigenAlign approach. We also compare a variety of existing algorithms on problems in bioinformatics and social networks. Our approach can also be combined with existing algorithms to improve their performance and speed."
Mapping the Invocation Structure of Online Political Interaction,"The surge in political information, discourse, and interaction has been one of the most important developments in social media over the past several years. There is rich structure in the interaction among different viewpoints on the ideological spectrum. However, we still have only a limited analytical vocabulary for expressing the ways in which these viewpoints interact."
