Session details: Social Network Analysis and Graph Algorithms for the Web,No abstract available.
RaRE: Social Rank Regulated Large-scale Network Embedding,"Network embedding algorithms that map nodes in a network into a low-dimensional vector space are prevalent in recent years, due to their superior performance in many network-based tasks, such as clustering, classification, and link prediction. The main assumption of existing algorithms is that the learned latent representation for nodes should preserve the structure of the network, in terms of first-order or higher-order connectivity. In other words, nodes that are more similar will have higher probability to connect to each other. This phenomena is typically explained as homophily in network science. However, there is another factor usually neglected by the existing embedding algorithms, which is the popularity of a node. For example, celebrities in a social network usually receive numerous followers, which cannot be fully explained by the similarity of the two users. We denote this factor with the terminology ""social rank»». We then propose a network embedding model that considers both of the two factors in link generation, and learn proximity-based embedding and social rank-based embedding separately. Rather than simply treating these two factors independent with each other, a carefully designed link generation model is proposed, which explicitly models the interdependency between these two types of embeddings. Experiments on several real-world datasets across different domains demonstrate the superiority of our novel network embedding model over the state-of-the-art methods."
Minimizing Polarization and Disagreement in Social Networks,"The rise of social media and online social networks has been a disruptive force in society. Opinions are increasingly shaped by interactions on online social media, and social phenomena including disagreement and polarization are now tightly woven into everyday life. In this work we initiate the study of the following question: \beginquotation \noindent Given n agents, each with its own initial opinion that reflects its core value on a topic, and an opinion dynamics model, what is the structure of a social network that minimizes \em disagreementand \em controversy simultaneously? \endquotation \noindent This question is central to recommender systems: should a recommender system prefer a link suggestion between two online users with similar mindsets in order to keep disagreement low, or between two users with different opinions in order to expose each to the others viewpoint of the world, and decrease overall levels of polarization and controversy? Such decisions have an important global effect on society \citewilliams2007social. Our contributions include a mathematical formalization of this question as an optimization problem and an exact, time-efficient algorithm. We also prove that there always exists a graph with $O(n/ε^2)$ edges that is a $(1+ε)$ approximation to the optimum. Our formulation is an instance of optimization over \em graph topologies, see also \citeboyd2004fastest,daitch2009fitting,sun2006fastest. Furthermore, for a given graph, we show how to optimize the same objective over the agents» innate opinions in polynomial time. Finally, we perform an empirical study of our proposed methods on synthetic and real-world data that verify their value as mining tools to better understand the trade-off between of disagreement and polarization. We find that there is a lot of space to reduce both controversy and disagreement in real-world networks; for instance, on a Reddit network where users exchange comments on politics, our methods achieve a reduction in controversy and disagreement of the order $6.2 \times 10^4$."
Minimizing Latency in Online Ride and Delivery Services,"Motivated by the popularity of online ride and delivery services, we study natural variants of classical multi-vehicle minimum latency problems where the objective is to route a set of vehicles located at depots to serve requests located on a metric space so as to minimize the total latency. In this paper, we consider point-to-point requests that come with source-destination pairs and release-time constraints that restrict when each request can be served. The point-to-point requests and release-time constraints model taxi rides and deliveries. For all the variants considered, we show constant-factor approximation algorithms based on a linear programming framework. To the best of our knowledge, these are the first set of results for the aforementioned variants of the minimum latency problems. Furthermore, we provide an empirical study of heuristics based on our theoretical algorithms on a real data set of taxi rides."
TIMES: Temporal Information Maximally Extracted from Structures,"Inferring the node arrival sequence from a snapshot of a dynamic network is an important problem, with applications ranging from identifying sources of contagion to flow of capital in financial transaction networks. Variants of this problem have received significant recent research attention, including results on infeasibility of solution for prior formulations. We present a new formulation of the problem that admits probabilistic solutions for broad classes of dynamic network models. Instantiating our framework for a preferential attachment model, we present effectively computable and practically tight bounds on the tradeoff curve between optimal achievable precision and density/recall. We also present efficient algorithms for partial recovery of node arrival orders and derive theoretical and empirical performance bounds on the precision and density/recall of our methods in comparison to the best possible. We validate our methods through experiments on both synthetic and real networks to show that their performance is robust to model changes, and that they yield excellent results in practice. We also demonstrate their utility in the context of a novel application in analysis of the human brain connectome to draw new insights into the functional and structural organization and evolution of the human brain."
Deep Collective Classification in Heterogeneous Information Networks,"Collective classification has attracted considerable attention in the last decade, where the labels within a group of instances are correlated and should be inferred collectively, instead of independently. Conventional approaches on collective classification mainly focus on exploiting simple relational features (such ascount andexists aggregators on neighboring nodes). However, many real-world applications involve complex dependencies among the instances, which are obscure/hidden in the networks. To capture these dependencies in collective classification, we need to go beyond simple relational features and extract deep dependencies between the instances. In this paper, we study the problem of deep collective classification inHeterogeneous Information Networks (HINs), which involves different types of autocorrelations, from simple to complex relations, among the instances. Different from conventional autocorrelations, which are given explicitly by the links in the network, complex autocorrelations are obscure/hidden in HINs, and should be inferred from existing links in a hierarchical order. This problem is highly challenging due to the multiple types of dependencies among the nodes and the complexity of the relational features. In this study, we proposed a deep convolutional collective classification method, called GraphInception to learn the deep relational features in HINs. The proposed method can automatically generate a hierarchy of relational features with different complexities. Extensive experiments on four real-world networks demonstrate that our approach can improve the collective classification performance by considering deep relational features in HINs."
Fast and Accurate Random Walk with Restart on Dynamic Graphs with Guarantees,"Given a time-evolving graph, how can we track similarity between nodes in a fast and accurate way, with theoretical guarantees on the convergence and the error? Random Walk with Restart (RWR) is a popular measure to estimate the similarity between nodes and has been exploited in numerous applications. Many real-world graphs are dynamic with frequent insertion/deletion of edges; thus, tracking RWR scores on dynamic graphs in an efficient way has aroused much interest among data mining researchers. Recently, dynamic RWR models based on the propagation of scores across a given graph have been proposed, and have succeeded in outperforming previous other approaches to compute RWR dynamically. However, those models fail to guarantee exactness and convergence time for updating RWR in a generalized form. In this paper, we propose OSP, a fast and accurate algorithm for computing dynamic RWR with insertion/deletion of nodes/edges in a directed/undirected graph. When the graph is updated, OSP first calculates offset scores around the modified edges, propagates the offset scores across the updated graph, and then merges them with the current RWR scores to get updated RWR scores. We prove the exactness of OSP and introduce OSP-T, a version of OSP which regulates a trade-off between accuracy and computation time by using error tolerance?. Given restart probability c, OSP-T guarantees to return RWR scores with O(∋/c) error in O(log(∋/2)/log(1-c)) iterations. Through extensive experiments, we show that OSP tracks RWR exactly up to 4605x faster than existing static RWR method on dynamic graphs, and OSP-T requires up to 15x less time with 730x lower L1 norm error and 3.3x lower rank error than other state-of-the-art dynamic RWR methods."
SIR-Hawkes: Linking Epidemic Models and Hawkes Processes to Model Diffusions in Finite Populations,"Among the statistical tools for online information diffusion modeling, both epidemic models and Hawkes point processes are popular choices. The former originate from epidemiology, and consider information as a viral contagion which spreads into a population of online users. The latter have roots in geophysics and finance, view individual actions as discrete events in continuous time, and modulate the rate of events according to the self-exciting nature of event sequences. Here, we establish a novel connection between these two frameworks. Namely, the rate of events in an extended Hawkes model is identical to the rate of new infections in the Susceptible-Infected-Recovered (SIR) model after marginalizing out recovery events -- which are unobserved in a Hawkes process. This result paves the way to apply tools developed for SIR to Hawkes, and vice versa. It also leads to HawkesN, a generalization of the Hawkes model which accounts for a finite population size. Finally, we derive the distribution of cascade sizes for HawkesN, inspired by methods in stochastic SIR. Such distributions provide nuanced explanations to the general unpredictability of popularity: the distribution for diffusion cascade sizes tends to have two modes, one corresponding to large cascade sizes and another one around zero."
When Online Dating Meets Nash Social Welfare: Achieving Efficiency and Fairness,"Mobile dating applications such as Coffee Meets Bagel, Tantan, and Tinder, have become significant for young adults to meet new friends and discover romantic relationships. From a system designer's perspective, in order to achieve better user experience in these applications, we should take both the efficiency and fairness of a dating market into consideration, so as to increase the overall satisfaction for all users. Towards this goal, we investigate the nature of diminishing marginal returns for online dating markets (i.e., captured by the submodularity), and trade-off between the efficiency and fairness of the market with Nash social welfare. We further design effective online algorithms to the apps. We verify our models and algorithms through sound theoretical analysis and empirical studies by using real data and show that our algorithms can significantly improve the ecosystems of the online dating applications."
A Correlation Clustering Framework for Community Detection,"Graph clustering, or community detection, is the task of identifying groups of closely related objects in a large network. In this paper we introduce a new community detection framework called LambdaCC that is based on a specially weighted version of correlation clustering. A key component in our methodology is a clustering resolution parameter, lambda, which implicitly controls the size and structure of clusters formed by our framework. We show that, by increasing this parameter, our objective effectively interpolates between two different strategies in graph clustering: finding a sparse cut and forming dense subgraphs. Our methodology unifies and generalizes a number of other important clustering quality functions including modularity, sparsest cut, and cluster deletion, and places them all within the context of an optimization problem that has been well studied from the perspective of approximation algorithms. Our approach to clustering is particularly relevant in the regime of finding dense clusters, as it leads to a 2-approximation for the cluster deletion problem. We use our approach to cluster several graphs, including large collaboration networks and social networks."
Provable and Practical Approximations for the Degree Distribution using Sublinear Graph Samples,"The degree distribution is one of the most fundamental properties used in the analysis of massive graphs. There is a large literature on graph sampling, where the goal is to estimate properties (especially the degree distribution) of a large graph through a small, random sample. Estimating the degree distribution of real-world graphs poses a significant challenge, due to their heavy-tailed nature and the large variance in degrees. We design a new algorithm, SADDLES, for this problem, using recent mathematical techniques from the field of sublinear algorithms. The SADDLES algorithm gives provably accurate outputs for all values of the degree distribution. For the analysis, we define two fatness measures of the degree distribution, called the h-index and the z-index. We prove that SADDLES is sublinear in the graph size when these indices are large. A corollary of this result is a provably sublinear algorithm for any degree distribution bounded below by a power law. We deploy our new algorithm on a variety of real datasets and demonstrate its excellent empirical behavior. In all instances, we get extremely accurate approximations for all values in the degree distribution by observing at most $1%$ of the vertices. This is a major improvement over the state-of-the-art sampling algorithms, which typically sample more than $10%$ of the vertices to give comparable results. We also observe that the h and z-indices of real graphs are large, validating our theoretical analysis."
Mining Tours and Paths in Activity Networks,"The proliferation of online social networks and the spread of smart mobile devices enable the collection of information related to a multitude of users' activities. These networks, where every node is associated with a type of action and a frequency, are usually referred to as activity networks. Examples of such networks include road networks, where the nodes are intersections and the edges are road segments. Each node is associated with a number of geolocated actions that users of an online platform took in its vicinity. In these networks, we define a prize-collecting subgraph to be a connected set of nodes, which exhibits high levels of activity, and is compact, i.e., the nodes are close to each other. The k-PCSubgraphs problem we address in this paper is defined as follows: given an activity network and an integer k, identify k non-overlapping and connected subgraphs of the network such that the nodes of each subgraph are close to each other, and the total number of actions they are associated with is high. Here, we define and study two new variants of the k-PCSubgraphs problem, where the subgraphs of interest are tours and paths. Since both these problems are NP-hard, we provide approximate and heuristic algorithms that run in time nearly-linear to the number of edges. In our experiments, we use real activity networks obtained by combining road networks and projecting on them user activity from Twitter and Flickr. Our experimental results demonstrate both the efficiency and the practical utility of our methods."
Co-Regularized Deep Multi-Network Embedding,"Network embedding aims to learn a low-dimensional vector representation for each node in the social and information networks, with the constraint to preserve network structures. Most existing methods focus on single network embedding, ignoring the relationship between multiple networks. In many real-world applications, however, multiple networks may contain complementary information, which can lead to further refined node embeddings. Thus, in this paper, we propose a novel multi-network embedding method, DMNE. DMNE is flexible. It allows different networks to have different sizes, to be (un)weighted and (un)directed. It leverages multiple networks via cross-network relationships between nodes in different networks, which may form many-to-many node mappings, and be associated with weights. To model the non-linearity of the network data, we develop DMNE to have a new deep learning architecture, which coordinates multiple neural networks (one for each input network data) with a co-regularized loss function. With multiple layers of non-linear mappings, DMNE progressively transforms each input network to a highly non-linear latent space, and in the meantime, adapts different spaces to each other through a co-regularized learning schema. Extensive experimental results on real-life datasets demonstrate the effectiveness of our method."
On Exploring Semantic Meanings of Links for Embedding Social Networks,"There are increasing interests in learning low-dimensional and dense node representations from the network structure which is usually high-dimensional and sparse. However, most existing methods fail to consider semantic meanings of links. Different links may have different semantic meanings because the similarities between two nodes can be different, e.g., two nodes share common neighbors and two nodes share similar interests which are demonstrated in node-generated content. In this paper, the former type of links are referred to as structure-close links while the latter type are referred to as content-close links. These two types of links naturally indicate there are two types of characteristics that nodes expose in a social network. Hence, we propose to learn two representations for each node, and render each representation responsible for encoding the corresponding type of node characteristics, which is achieved by jointly embedding the network structure and inferring the type of each link. In the experiments, the proposed method is demonstrated to be more effective than five recent methods on four social networks through applications including visualization, link prediction and multi-label classification."
Any-k: Anytime Top-k Tree Pattern Retrieval in Labeled Graphs,"Many problems in areas as diverse as recommendation systems, social network analysis, semantic search, and distributed root cause analysis can be modeled as pattern search on labeled graphs (also called ""heterogeneous information networks"" or HINs). Given a large graph and a query pattern with node and edge label constraints, a fundamental challenge is to find the top-k matches according to a ranking function over edge and node weights. For users, it is difficult to select value k. We therefore propose the novel notion of an any-k ranking algorithm: for a given time budget, return as many of the top-ranked results as possible. Then, given additional time, produce the next lower-ranked results quickly as well. It can be stopped anytime, but may have to continue until all results are returned. This paper focuses on acyclic patterns over arbitrary labeled graphs. We are interested in practical algorithms that effectively exploit (1) properties of heterogeneous networks, in particular selective constraints on labels, and (2) that the users often explore only a fraction of the top-ranked results. Our solution, KARPET, carefully integrates aggressive pruning that leverages the acyclic nature of the query, and incremental guided search. It enables us to prove strong non-trivial time and space guarantees, which is generally considered very hard for this type of graph search problem. Through experimental studies we show that KARPET achieves running times in the order of milliseconds for tree patterns on large networks with millions of nodes and edges."
Dual Graph Convolutional Networks for Graph-Based Semi-Supervised Classification,"The problem of extracting meaningful data through graph analysis spans a range of different fields, such as the internet, social networks, biological networks, and many others. The importance of being able to effectively mine and learn from such data continues to grow as more and more structured data become available. In this paper, we present a simple and scalable semi-supervised learning method for graph-structured data in which only a very small portion of the training data are labeled. To sufficiently embed the graph knowledge, our method performs graph convolution from different views of the raw data. In particular, a dual graph convolutional neural network method is devised to jointly consider the two essential assumptions of semi-supervised learning: (1) local consistency and (2) global consistency. Accordingly, two convolutional neural networks are devised to embed the local-consistency-based and global-consistency-based knowledge, respectively. Given the different data transformations from the two networks, we then introduce an unsupervised temporal loss function for the ensemble. In experiments using both unsupervised and supervised loss functions, our method outperforms state-of-the-art techniques on different datasets."
SIDE: Representation Learning in Signed Directed Networks,"Given a signed directed network, how can we learn node representations which fully encode structural information of the network including sign and direction of edges? Node representation learning or network embedding learns a mapping of each node to a vector. The mapping encodes structural information on network, providing low-dimensional dense node features for general machine learning and data mining frameworks. Since many social networks allow trust (friend) and distrust (enemy) relationships described by signed and directed edges, generalizing network embedding method to learn from sign and direction information in networks is crucial. In addition, social theories are critical tool in signed network analysis. However, none of the existing methods supports all of the desired properties: considering sign, direction, and social theoretical interpretation. In this paper, we propose SIDE, a general network embedding method that represents both sign and direction of edges in the embedding space. SIDE carefully formulates and optimizes likelihood over both direct and indirect signed connections. We provide socio-psychological interpretation for each component of likelihood function. We prove linear scalability of our algorithm and propose additional optimization techniques to reduce the training time and improve accuracy. Through extensive experiments on real-world signed directed networks, we show that SIDE effectively encodes structural information into the learned embedding."
Spectral Algorithms for Temporal Graph Cuts,"The sparsest cut problem consists of identifying a small set of edges that breaks the graph into balanced sets of vertices. The normalized cut problem balances the total degree, instead of the size, of the resulting sets. Applications of graph cuts include community detection and computer vision. However, cut problems were originally proposed for static graphs, an assumption that does not hold in many modern applications where graphs are highly dynamic. In this paper, we introduce sparsest and normalized cuts in temporal graphs, which generalize their standard definitions by enforcing the smoothness of cuts over time. We propose novel formulations and algorithms for computing temporal cuts using spectral graph theory, divide-and-conquer and low-rank matrix approximation. Furthermore, we extend temporal cuts to dynamic graph signals, where vertices have attributes. Experiments show that our solutions are accurate and scalable, enabling the discovery of dynamic communities and the analysis of dynamic graph processes."
Collective Classification of Spam Campaigners on Twitter: A Hierarchical Meta-Path Based Approach,"Cybercriminals have leveraged the popularity of a large user base available on Online Social Networks~(OSNs) to spread spam campaigns by propagating phishing URLs, attaching malicious contents, etc. However, another kind of spam attacks using phone numbers has recently become prevalent on OSNs, where spammers advertise phone numbers to attract users» attention and convince them to make a call to these phone numbers. The dynamics of phone number based spam is different from URL-based spam due to an inherent trust associated with a phone number. While previous work has proposed strategies to mitigate URL-based spam attacks, phone number based spam attacks have received less attention."
