City-Wide Signal Strength Maps: Prediction with Random Forests,"Signal strength maps are of great importance to cellular providers for network planning and operation, however they are expensive to obtain and possibly limited or inaccurate in some locations. In this paper, we develop a prediction framework based on random forests to improve signal strength maps from limited measurements. First, we propose a random forests (RFs)-based predictor, with a rich set of features including location as well as time, cell ID, device hardware and other features. We show that our RFs-based predictor can significantly improve the tradeoff between prediction error and number of measurements needed compared to state-of-the-art data-driven predictors, i.e., requiring 80% less measurements for the same prediction accuracy, or reduces the relative error by 17% for the same number of measurements. Second, we leverage two types of real-world LTE RSRP datasets to evaluate into the performance of different prediction methods: (i) a small but dense Campus dataset, collected on a university campus and (ii) several large but sparser NYC and LA datasets, provided by a mobile data analytics company."
Is Yelp Actually Cleaning Up the Restaurant Industry? A Re-Analysis on the Relative Usefulness of Consumer Reviews,"Social media provides the government with novel methods to improve regulation. One leading case has been the use of Yelp reviews to target food safety inspections. While previous research on data from Seattle finds that Yelp reviews can predict unhygienic establishments, we provide a more cautionary perspective. First, we show that prior results are sensitive to what we call “Extreme Imbalanced Sampling”: extreme because the dataset was restricted from roughly 13k inspections to a sample of only 612 inspections with only extremely high or low inspection scores, and imbalanced by not accounting for class imbalance in the population. We show that extreme imbalanced sampling is responsible for claims about the power of Yelp information in the original classification setup. Second, a re-analysis that utilizes the full dataset of 13k inspections and models the full inspection score (regression instead of classification) shows that (a) Yelp information has lower predictive power than prior inspection history and (b) Yelp reviews do not significantly improve predictions, given existing information about restaurants and inspection history. Contrary to prior claims, Yelp reviews do not appear to aid regulatory targeting. Third, this case study highlights critical issues when using social media for predictive models in governance and corroborates recent calls for greater transparency and reproducibility in machine learning."
Bi-LSTM-CRF Sequence Labeling for Keyphrase Extraction from Scholarly Documents,"In this paper, we address the keyphrase extraction problem as sequence labeling and propose a model that jointly exploits the complementary strengths of Conditional Random Fields that capture label dependencies through a transition parameter matrix consisting of the transition probabilities from one label to the neighboring label, and Bidirectional Long Short Term Memory networks that capture hidden semantics in text through the long distance dependencies. Our results on three datasets of scholarly documents show that the proposed model substantially outperforms strong baselines and previous approaches for keyphrase extraction."
Longitudinal Adversarial Attack on Electronic Health Records Data,"Although deep learning models trained on electronic health records (EHR) data have shown state-of-the-art performance in many predictive clinical tasks, the discovery of adversarial examples (i.e., input data that are engineered to cause misclassification) has exposed vulnerabilities with lab and imaging data. We specifically consider adversarial examples with longitudinal EHR data, an area that has not been previously examined because of the challenges with temporal high-dimensional and sparse features. We propose Longitudinal AdVersarial Attack (, a saliency score based adversarial example using a method that requires a minimal number of perturbations and that automatically minimizes the likelihood of detection. Features are selected and modified by jointly modeling a saliency map and attention mechanism. Experimental results with longitudinal EHR data show that an substantially reduce model performance for attention-based target models (from AUPR = 0.5 to AUPR = 0.08)."
A Graph is Worth a Thousand Words: Telling Event Stories using Timeline Summarization Graphs,"Story timeline summarization is widely used by analysts, law enforcement agencies, and policymakers for content presentation, story-telling, and other data-driven decision-making applications. Recent advancements in web technologies have rendered social media sites such as Twitter and Facebook as a viable platform for discovering evolving stories and trending events for story timeline summarization. However, a timeline summarization structure that models complex evolving stories by tracking event evolution to identify different themes of a story and generate a coherent structure that is easy for users to understand is yet to be explored. In this paper, we propose StoryGraph, a novel graph timeline summarization structure that is capable of identifying the different themes of a story. By using high penalty metrics that leverage user network communities, temporal proximity, and the semantic context of the events, we construct coherent paths and generate structural timeline summaries to tell the story of how events evolve over time. We performed experiments on real-world datasets to show the prowess of StoryGraph. StoryGraph outperforms existing models and produces accurate timeline summarizations. As a key finding, we discover that user network communities increase coherence leading to the generation of consistent summary structures."
Firsthand Opiates Abuse on Social Media: Monitoring Geospatial Patterns of Interest Through a Digital Cohort,"In the last decade drug overdose deaths reached staggering proportions in the US. Besides the raw yearly deaths count that is worrisome per se, an alarming picture comes from the steep acceleration of such rate that increased by 21% from 2015 to 2016. While traditional public health surveillance suffers from its own biases and limitations, digital epidemiology offers a new lens to extract signals from Web and Social Media that might be complementary to official statistics. In this paper we present a computational approach to identify a digital cohort that might provide an updated and complementary view on the opioid crisis. We introduce an information retrieval algorithm suitable to identify relevant subspaces of discussion on social media, for mining data from users showing explicit interest in discussions about opioid consumption in Reddit. Moreover, despite the pseudonymous nature of the user base, almost 1.5 million users were geolocated at the US state level, resembling the census population distribution with a good agreement. A measure of prevalence of interest in opiate consumption has been estimated at the state level, producing a novel indicator with information that is not entirely encoded in the standard surveillance. Finally, we further provide a domain specific vocabulary containing informal lexicon and street nomenclature extracted by user-generated content that can be used by researchers and practitioners to implement novel digital public health surveillance methodologies for supporting policy makers in fighting the opioid epidemic."
Learn2Clean: Optimizing the Sequence of Tasks for Web Data Preparation,"Data cleaning and preparation has been a long-standing challenge in data science to avoid incorrect results and misleading conclusions obtained from dirty data. For a given dataset and a given machine learning-based task, a plethora of data preprocessing techniques and alternative data curation strategies may lead to dramatically different outputs with unequal quality performance. Most current work on data cleaning and automated machine learning, however, focus on developing either cleaning algorithms or user-guided systems or"
Global Vectors for Node Representations,"Most network embedding algorithms consist in measuring co-occur-rences of nodes via random walks then learning the embeddings using Skip-Gram with Negative Sampling. While it has proven to be a relevant choice, there are alternatives, such as GloVe, which has not been investigated yet for network embedding. Even though SGNS better handles non co-occurrence than GloVe, it has a worse time-complexity. In this paper, we propose a matrix factorization approach for network embedding, inspired by GloVe, that better handles non co-occurrence with a competitive time-complexity. We also show how to extend this model to deal with networks where nodes are documents, by simultaneously learning word, node and document representations. Quantitative evaluations show that our model achieves state-of-the-art performance, while not being so sensitive to the choice of hyper-parameters. Qualitatively speaking, we show how our model helps exploring a network of documents by generating complementary network-oriented and content-oriented keywords."
The Music Streaming Sessions Dataset,"At the core of many important machine learning problems faced by online streaming services is a need to model how users interact with the content they are served. Unfortunately, there are no public datasets currently available that enable researchers to explore this topic. In order to spur that research, we release the Music Streaming Sessions Dataset (MSSD), which consists of 160 million listening sessions and associated user actions. Furthermore, we provide audio features and metadata for the approximately 3.7 million unique tracks referred to in the logs. This is the largest collection of such track metadata currently available to the public. This dataset enables research on important problems including how to model user listening and interaction behaviour in streaming, as well as Music Information Retrieval (MIR), and session-based sequential recommendations. Additionally, a subset of sessions were collected using a uniformly random recommendation setting, enabling their use for counterfactual evaluation of such sequential recommendations. Finally, we provide an analysis of user behavior and suggest further research problems which can be addressed using the dataset."
Rethinking the Detection of Child Sexual Abuse Imagery on the Internet,"Over the last decade, the illegal distribution of child sexual abuse imagery (CSAI) has transformed alongside the rise of online sharing platforms. In this paper, we present the first longitudinal measurement study of CSAI distribution online and the threat it poses to society's ability to combat child sexual abuse. Our results illustrate that CSAI has grown exponentially-to nearly 1 million detected events per month-exceeding the capabilities of independent clearinghouses and law enforcement to take action. In order to scale CSAI protections moving forward, we discuss techniques for automating detection and response by using recent advancements in machine learning."
"The Illusion of Change: Correcting for Biases in Change Inference for Sparse, Societal-Scale Data","Societal-scale data is playing an increasingly prominent role in social science research; examples from research on geopolitical events include questions on how emergency events impact the diffusion of information or how new policies change patterns of social interaction. Such research often draws critical inferences from observing how an exogenous event changes meaningful metrics like network degree or network entropy. However, as we show in this work, standard estimation methodologies make systematically incorrect inferences when the event also changes the sparsity of the data."
