From Stances' Imbalance to Their HierarchicalRepresentation and Detection,"Stance detection has gained increasing interest from the research community due to its importance for fake news detection. The goal of stance detection is to categorize an overall position of a subject towards an object into one of the four classes: agree, disagree, discuss, and unrelated. One of the major problems faced by current machine learning models used for stance detection is caused by a severe class imbalance among these classes. Hence, most models fail to correctly classify instances that fall into minority classes. In this paper, we address this problem by proposing a hierarchical representation of these classes, which combines the agree, disagree, and discuss classes under a new related class. Further, we propose a two-layer neural network that learns from this hierarchical representation and controls the error propagation between the two layers using the Maximum Mean Discrepancy regularizer. Compared with conventional four-way classifiers, this model has two advantages: (1) the hierarchical architecture mitigates the class imbalance problem; (2) the regularization makes the model to better discern between the related and unrelated stances. An extensive experimentation demonstrates state-of-the-art accuracy performance of the proposed model for stance detection."
Reply-Aided Detection of Misinformation via Bayesian Deep Learning,"Social media platforms are a plethora of misinformation and its potential negative influence on the public is a growing concern. This concern has drawn the attention of the research community on developing mechanisms to detect misinformation. The task of misinformation detection consists of classifying whether a claim is True or False. Most research concentrates on developing machine learning models, such as neural networks, that outputs a single value in order to predict the veracity of a claim. One of the major problem faced by these models is the inability of representing the uncertainty of the prediction, which is due incomplete or finite available information about the claim being examined. We address this problem by proposing a Bayesian deep learning model. The Bayesian model outputs a distribution used to represent both the prediction and its uncertainty. In addition to the claim content, we also encode auxiliary information given by people's replies to the claim. First, the model encodes a claim to be verified, and generate a prior belief distribution from which we sample a latent variable. Second, the model encodes all the people's replies to the claim in a temporal order through a Long Short Term Memory network in order to summarize their content. This summary is then used to update the prior belief generating the posterior belief. Moreover, in order to train this model, we develop a Stochastic Gradient Variational Bayes algorithm to approximate the analytically intractable posterior distribution. Experiments conducted on two public datasets demonstrate that our model outperforms the state-of-the-art detection models."
Multilevel Network Alignment,"Network alignment, which aims to find the node correspondence across multiple networks, is a fundamental task in many areas, ranging from social network analysis to adversarial activity detection. The state-of-the-art in the data mining community often view the node correspondence as a probabilistic cross-network node similarity, and thus inevitably introduce an O(n2) lower bound on the computational complexity. Moreover, they might ignore the rich patterns (e.g., clusters) accompanying the real networks. In this paper, we propose a multilevel network alignment algorithm (Moana) which consists of three key steps. It first efficiently coarsens the input networks into their structured representations, and then aligns the coarsest representations of the input networks, followed by the interpolations to obtain the alignment at multiple levels including the node level at the finest granularity. The proposed coarsen-align-interpolate method bears two key advantages. First, it overcomes the O(n2) lower bound, achieving a linear complexity. Second, it helps reveal the alignment between rich patterns of the input networks at multiple levels (e.g., node, clusters, super-clusters, etc.). Extensive experimental evaluations demonstrate the efficacy of the proposed algorithm on both the node-level alignment and the alignment among rich patterns (e.g., clusters) at different granularities."
Automatic Generation of Pattern-controlled Product Description in E-commerce,"Nowadays, online shoppers have paid more and more attention to detailed product descriptions, since a well-written description is a huge factor in making online sales. However, for a website with billions of product data like Alibaba, the writing efficiency of human copywriters cannot match the growth rate of new products. To address this issue, we propose a novel pointer-generator neural network to generate product description. In particular, coordinate encoders and a pattern-controlled decoder are utilized to improve generation quality with an attention mechanism. The coordinate encoders equipped with a Transformer and a gated convolutional unit is introduced to learn the source input representations. In the decoding phase, a pattern controlled decoder is proposed to control the output description pattern (such as category, length, and style) to ensure the quality of the description. For evaluation, we build a substantial collection of real-world products along with human-written descriptions. An extensive set of experiments with both human annotated data demonstrate the advantage of the proposed method for generation qualities. Finally, an online deployment shows significant benefits of our model in a real online shopping scenario, as measured by the click-through rate."
Iteratively Learning Embeddings and Rules for Knowledge Graph Reasoning,"Reasoning is essential for the development of large knowledge graphs, especially for completion, which aims to infer new triples based on existing ones. Both rules and embeddings can be used for knowledge graph reasoning and they have their own advantages and difficulties. Rule-based reasoning is accurate and explainable but rule learning with searching over the graph always suffers from efficiency due to huge search space. Embedding-based reasoning is more scalable and efficient as the reasoning is conducted via computation between embeddings, but it has difficulty learning good representations for sparse entities because a good embedding relies heavily on data richness. Based on this observation, in this paper we explore how embedding and rule learning can be combined together and complement each other's difficulties with their advantages. We propose a novel framework IterE iteratively learning embeddings and rules, in which rules are learned from embeddings with proper pruning strategy and embeddings are learned from existing triples and new triples inferred by rules. Evaluations on embedding qualities of IterE show that rules help improve the quality of sparse entity embeddings and their link prediction results. We also evaluate the efficiency of rule learning and quality of rules from IterE compared with AMIE+, showing that IterE is capable of generating high quality rules more efficiently. Experiments show that iteratively learning embeddings and rules benefit each other during learning and prediction."
Language in Our Time: An Empirical Analysis of Hashtags,"Hashtags in online social networks have gained tremendous popularity during the past five years. The resulting large quantity of data has provided a new lens into modern society. Previously, researchers mainly rely on data collected from Twitter to study either a certain type of hashtags or a certain property of hashtags. In this paper, we perform the first large-scale empirical analysis of hashtags shared on Instagram, the major platform for hashtag-sharing. We study hashtags from three different dimensions including the temporal-spatial dimension, the semantic dimension, and the social dimension. Extensive experiments performed on three large-scale datasets with more than 7 million hashtags in total provide a series of interesting observations. First, we show that the temporal patterns of hashtags can be categorized into four different clusters, and people tend to share fewer hashtags at certain places and more hashtags at others. Second, we observe that a non-negligible proportion of hashtags exhibit large semantic displacement. We demonstrate hashtags that are more uniformly shared among users, as quantified by the proposed hashtag entropy, are less prone to semantic displacement. In the end, we propose a bipartite graph embedding model to summarize users' hashtag profiles, and rely on these profiles to perform friendship prediction. Evaluation results show that our approach achieves an effective prediction with AUC (area under the ROC curve) above 0.8 which demonstrates the strong social signals possessed in hashtags."
Neural IR Meets Graph Embedding: A Ranking Model for Product Search,"Recently, neural models for information retrieval are becoming increasingly popular. They provide effective approaches for product search due to their competitive advantages in semantic matching. However, it is challenging to use graph-based features, though proved very useful in IR literature, in these neural approaches. In this paper, we leverage the recent advances in graph embedding techniques to enable neural retrieval models to exploit graph-structured data for automatic feature extraction. The proposed approach can not only help to overcome the long-tail problem of click-through data, but also incorporate external heterogeneous information to improve search results. Extensive experiments on a real-world e-commerce dataset demonstrate significant improvement achieved by our proposed approach over multiple strong baselines both as an individual retrieval model and as a feature used in learning-to-rank frameworks."
Neural Multimodal Belief Tracker with Adaptive Attention for Dialogue Systems,"Multimodal dialogue systems are attracting increasing attention with a more natural and informative way for human-computer interaction. As one of its core components, the belief tracker estimates the user's goal at each step of the dialogue and provides a direct way to validate the ability of dialogue understanding. However, existing studies on belief trackers are largely limited to textual modality, which cannot be easily extended to capture the rich semantics in multimodal systems such as those with product images. For example, in fashion domain, the visual appearance of clothes play a crucial role in understanding the user's intention. In this case, the existing belief trackers may fail to generate accurate belief states for a multimodal dialogue system."
Auto-EM: End-to-end Fuzzy Entity-Matching using Pre-trained Deep Models and Transfer Learning,"Entity matching (EM), also known as entity resolution, fuzzy join, and record linkage, refers to the process of identifying records corresponding to the same real-world entities from different data sources. It is an important and long-standing problem in data integration and data mining. So far progresses have been made mainly in the form of model improvements, where models with better accuracy are developed when large amounts of training data is available. In real-world applications we find that advanced approaches can often require too many labeled examples that is expensive to obtain, which has become a key obstacle to wider adoption."
Review Response Generation in E-Commerce Platforms with External Product Information,"''User reviews” are becoming an essential component of e-commerce. When buyers write a negative or doubting review, ideally, the sellers need to quickly give a response to minimize the potential impact. When the number of reviews is growing at a frightening speed, there is an urgent need to build a response writing assistant for customer service providers. In order to generate high-quality responses, the algorithm needs to consume and understand the information from both the original review and the target product. The classical sequence-to-sequence (Seq2Seq) methods can hardly satisfy this requirement. In this study, we propose a novel deep neural network model based on the Seq2Seq framework for the review response generation task in e-commerce platforms, which can incorporate product information by a gated multi-source attention mechanism and a copy mechanism. Moreover, we employ a reinforcement learning technique to reduce the exposure bias problem. To evaluate the proposed model, we constructed a large-scale dataset from a popular e-commerce website, which contains product information. Empirical studies on both automatic evaluation metrics and human annotations show that the proposed model can generate informative and diverse responses, significantly outperforming state-of-the-art text generation models."
CBHE: Corner-based Building Height Estimation for Complex Street Scene Images,"Building height estimation is important in many applications such as 3D city reconstruction, urban planning, and navigation. Recently, a new building height estimation method using street scene images and 2D maps was proposed. This method is more scalable than traditional methods that use high-resolution optical data, LiDAR data, or RADAR data which are expensive to obtain. The method needs to detect building rooflines and then compute building height via the pinhole camera model. We observe that this method has limitations in handling complex street scene images in which buildings overlap with each other and the rooflines are difficult to locate. We propose CBHE, a building height estimation algorithm considering both building corners and rooflines. CBHE first obtains building corner and roofline candidates in street scene images based on building footprints from 2D maps and the camera parameters. Then, we use a deep neural network named BuildingNet to classify and filter corner and roofline candidates. Based on the valid corners and rooflines from BuildingNet, CBHE computes building height via the pinhole camera model. Experimental results show that the proposed BuildingNet yields a higher accuracy on building corner and roofline candidate filtering compared with the state-of-the-art open set classifiers. Meanwhile, CBHE outperforms the baseline algorithm by over 10% in building height estimation accuracy."
Domain-Constrained Advertising Keyword Generation,"Advertising (ad for short) keyword suggestion is important for sponsored search to improve online advertising and increase search revenue. There are two common challenges in this task. First, the keyword bidding problem: hot ad keywords are very expensive for most of the advertisers because more advertisers are bidding on more popular keywords, while unpopular keywords are difficult to discover. As a result, most ads have few chances to be presented to the users. Second, the inefficient ad impression issue: a large proportion of search queries, which are unpopular yet relevant to many ad keywords, have no ads presented on their search result pages. Existing retrieval-based or matching-based methods either deteriorate the bidding competition or are unable to suggest novel keywords to cover more queries, which leads to inefficient ad impressions."
Predicting ConceptNet Path Quality Using Crowdsourced Assessments of Naturalness,"In many applications, it is important to characterize the way in which two concepts are semantically related. Knowledge graphs such as ConceptNet provide a rich source of information for such characterizations by encoding relations between concepts as edges in a graph. When two concepts are not directly connected by an edge, their relationship can still be described in terms of the paths that connect them. Unfortunately, many of these paths are uninformative and noisy, which means that the success of applications that use such path features crucially relies on their ability to select high-quality paths. In existing applications, this path selection process is based on relatively simple heuristics. In this paper we instead propose to learn to predict path quality from crowdsourced human assessments. Since we are interested in a generic task-independent notion of quality, we simply ask human participants to rank paths according to their subjective assessment of the paths' naturalness, without attempting to define naturalness or steering the participants towards particular indicators of quality. We show that a neural network model trained on these assessments is able to predict human judgments on unseen paths with near optimal performance. Most notably, we find that the resulting path selection method is substantially better than the current heuristic approaches at identifying meaningful paths."
A Hierarchical Attention Retrieval Model for Healthcare Question Answering,"The growth of the Web in recent years has resulted in the development of various online platforms that provide healthcare information services. These platforms contain an enormous amount of information, which could be beneficial for a large number of people. However, navigating through such knowledgebases to answer specific queries of healthcare consumers is a challenging task. A majority of such queries might be non-factoid in nature, and hence, traditional keyword-based retrieval models do not work well for such cases. Furthermore, in many scenarios, it might be desirable to get a short answer that sufficiently answers the query, instead of a long document with only a small amount of useful information. In this paper, we propose a neural network model for ranking documents for question answering in the healthcare domain. The proposed model uses a deep attention mechanism at word, sentence, and document levels, for efficient retrieval for both factoid and non-factoid queries, on documents of varied lengths. Specifically, the word-level cross-attention allows the model to identify words that might be most relevant for a query, and the hierarchical attention at sentence and document levels allows it to do effective retrieval on both long and short documents. We also construct a new large-scale healthcare question-answering dataset, which we use to evaluate our model. Experimental evaluation results against several state-of-the-art baselines show that our model outperforms the existing retrieval techniques."
ShadowBlock: A Lightweight and Stealthy Adblocking Browser,"As the popularity of adblocking has soared over the last few years, publishers are increasingly deploying anti-adblocking paywalls that ask users to either disable their adblockers or pay to access content. In this work we propose ShadowBlock, a new Chromium-based adblocking browser that can hide traces of adblocking activities from anti-adblockers as it removes ads from web pages. To bypass anti-adblocking paywalls, ShadowBlock takes advantage of existing filter lists used by adblockers and hides all ad elements stealthily in such a way that anti-adblocking scripts cannot detect any tampering of the ads (e.g., absence of ad elements). Specifically, ShadowBlock introduces lightweight hooks in Chromium to ensure that DOM states queried by anti-adblocking scripts are exactly as if adblocking is not employed. We implement a fully working prototype by modifying Chromium which shows great promise in terms of adblocking effectiveness and anti-adblocking circumvention but also more efficient than the state-of-the-art adblocking browser extensions. Our evaluation on Alexa top-1K websites shows that ShadowBlock successfully blocks 98.3% of all visible ads while only causing minor breakage on less than 0.6% of the websites. Most importantly, ShadowBlock is able to bypass anti-adblocking paywalls on more than 200 websites that deploy visible anti-adblocking paywalls with a 100% success rate. Our performance evaluation further shows that ShadowBlock loads pages as fast as the state-of-the-art adblocking browser extension on average."
GraphVite: A High-Performance CPU-GPU Hybrid System for Node Embedding,"Learning continuous representations of nodes is attracting growing interest in both academia and industry recently, due to their simplicity and effectiveness in a variety of applications. Most of existing node embedding algorithms and systems are capable of processing networks with hundreds of thousands or a few millions of nodes. However, how to scale them to networks that have tens of millions or even hundreds of millions of nodes remains a challenging problem. In this paper, we propose GraphVite, a high-performance CPU-GPU hybrid system for training node embeddings, by co-optimizing the algorithm and the system. On the CPU end, augmented edge samples are parallelly generated by random walks in an online fashion on the network, and serve as the training data. On the GPU end, a novel parallel negative sampling is proposed to leverage multiple GPUs to train node embeddings simultaneously, without much data transfer and synchronization. Moreover, an efficient collaboration strategy is proposed to further reduce the synchronization cost between CPUs and GPUs. Experiments on multiple real-world networks show that GraphVite is super efficient. It takes only about one minute for a network with 1 million nodes and 5 million edges on a single machine with 4 GPUs, and takes around 20 hours for a network with 66 million nodes and 1.8 billion edges. Compared to the current fastest system, GraphVite is about 50 times faster without any sacrifice on performance."
Transfer Learning for Unsupervised Influenza-like Illness Models from Online Search Data,"A considerable body of research has demonstrated that online search data can be used to complement current syndromic surveillance systems. The vast majority of previous work proposes solutions that are based on supervised learning paradigms, in which historical disease rates are required for training a model. However, for many geographical regions this information is either sparse or not available due to a poor health infrastructure. It is these regions that have the most to benefit from inferring population health statistics from online user search activity. To address this issue, we propose a statistical framework in which we first learn a supervised model for a region with adequate historical disease rates, and then transfer it to a target region, where no syndromic surveillance data exists. This transfer learning solution consists of three steps: (i) learn a regularized regression model for a source country, (ii) map the source queries to target ones using semantic and temporal similarity metrics, and (iii) re-adjust the weights of the target queries. It is evaluated on the task of estimating influenza-like illness (ILI) rates. We learn a source model for the United States, and subsequently transfer it to three other countries, namely France, Spain and Australia. Overall, the transferred (unsupervised) models achieve strong performance in terms of Pearson correlation with the ground truth (> .92 on average), and their mean absolute error does not deviate greatly from a fully supervised baseline."
Tortoise or Hare? Quantifying the Effects of Performance on Mobile App Retention,"We contribute by quantifying the effect of network latency and battery consumption on mobile app performance and retention, i.e., user's decisions to continue or stop using apps. We perform our analysis by fusing two large-scale crowdsensed datasets collected by piggybacking on information captured by mobile apps. We find that app performance has an impact in its retention rate. Our results demonstrate that high energy consumption and high latency decrease the likelihood of retaining an app. Conversely, we show that reducing latency or energy consumption does not guarantee higher likelihood of retention as long as they are within reasonable standards of performance. However, we also demonstrate that what is considered reasonable depends on what users have been accustomed to, with device and network characteristics, and app category playing a role. As our second contribution, we develop a model for predicting retention based on performance metrics. We demonstrate the benefits of our model through empirical benchmarks which show that our model not only predicts retention accurately, but generalizes well across application categories, locations and other factors moderating the effect of performance."
BotCamp: Bot-driven Interactions in Social Campaigns,"Bots (i.e. automated accounts) involve in social campaigns typically for two obvious reasons: to inorganically sway public opinion and to build social capital exploiting the organic popularity of social campaigns. In the process, bots interact with each other and engage in human activities (e.g. likes, retweets, and following)."
