STFNets: Learning Sensing Signals from the Time-Frequency Perspective with Short-Time Fourier Neural Networks,"Recent advances in deep learning motivate the use of deep neural networks in Internet-of-Things (IoT) applications. These networks are modelled after signal processing in the human brain, thereby leading to significant advantages at perceptual tasks such as vision and speech recognition. IoT applications, however, often measure physical phenomena, where the underlying physics (such as inertia, wireless signal propagation, or the natural frequency of oscillation) are fundamentally a function of signal frequencies, offering better features in the frequency domain. This observation leads to a fundamental question: For IoT applications, can one develop a new brand of neural network structures that synthesize features inspired not only by the biology of human perception but also by the fundamental nature of physics? Hence, in this paper, instead of using conventional building blocks (e.g., convolutional and recurrent layers), we propose a new foundational neural network building block, the Short-Time Fourier Neural Network (STFNet). It integrates a widely-used time-frequency analysis method, the Short-Time Fourier Transform, into data processing to learn features directly in the frequency domain, where the physics of underlying phenomena leave better footprints. STFNets bring additional flexibility to time-frequency analysis by offering novel nonlinear learnable operations that are spectral-compatible. Moreover, STFNets show that transforming signals to a domain that is more connected to the underlying physics greatly simplifies the learning process. We demonstrate the effectiveness of STFNets with extensive experiments on a wide range of sensing inputs, including motion sensors, WiFi, ultrasound, and visible light. STFNets significantly outperform the state-of-the-art deep learning models in all experiments. A STFNet, therefore, demonstrates superior capability as the fundamental building block of deep neural networks for IoT applications for various sensor inputs 1."
CoaCor: Code Annotation for Code Retrieval with Reinforcement Learning,"To accelerate software development, much research has been performed to help people understand and reuse the huge amount of available code resources. Two important tasks have been widely studied: code retrieval, which aims to retrieve code snippets relevant to a given natural language query from a code base, and code annotation, where the goal is to annotate a code snippet with a natural language description. Despite their advancement in recent years, the two tasks are mostly explored separately. In this work, we investigate a novel perspective of Code annotation for Code retrieval (hence called “CoaCor”), where a code annotation model is trained to generate a natural language annotation that can represent the semantic meaning of a given code snippet and can be leveraged by a code retrieval model to better distinguish relevant code snippets from others. To this end, we propose an effective framework based on reinforcement learning, which explicitly encourages the code annotation model to generate annotations that can be used for the retrieval task. Through extensive experiments, we show that code annotations generated by our framework are much more detailed and more useful for code retrieval, and they can further improve the performance of existing code retrieval models significantly.1"
Snapshot-based Loading Acceleration of Web Apps with Nondeterministic JavaScript Execution,"JavaScript execution is heavily used during the loading of web apps, taking a substantial portion of the app loading time. To accelerate JavaScript execution, snapshot-based app loading has been proposed [5, 17]. We take a snapshot of the JavaScript objects in the heap at some point during app loading (which we call snapshot point) and save them in a file in advance. Then, we start app loading by copying the objects in the snapshot to the heap directly, skipping JavaScript execution to create those objects. One issue is that the JavaScript execution state at the snapshot point should be the same at every app loading. If JavaScript execution included in the snapshot is involved with some nondeterminism (e.g., use random function or current time/location), snapshot-based app loading might be inapplicable since the loaded state might differ each time."
Doppelgängers on the Dark Web: A Large-scale Assessment on Phishing Hidden Web Services,"Anonymous network services on the World Wide Web have emerged as a new web architecture, called the Dark Web. The Dark Web has been notorious for harboring cybercriminals abusing anonymity. At the same time, the Dark Web has been a last resort for people who seek freedom of the press as well as avoid censorship. This anonymous nature allows website operators to conceal their identity and thereby leads users to have difficulties in determining the authenticity of websites. Phishers abuse this perplexing authenticity to lure victims; however, only a little is known about the prevalence of phishing attacks on the Dark Web."
Hierarchical Temporal Convolutional Networks for Dynamic Recommender Systems,"Recommender systems that can learn from cross-session data to dynamically predict the next item a user will choose are crucial for online platforms. However, existing approaches often use out-of-the-box sequence models which are limited by speed and memory consumption, are often infeasible for production environments, and usually do not incorporate cross-session information, which is crucial for effective recommendations. Here we propose Hierarchical Temporal Convolutional Networks (HierTCN), a hierarchical deep learning architecture that makes dynamic recommendations based on users' sequential multi-session interactions with items. HierTCN is designed for web-scale systems with billions of items and hundreds of millions of users. It consists of two levels of models: The high-level model uses Recurrent Neural Networks (RNN) to aggregate users' evolving long-term interests across different sessions, while the low-level model is implemented with Temporal Convolutional Networks (TCN), utilizing both the long-term interests and the short-term interactions within sessions to predict the next interaction. We conduct extensive experiments on a public XING dataset and a large-scale Pinterest dataset that contains 6 million users with 1.6 billion interactions. We show that HierTCN is 2.5x faster than RNN-based models and uses 90% less data memory compared to TCN-based models. We further develop an effective data caching scheme and a queue-based mini-batch generator, enabling our model to be trained within 24 hours on a single GPU. Our model consistently outperforms state-of-the-art dynamic recommendation methods, with up to 18% improvement in recall and 10% in mean reciprocal rank."
Spectrum-enhanced Pairwise Learning to Rank,"To enhance the performance of the recommender system, side information is extensively explored with various features (e.g., visual features and textual features). However, there are some demerits of side information: (1) the extra data is not always available in all recommendation tasks; (2) it is only for items, there is seldom high-level feature describing users. To address these gaps, we introduce the spectral features extracted from two hypergraph structures of the purchase records. Spectral features describe the similarity of users/items in the graph space, which is critical for recommendation. We leverage spectral features to model the users' preference and items' properties by incorporating them into a Matrix Factorization (MF) model."
Beyond Shortest Paths: Route Recommendations for Ride-sharing,"In taxi ride-sharing, multiple customers are allotted to the same taxi as long as they are compatible, i.e., if none of them suffers a detour beyond a permissible threshold. To attract customers to ride-sharing, taxi operators promise a reduced fare upfront. As a result, if the taxi fails to pair the initial customer with additional compatible passengers, the taxi operator incurs a financial loss. Hence, it is important to ensure that the taxi finds compatible customers once it has picked up the initial customer. In the current scenario, the appearance of subsequent compatible customers is left to luck: a taxi moves along the shortest (or quickest) path for the existing customer and hopes to find additional compatible customers on its way. In this paper, we ask: Is the shortest path the optimal path for ride-sharing? To investigate this question, we develop a route recommendation algorithm called Share, which predicts the route with the highest probability of finding compatible customers, while staying within the detour limits. Through extensive evaluations on real datasets, we show that Share reduces failure rate in ride-sharing by up to 40%, while also improving waiting time for customers by 20%. Technically, the route recommendation problem is NP-hard. We overcome this bottleneck, by reducing the search space of the entire road network into a smaller directed acyclic graph, on which we perform dynamic programming to identify the optimal route. This strategy allows us to answer queries within 0.2 seconds, and thereby making Share deployable on real road conditions."
Detecting Low Self-Esteem in Youths from Web Search Data,"Online behavior leaves a digital footprint that can be analyzed to reveal our cognitive and psychological state through time. Recognizing these subtle cues can help identify different aspects of mental health, such as low self-esteem, depression, and anxiety. Google's web search engine, used daily by millions of people, logs every search query made by a user, which is accessible through a platform called Google Takeout. Previous researchers have made efforts to detect and predict behaviors associated with depression and anxiety from web data, but only at a population level. This paper fills in the gap of looking into signs of low self-esteem, a condition that work in a vicious cycle with depression and anxiety, at an individual level by looking into Google search history data. We target college students, a population prone to depression, anxiety, and low self-esteem, and ask to take mental health assessment survey along with their individual search history. Textual analysis show that search logs contain strong signals that can identify individuals with current low self-esteem. For example, participants with low self-esteem have fewer searches pertaining to family, friend, and money attributes; and we also observed differences in the search category distribution, over time, when compared with individuals with moderate to high self-esteem. Using these markers we were able to build a probabilistic classifier that can identify low self-esteem conditions, based on search history, with an average F1 score of 0.86."
The Matthew Effect in Computation Contests: High Difficulty May Lead to 51% Dominance?,"We study the computation contests where players compete for searching a solution to a given problem with a winner-take-all reward. The search processes are independent across the players and the search speeds of players are proportional to their computational powers. One concrete application of this abstract model is the mining process of proof-of-work type blockchain systems, such as Bitcoin. Although one's winning probability is believed to be proportional to his computational power in previous studies on Bitcoin, we show that it is not the case in the strict sense."
Judging a Book by Its Cover: The Effect of Facial Perception on Centrality in Social Networks,"Facial appearance matters in social networks. Individuals frequently make trait judgments from facial clues. Although these face-based impressions lack the evidence to determine validity, they are of vital importance, because they may relate to human network-based social behavior, such as seeking certain individuals for help, advice, dating, and cooperation, and thus they may relate to centrality in social networks. However, little to no work has investigated the apparent facial traits that influence network centrality, despite the large amount of research on attributions of the central position including personality and behavior. In this paper, we examine whether perceived traits based on facial appearance affect network centrality by exploring the initial stage of social network formation in a first-year college residential area. We took face photos of participants who are freshmen living in the same residential area, and we asked them to nominate community members linking to different networks. We then collected facial perception data by requiring other participants to rate facial images for three main attributions: dominance, trustworthiness, and attractiveness. Meanwhile, we proposed a framework to discover how facial appearance affects social networks. Our results revealed that perceived facial traits were correlated with the network centrality and that they were indicative to predict the centrality of people in different networks. Our findings provide psychological evidence regarding the interaction between faces and network centrality. Our findings also offer insights in to a combination of psychological and social network techniques, and they highlight the function of facial bias in cuing and signaling social traits. To the best of our knowledge, we are the first to explore the influence of facial perception on centrality in social networks."
Pruning based Distance Sketches with Provable Guarantees on Random Graphs,"Measuring the distances between vertices on graphs is one of the most fundamental components in network analysis. Since finding shortest paths requires traversing the graph, it is challenging to obtain distance information on large graphs very quickly. In this work, we present a preprocessing algorithm that is able to create landmark based distance sketches efficiently, with strong theoretical guarantees. When evaluated on a diverse set of social and information networks, our algorithm significantly improves over existing approaches by reducing the number of landmarks stored, preprocessing time, or stretch of the estimated distances."
Large-Scale Talent Flow Forecast with Dynamic Latent Factor Model?,"The understanding of talent flow is critical for sharpening company talent strategy to keep competitiveness in the current fast-evolving environment. Existing studies on talent flow analysis generally rely on subjective surveys. However, without large-scale quantitative studies, there are limits to deliver fine-grained predictive business insights for better talent management. To this end, in this paper, we aim to introduce a big data-driven approach for predictive talent flow analysis. Specifically, we first construct a time-aware job transition tensor by mining the large-scale job transition records of digital resumes from online professional networks (OPNs), where each entry refers to a fine-grained talent flow rate of a specific job position between two companies. Then, we design a dynamic latent factor based Evolving Tensor Factorization (ETF) model for predicting the future talent flows. In particular, a novel evolving feature by jointly considering the influence of previous talent flows and global market is introduced for modeling the evolving nature of each company. Furthermore, to improve the predictive performance, we also integrate several representative attributes of companies as side information for regulating the model inference. Finally, we conduct extensive experiments on large-scale real-world data for evaluating the model performances. The experimental results clearly validate the effectiveness of our approach compared with state-of-the-art baselines in terms of talent flow forecast. Meanwhile, the results also reveal some interesting findings on the regularity of talent flows, e.g. Facebook becomes more and more attractive for the engineers from Google in 2016."
