Session details: Fast Forward 5,No abstract available.
Visual Sentiment Analysis for Review Images with Item-Oriented and User-Oriented CNN,"Online reviews are prevalent. When recounting their experience with a product, service, or venue, in addition to textual narration, a reviewer frequently includes images as photographic record. While textual sentiment analysis has been widely studied, in this paper we are interested in visual sentiment analysis to infer whether a given image included as part of a review expresses the overall positive or negative sentiment of that review. Visual sentiment analysis can be formulated as image classification using deep learning methods such as Convolutional Neural Networks or CNN. However, we observe that the sentiment captured within an image may be affected by three factors: image factor, user factor, and item factor. Essentially, only the first factor had been taken into account by previous works on visual sentiment analysis. We develop item-oriented and user-oriented CNN that we hypothesize would better capture the interaction of image features with specific expressions of users or items. Experiments on images from restaurant reviews show these to be more effective at classifying the sentiments of review images."
Mutually Guided Image Filtering,"Image filtering is helpful to numerous multimedia, computer vision and graphics tasks. Linear translation-invariant filters with manually designed kernels have been widely used. However, their performance suffers from the content-blindness, say identically treating noises, textures and structures. To mitigate the content-blindness, a family of filters, called joint/guided filters, has attracted much attention from the community, the principle of which is transferring the structure in the reference image to the target one. The main drawback of most joint/guided filters comes from the ignorance of structural inconsistency between the reference and target signals that can be like color, infrared and depth images captured under different conditions. Simply adopting such guidances very likely leads to unsatisfactory results. To address the above issues, this paper designs a simple yet effective filter, named as mutually guided image filter (muGIF), which jointly preserves mutual structures, avoids misleading from inconsistent structures and smooths flat regions. The proposed muGIF is very flexible, which can perform in one of dynamic only (self-guided), static/dynamic and dynamic/dynamic modes. Although the objective of muGIF is in nature non-convex, by subtly decomposing the objective, we can solve it effectively and efficiently. The advantages of muGIF in terms of effectiveness and flexibility are demonstrated over other state-of-the-art alternatives on a variety of applications."
Learning Semantic Feature Map for Visual Content Recognition,"The spatial relationship among objects provide rich clues to object contexts for visual recognition. In this paper, we propose to learn Semantic Feature Map (SFM) by deep neural networks to model the spatial object contexts for better understanding of image and video contents. Specifically, we first extract high-level semantic object features on input image with convolutional neural networks for every object proposals, and organize them to the designed SFM so that spatial information among objects are preserved. To fully exploit the spatial relationship among objects, we employ either Fully Convolutional Networks (FCN) or Long-Short Term Memory (LSTM) on top of SFM for final recognition. For better training, we also introduce a multi-task learning framework to train the model in an end-to-end manner. It is composed of an overall image classification loss as well as a grid labeling loss, which predicts the objects label at each SFM grid. Extensive experiments are conducted to verify the effectiveness of the proposed approach. For image classification, very promising results are obtained on Pascal VOC 2007/2012 and MS-COCO benchmarks. We also directly transfer the SFM learned on image domain to the video classification task. The results on CCV benchmark demonstrate the robustness and generalization capability of the proposed approach."
Video Visual Relation Detection,"As a bridge to connect vision and language, visual relations between objects in the form of relation triplet $łangle subject,predicate,object\rangle$, such as ""person-touch-dog'' and ""cat-above-sofa'', provide a more comprehensive visual content understanding beyond objects. In this paper, we propose a novel vision task named Video Visual Relation Detection (VidVRD) to perform visual relation detection in videos instead of still images (ImgVRD). As compared to still images, videos provide a more natural set of features for detecting visual relations, such as the dynamic relations like ""A-follow-B'' and ""A-towards-B'', and temporally changing relations like ""A-chase-B'' followed by ""A-hold-B''. However, VidVRD is technically more challenging than ImgVRD due to the difficulties in accurate object tracking and diverse relation appearances in video domain. To this end, we propose a VidVRD method, which consists of object tracklet proposal, short-term relation prediction and greedy relational association. Moreover, we contribute the first dataset for VidVRD evaluation, which contains 1,000 videos with manually labeled visual relations, to validate our proposed method. On this dataset, our method achieves the best performance in comparison with the state-of-the-art baselines."
Deep Location-Specific Tracking,"Convolutional Neural Network (CNN) based methods have shown significant performance gains in the problem of visual tracking in recent years. Due to many uncertain changes of objects online, such as abrupt motion, background clutter and large deformation, the visual tracking is still a challenging task. We propose a novel algorithm, namely Deep Location-Specific Tracking, which decomposes the tracking problem into a localization task and a classification task, and trains an individual network for each task. The localization network exploits the information in the current frame and provides a specific location to improve the probability of successful tracking, while the classification network finds the target among many examples generated around the target location in the previous frame, as well as the one estimated from the localization network in the current frame. CNN based trackers often have massive number of trainable parameters, and are prone to over-fitting to some particular object states, leading to less precision or tracking drift. We address this problem by learning a classification network based on 1 × 1 convolution and global average pooling. Extensive experimental results on popular benchmark datasets show that the proposed tracker achieves competitive results without using additional tracking videos for fine-tuning. The code is available at https://github.com/ZjjConan/DLST"
A Multi-Task Framework for Weather Recognition,"Weather recognition is important in practice, while this task has not been thoroughly explored so far. The current trend of dealing with this task is treating it as a single classification problem, i.e., determining whether a given image belongs to a certain weather category or not. However, weather recognition differs significantly from traditional image classification, since several weather features may appear simultaneously. In this case, a simple classification result is insufficient to describe the weather condition. To address this issue, we propose to provide auxiliary weather related information for comprehensive weather description. Specifically, semantic segmentation of weather-cues, such as blue sky and white clouds, is exploited as an auxiliary task in this paper. Moreover, a convolutional neural network (CNN) based multi-task framework is developed which aims to concurrently tackle weather category classification task and weather-cues segmentation task. Due to the intrinsic relationships between these two tasks, exploring auxiliary semantic segmentation of weather-cues can also help to learn discriminative features for the classification task, and thus obtain superior accuracy. To verify the effectiveness of the proposed approach, extra segmentation masks of weather-cues are generated manually on an existing weather image dataset. Experimental results have demonstrated the superior performance of our approach. The enhanced dataset, source codes and pre-trained models are available at https://github.com/wzgwzg/Multitask_Weather."
Discriminative Training of Complex-valued Deep Recurrent Neural Network for Singing Voice Separation,"Deep neural networks (DNN) have performed impressively in the processing of multimedia signals. Most DNN-based approaches were developed to handle real-valued data; very few have been designed for complex-valued data, despite their being essential for processing various types of multimedia signal. Accordingly, this work presents a complex-valued deep recurrent neural network (C-DRNN) for singing voice separation. The C-DRNN operates on the complex-valued short-time discrete Fourier transform (STFT) domain. A key aspect of the C-DRNN is that the activations and weights are complex-valued. The goal herein is to reconstruct the singing voice and the background music from a mixed signal. For error back-propagation, CR-calculus is utilized to calculate the complex-valued gradients of the objective function. To reinforce model regularity, two constraints are incorporated into the objective function of the C-DRNN. The first is an additional masking layer that ensures the sum of separated sources equals the input mixture. The second is a discriminative term that preserves the mutual difference between two separated sources. Finally, the proposed method is evaluated using the MIR-1K dataset and a singing voice separation task. Experimental results demonstrate that the proposed method outperforms the state-of-the-art DNN-based methods."
Adaptive Low-Rank Multi-Label Active Learning for Image Classification,"Multi-label active learning for image classification has attracted great attention over recent years and a lot of relevant works are published continuously. However, there still remain some problems that need to be solved, such as existing multi-label active learning algorithms do not reflect on the cleanness of sample data and their ways on label correlation mining are defective. For one thing, sample data is usually contaminated in reality, which disturbs the estimation of data distribution and further hinders the model training. For another, previous approaches for label relationship exploration are purely based on the observed label distribution of an incomplete training set, which cannot provide sufficiently efficient information. To address these issues, we propose a novel adaptive low-rank multi-label active learning algorithm, called LRMAL. Specifically, we first use low-rank matrix recovery to learn an effective low-rank feature representation from the noisy data. In a subsequent sampling phase, we make use of its superiorities to evaluate the general informativeness of each unlabeled example-label pair. Based on an intrinsic mapping relation between the example space and the label space of a certain multi-label dataset, we recover the incomplete labels of a training set for a more comprehensive label correlation mining. Furthermore, to reduce the redundancy among the selected example-label pairs, we use a diversity measurement to diversify the sampled data. Finally, an effective sampling strategy is developed by integrating these two aspects of potential information with uncertainty based on an adaptive integration scheme. Experimental results demonstrate the effectiveness of our approach."
Adaptively Attending to Visual Attributes and Linguistic Knowledge for Captioning,"Visual content description has been attracting broad research attention in multimedia community because it deeply uncovers intrinsic semantic facet of visual data. Most existing approaches formulate visual captioning as machine translation task (i.e., from vision to language) via a top-down paradigm with global attention, which ignores to distinguish visual and non-visual parts during word generation. In this work, we propose a novel adaptive attention strategy for visual captioning, which can selectively attend to salient visual content based on linguistic knowledge. Specifically, we design a key control unit, termed visual gate, to adaptively decide ""when"" and ""what"" the language generator attend to during the word generation process. We map all the preceding outputs of language generator into a latent space to derive the representation of sentence structures, which assists the ""visual gate"" to choose appropriate attention timing. Meanwhile, we employ a bottom-up workflow to learn a pool of semantic attributes for serving as the propositional attention resources. We evaluate the proposed approach on two commonly-used benchmarks, i.e., MSCOCO and MSVD. The experimental results demonstrate the superiority of our proposed approach compared to several state-of-the-art methods."
Efficient Binary Coding for Subspace-based Query-by-Image Video Retrieval,"Subspace representations have been widely applied for videos in many tasks. In particular, the subspace-based query-by-image video retrieval (QBIVR), facing high challenges on similarity-preserving measurements and efficient retrieval schemes, urgently needs considerable research attention. In this paper, we propose a novel subspace-based QBIVR framework to enable efficient video search. We first define a new geometry-preserving distance metric to measure the image-to-video distance, which transforms the QBIVR task to be the Maximum Inner Product Search (MIPS) problem. The merit of this distance metric lies in that it helps to preserve the genuine geometric relationship between query images and database videos to the greatest extent. To boost the efficiency of solving the MIPS problem, we introduce two asymmetric hashing schemes which can bridge the domain gap of images and videos properly. The first approach, termed Inner-product Binary Coding (IBC), achieves high-quality binary codes by learning the binary codes and coding functions simultaneously without continuous relaxations. The other one, Bilinear Binary Coding (BBC) approach, employs compact bilinear projections instead of a single large projection matrix to further improve the retrieval efficiency. Extensive experiments on four real-world video datasets verify the effectiveness of our proposed approaches, as compared to the state-of-the-art methods."
FRACTaL: FEC-based Rate Control for RTP,"We propose a new rate control algorithm for interactive real-time multimedia traffic, the FRACTaL algorithm. In our approach, the endpoint sends Forward Error Correction (FEC) packets not only for better error-resilience but also to probe for available bandwidth. The sender varies the amount of FEC to meet the sending rate calculated by the congestion control without changing the media rate. We evaluate our proposal in an emulated networking environment, using a set of reference test scenarios and compare it to the SCReAM congestion control algorithm. We find that FRACTaL performs better than SCReAM when competing with TCP flows, i.e., it is able to obtain its ""fair"" share. In other (non-TCP) scenarios, it achieves lower loss rates at comparable path utilization and queuing delay, i.e., FRACTaL delivers better and consistent media quality."
When Cloud Meets Uncertain Crowd: An Auction Approach for Crowdsourced Livecast Transcoding,"In the emerging crowd sourced live cast services, numerous amateur broadcasters live stream their video contents to worldwide viewers and constantly interact with them through chat messages. Live video contents are transcoded into multiple quality versions to better service viewers with different network and device configurations. Cloud computing becomes a natural choice to handle these computational intensive tasks due to its elasticity and the ""pay-as-you-go"" billing model. However, given the significantly large number of concurrent channel numbers and the diverse viewer geo-distributions in this new crowd sourced live cast service, even the cloud becomes significantly expensive to cover the whole community and inadequate in fulfilling the latency requirement. In this paper, after observing the abundant computational resources residing in end viewers, we propose a Cloud-Crowd collaborative system, C2, which combines end viewers with cloud to perform video transcoding in a cost-efficient way. To quantify the heterogeneity and uncertainty of viewers and pass the asymmetric information barrier, we incorporate statistical descriptions into our bidding language and design truthful auctions to recruit stable viewers with appropriate incentives. We further tailor redundancy strategies for workloads with different Quality of Service requirements to improve the stability of our system. Desirable economic properties, like social efficiency, ex-post incentive compatibility, individual rationality, are proved to be guaranteed in our studied scenarios. Using traces captured from the popular Twitch platform, we show that C2 achieves up to 93% more cost saving than a pure cloud-based solution, and significantly outperforms other baseline approaches in both social welfare and system stability."
Multicamera Summarization of Rehabilitation Sessions in Home Environment,"In this paper we present a cyber-physiotherapy system (CyPhy) that brings daily rehabilitation to patient's home with supervision from trained therapist. CyPhy is able to capture and record RGB-D, skeleton, and physiotherapy-related medical sensing data streams from patient's exercises using multiple cameras and body sensors. With hours of exercises from every patient, that are captured every day from multiple cameras, therapists spend huge amount of their time watching videos to monitor the correctness of patients' moves. This becomes even more challenging in the presence of multiple cameras where the therapist might not know which camera stream shows the incorrect motion. In this paper, we explore the multicamera summarization problem from various aspects: (1) We first explore the types of exercises that benefit the most from using multiple cameras; (2) We propose a method to detect incorrect motion from multiple cameras in rehabilitation exercises; (3) We show how the analysis of incorrect motion is used to summarize the video and recommend the camera view that best visualizes the mistake. Our method for detecting incorrect motion achieves more than 92% accuracy at wide range of thresholds with significant improvement of 20% over single camera and 10% over the closest approach that uses multiple cameras."
Visualization of Stone Trajectories in Live Curling Broadcasts using Online Machine Learning,"We developed a system for visualizing stone trajectories in curling games for live broadcasts. Robustly tracking a moving stone from curling video sequences is difficult because the stone is frequently hidden by the brushes held by the players and the players' bodies during their sweeping actions. Although a number of methods for visual object tracking have been proposed, real-time tracking under heavy occlusion is still a challenging task. We thus propose an online machine learning method for tracking a curling stone to deal with changes in its appearance. The method creates a candidate-object image, which eliminates background noises, and is used as input to the kernelized correlation filter (KCF) tracker. Coordinate transformation is also applied to the system to improve its operability. Experimental results showed that our stone tracker is more accurate and faster than other conventional tracking methods. The developed system was used at All Japan Curling Championships 2017 to display stone trajectories during live broadcasts."
Deep Binary Reconstruction for Cross-modal Hashing,"With the increasing demand of massive multimodal data storage and organization, cross-modal retrieval based on hashing technique has drawn much attention nowadays. It takes the binary codes of one modality as the query to retrieve the relevant hashing codes of another modality. However, the existing binary constraint makes it difficult to find the optimal cross-modal hashing function. Most approaches choose to relax the constraint and perform thresholding strategy on the real-value representation instead of directly solving the original objective. In this paper, we first provide a concrete analysis about the effectiveness of multimodal networks in preserving the inter- and intra-modal consistency. Based on the analysis, we provide a so-called Deep Binary Reconstruction (DBRC) network that can directly learn the binary hashing codes in an unsupervised fashion. The superiority comes from a proposed simple but efficient activation function, named as Adaptive Tanh (ATanh). The ATanh function can adaptively learn the binary codes and be trained via back-propagation. Extensive experiments on three benchmark datasets demonstrate that DBRC outperforms several state-of-the-art methods in both image2text and text2image retrieval task."
Semi-Dense Depth Interpolation using Deep Convolutional Neural Networks,"With advances of recent technologies, augmented reality systems and autonomous vehicles gained a lot of interest from academics and industry. Both these areas rely on scene geometry understanding, which usually requires depth map estimation. However, in case of systems with limited computational resources, such as smartphones or autonomous robots, high resolution dense depth map estimation may be challenging. In this paper, we study the problem of semi-dense depth map interpolation along with low resolution depth map upsampling. We present an end-to-end learnable residual convolutional neural network architecture that achieves fast interpolation of semi-dense depth maps with different sparse depth distributions: uniform, sparse grid and along intensity image gradient. We also propose a loss function combining classical mean squared error with perceptual loss widely used in intensity image super-resolution and style transfer tasks. We show that with some modifications, this architecture can be used for depth map super-resolution. Finally, we evaluate our results on both synthetic and real data, and consider applications for autonomous vehicles and creating AR/MR video games."
Venues in Social Media: Examining Ambiance Perception Through Scene Semantics,"We address the question of what visual cues, including scene objects and demographic attributes, contribute to the automatic inference of perceived ambiance in social media venues. We first use a state-of-art, deep scene semantic parsing method and a face attribute extractor to understand how different cues present in a scene relate to human perception of ambiance on Foursquare images of social venues. We then analyze correlational links between visual cues and thirteen ambiance variables, as well as the ability of the semantic attributes to automatically infer place ambiance. We study the effect of the type and amount of image data used for learning, and compare regression results to previous work, showing that the proposed approach results in marginal-to-moderate performance increase for up to ten of the ambiance dimensions, depending on the corpus."
Moving as a Leader: Detecting Emergent Leadership in Small Groups using Body Pose,"Detecting leadership while understanding the underlying behavior is an important research topic particularly for social and organizational psychology, and has started to get attention from social signal processing research community as well. It is known that, visual activity is a useful cue to investigate the social interactions, even though previously applied nonverbal features based on head/body actions were not performing well enough for identification of emergent leaders (ELs) in small group meetings. Starting from these premises, in this study, we propose an effective method that uses 2D body pose based nonverbal features to represent the visual activity of a person. Our results suggest that, i) overall, the proposed nonverbal features derived from body pose perform better than existing visual activity based features, ii) it is possible to improve classification results by applying unsupervised feature learning as a preprocessing step, and iii) the proposed nonverbal features are able to advance the EL identification performances of other types of nonverbal features when they are used together."
#VisualHashtags: Visual Summarization of Social Media Events Using Mid-Level Visual Elements,"The data generated on social media sites continues to grow at an increasing rate with more than 36% of tweets containing images making the dominance of multimedia content evidently visible. This massive user generated content has become a reflection of world events. In order to enhance the ability and effectiveness to consume this plethora of data, summarization of these events is needed. However, very few studies have exploited the images attached with social media events to summarize them using ""mid-level visual elements"". These are the entities which are both representative and discriminative to the target dataset besides being human-readable and hence more informative."
