Multi-scale Context Based Attention for Dynamic Music Emotion Prediction,"Dynamic music emotion prediction is to recognize the continuous emotion information in music, which is necessary for music retrieval and recommendation. In this paper, we adopt the dimensional valence-arousal (V-A) emotion model to represent the dynamic emotion in music. In our opinion, music and V-A emotion label do not have the one-to-one correspondence in the time domain, while the expression of music emotion at one moment is the accumulation of previous music content for a period of time, so we propose Long Short-Term Memory (LSTM) based sequence-to-one mapping for dynamic music emotion prediction. Based on this sequence-to-one music emotion mapping, it is proved that different time scales' preceding content has an influence on the LSTM model's performance, so we further propose the Multi-scale Context based Attention (MCA) for dynamic music emotion prediction. We evaluate our proposed method on the database of Emotion in Music task at MediaEval 2015, and the results show that our proposed method outperforms most of the models using the same features and achieves a competitive performance with the state-of-the-art methods."
A Simplified Topological Representation of Text for Local and Global Context,"Topological data analysis (TDA) is a branch of mathematics that analyzes the shape of high-dimensional data sets using geometry and algebra. TDA is used for data visualization which represents the relationship among elements using a network. Traditionally, TDA is quadratic in complexity and not commonly used for natural language processing. In this research, we visualize the relationship among words in a text block, words in a corpus and text blocks in a corpus. Text block represents a unit of a corpus such as, a web page in a web corpus, a chapter or section in a book corpus or a document in media corpus. This research proposes circular topology for representing words both for Local Context (LC) and Global Context (GC). Each text block is a set of sentences forming the LC. We found that feature words are extracted successfully from our LC analysis. The occurrence of extracted featured words in the corpus formed the GC. We evaluate this proposed simplified topological analysis on 3 different corpora: a single book corpus, a book corpus consisting of 7 books having 6020 narrations and a web corpus consisting of 990 web pages. The peripheral nature of the LC reduced the vocabulary size of the corpus significantly in O(nm) time where n is the number of text blocks and m is number of nouns in a sentence. GC analysis of featured words reflected useful properties of featured word movement which can be used to analyze topic evolution. GC analysis of text block points is aimed to find closely related text blocks in a radius. This reflected interesting results that need further supervised investigation. Research on topology driven natural language processing is in its infancy. This article contributes to this research field by introducing a method motivated by TDA to represent and visualize the peripheral nature of text block and corpus, by achieving success in dimensional reduction using local analysis and by simplifying the approach of complex topological analysis through localization."
Experimental Analysis of Bandwidth Allocation in Automated Video Surveillance Systems,"We consider the bandwidth allocation problem in automated video surveillance systems, in which a monitoring station analyzes the video streams captured and delivered wirelessly by multiple cameras. In contrast with prior studies, we provide a detailed experimental analysis of cross-layer optimization by developing a real system and conducting extensive experiments. In addition, we present an enhanced cross-layer optimization solution that allocates bandwidth to different cameras in a manner that optimizes the overall detection accuracy. The solution works with the popular HTTP streaming approach and includes a new online scheme for estimating the effective airtime of the network. The results show that the proposed solution significantly improves the detection accuracy."
Multimedia Semantic Integrity Assessment Using Joint Embedding Of Images And Text,"Real-world multimedia data is often composed of multiple modalities such as an image or a video with associated text (e.g., captions, user comments, etc.) and metadata. Such multimodal data packages are prone to manipulations, where a subset of these modalities can be altered to misrepresent or repurpose data packages, with possible malicious intent. It is therefore important to develop methods to assess or verify the integrity of these multimedia packages. Using computer vision and natural language processing methods to directly compare the image (or video) and the associated caption to verify the integrity of a media package is only possible for a limited set of objects and scenes. In this paper we present a novel deep-learning-based approach that uses a reference set of multimedia packages to assess the semantic integrity of multimedia packages containing images and captions. We construct a joint embedding of images and captions with deep multimodal representation learning on the reference dataset in a framework that also provides image-caption consistency scores (ICCSs). The integrity of query media packages is assessed as the inlierness of the query ICCSs with respect to the reference dataset. We present the MultimodAl Information Manipulation dataset (MAIM), a new dataset of media packages from Flickr, which we are making available to the research community. We use both the newly created dataset as well as Flickr30K and MS COCO datasets to quantitatively evaluate our proposed approach. The reference dataset does not contain unmanipulated versions of tampered query packages. Our method is able to achieve F-1 scores of 0.75, 0.89 and 0.94 on MAIM, Flickr30K and MS COCO, respectively, for detecting semantically incoherent media packages."
Real-Time False-Contours Removal for Inverse Tone Mapped HDR Content,"High Dynamic Ranges (HDR) displays can show images with higher color contrast levels and peak luminosities than the commonly used Low Dynamic Range (LDR) displays. Although HDR displays are still expensive, they are reaching the consumer market in the coming years. Unfortunately, most video content is recorded and/or graded in LDR format. Typically, dynamic range expansion by using an Inverse Tone Mapped Operator (iTMO) is required to show LDR content in HDR displays. The most common type of artifact derived from dynamic range expansion is false contouring, which negatively affects the overall image quality. In this paper, we propose a new fast iterative false-contour removal method for inverse tone mapped HDR content. We consider the false-contour removal as a signal reconstruction problem, and we solve it using an iterative Projection Onto Convex Sets (POCS) minimization algorithm. Unlike most other false-contour removal techniques, we define reconstruction constraints taking into account the iTMO used. Experimental results demonstrate the effectiveness of the proposed method to remove false contours while preserving details in the image. In order speed-up the execution time, the proposed method was implemented to run on a GPU. We were able to show that it can be used to remove false contours in real-time from an inverse tone mapped High-definition HDR video sequences at 24 fps."
Deep Matching and Validation Network: An End-to-End Solution to Constrained Image Splicing Localization and Detection,"Image splicing is a very common image manipulation technique that is sometimes used for malicious purposes. A splicing detection and localization algorithm usually takes an input image and produces a binary decision indicating whether the input image has been manipulated, and also a segmentation mask that corresponds to the spliced region. Most existing splicing detection and localization pipelines suffer from two main shortcomings: 1) they use handcrafted features that are not robust against subsequent processing (e.g., compression), and 2) each stage of the pipeline is usually optimized independently. In this paper we extend the formulation of the underlying splicing problem to consider two input images, a query image and a potential donor image. Here the task is to estimate the probability that the donor image has been used to splice the query image, and obtain the splicing masks for both the query and donor images. We introduce a novel deep convolutional neural network architecture, called Deep Matching and Validation Network (DMVN), which simultaneously localizes and detects image splicing. The proposed approach does not depend on handcrafted features and uses raw input images to create deep learned representations. Furthermore, the DMVN is end-to-end optimized to produce the probability estimates and the segmentation masks. Our extensive experiments demonstrate that this approach outperforms state-of-the-art splicing detection methods by a large margin in terms of both AUC score and speed."
