Deep Spatio-Temporal Neural Networks for Click-Through Rate Prediction,"Click-through rate (CTR) prediction is a critical task in online advertising systems. A large body of research considers each ad independently, but ignores its relationship to other ads that may impact the CTR. In this paper, we investigate various types of auxiliary ads for improving the CTR prediction of the target ad. In particular, we explore auxiliary ads from two viewpoints: one is from the spatial domain, where we consider the contextual ads shown above the target ad on the same page; the other is from the temporal domain, where we consider historically clicked and unclicked ads of the user. The intuitions are that ads shown together may influence each other, clicked ads reflect a user's preferences, and unclicked ads may indicate what a user dislikes to certain extent. In order to effectively utilize these auxiliary data, we propose the Deep Spatio-Temporal neural Networks (DSTNs) for CTR prediction. Our model is able to learn the interactions between each type of auxiliary data and the target ad, to emphasize more important hidden information, and to fuse heterogeneous data in a unified framework. Offline experiments on one public dataset and two industrial datasets show that DSTNs outperform several state-of-the-art methods for CTR prediction. We have deployed the best-performing DSTN in Shenma Search, which is the second largest search engine in China. The A/B test results show that the online CTR is also significantly improved compared to our last serving model."
Deep Uncertainty Quantification: A Machine Learning Approach for Weather Forecasting,"Weather forecasting is usually solved through numerical weather prediction (NWP), which can sometimes lead to unsatisfactory performance due to inappropriate setting of the initial states. In this paper, we design a data-driven method augmented by an effective information fusion mechanism to learn from historical data that incorporates prior knowledge from NWP. We cast the weather forecasting problem as an end-to-end deep learning problem and solve it by proposing a novel negative log-likelihood error (NLE) loss function. A notable advantage of our proposed method is that it simultaneously implements single-value forecasting and uncertainty quantification, which we refer to as deep uncertainty quantification (DUQ). Efficient deep ensemble strategies are also explored to further improve performance. This new approach was evaluated on a public dataset collected from weather stations in Beijing, China. Experimental results demonstrate that the proposed NLE loss significantly improves generalization compared to mean squared error (MSE) loss and mean absolute error (MAE) loss. Compared with NWP, this approach significantly improves accuracy by 47.76%, which is a state-of-the-art result on this benchmark dataset."
DeepHoops: Evaluating Micro-Actions in Basketball Using Deep Feature Representations of Spatio-Temporal Data,"Basketball is one of a number of sports which, within the past decade, have seen an explosion in quantitative metrics and methods for evaluating players and teams. However, it is still challenging to evaluate individual off-ball events (e.g., screens, cuts away from the ball etc.) in terms of how they contribute to the success of a possession. In this study, we develop a deep learning framework DeepHoops to process a unique dataset composed of spatio-temporal tracking data from NBA games in order to generate a running stream of predictions on the expected points to be scored as a possession progresses. We frame the problem as a multi-class sequence classification problem in which our model estimates probabilities of terminal actions taken by players (e.g. take field goal, turnover, foul etc.) at each moment of a possession based on a sequence of ball and player court locations preceding the said moment. Each of these terminal actions is associated with an expected point value, which is used to estimate the expected points to be scored. One of the challenges associated with this problem is the high imbalance in the action classes. To solve this problem, we parameterize a downsampling scheme for the training phase. We demonstrate that DeepHoops is well-calibrated, estimating accurately the probabilities of each terminal action and we further showcase the model's capability to evaluate individual actions (potentially off-ball) within a possession that are not captured by boxscore statistics."
DeepRoof: A Data-driven Approach For Solar Potential Estimation Using Rooftop Imagery,"Rooftop solar deployments are an excellent source for generating clean energy. As a result, their popularity among homeowners has grown significantly over the years. Unfortunately, estimating the solar potential of a roof requires homeowners to consult solar consultants, who manually evaluate the site. Recently there have been efforts to automatically estimate the solar potential for any roof within a city. However, current methods work only for places where LIDAR data is available, thereby limiting their reach to just a few places in the world. In this paper, we propose DeepRoof, a data-driven approach that uses widely available satellite images to assess the solar potential of a roof. Using satellite images, DeepRoof determines the roof's geometry and leverages publicly available real-estate and solar irradiance data to provide a pixel-level estimate of the solar potential for each planar roof segment. Such estimates can be used to identify ideal locations on the roof for installing solar panels. Further, we evaluate our approach on an annotated roof dataset, validate the results with solar experts and compare it to a LIDAR-based approach. Our results show that DeepRoof can accurately extract the roof geometry such as the planar roof segments and their orientation, achieving a true positive rate of 91.1% in identifying roofs and a low mean orientation error of 9.3 degree. We also show that DeepRoof's median estimate of the available solar installation area is within 11% of a LIDAR-based approach."
DeepUrbanEvent: A System for Predicting Citywide Crowd Dynamics at Big Events,"Event crowd management has been a significant research topic with high social impact. When some big events happen such as an earthquake, typhoon, and national festival, crowd management becomes the first priority for governments (e.g. police) and public service operators (e.g. subway/bus operator) to protect people's safety or maintain the operation of public infrastructures. However, under such event situations, human behavior will become very different from daily routines, which makes prediction of crowd dynamics at big events become highly challenging, especially at a citywide level. Therefore in this study, we aim to extract the deep trend only from the current momentary observations and generate an accurate prediction for the trend in the short future, which is considered to be an effective way to deal with the event situations. Motivated by these, we build an online system called DeepUrbanEvent which can iteratively take citywide crowd dynamics from the current one hour as input and report the prediction results for the next one hour as output. A novel deep learning architecture built with recurrent neural networks is designed to effectively model these highly-complex sequential data in an analogous manner to video prediction tasks. Experimental results demonstrate the superior performance of our proposed methodology to the existing approaches. Lastly, we apply our prototype system to multiple big real-world events and show that it is highly deployable as an online crowd management system."
Detecting Anomalies in Space using Multivariate Convolutional LSTM with Mixtures of Probabilistic PCA,"Detecting an anomaly is not only important for many terrestrial applications on Earth but also for space applications. Especially, satellite missions are highly risky because unexpected hardware and software failures can occur due to sudden or unforeseen space environment changes. Anomaly detection and spacecraft health monitoring systems have heavily relied on human expertise to investigate whether they are a true anomaly or not. Also, it is practically infeasible to produce labels on data due to the enormous amount of telemetries generated from a satellite. In this work, we propose a data-driven anomaly detection algorithm for Korea Multi-Purpose Satellite 2 (KOMPSAT-2). We develop a Multivariate Convolution LSTM with Mixtures of Probabilistic Principal Component Analyzers, where our approach uses both neural networks and probabilistic clustering to improve the anomaly detection performance. We evaluated our approach with a total of 22 million telemetry samples collected for 10 months from KOMPSAT-2. We also compare our approach with other state-of-the-art approaches. We show that our proposed approach is 35.8% better in precision, and 18.2% better in F-1 score than the best baseline approach. We plan to deploy our algorithm in the second half of 2019 to actually apply real operation of KOMPSAT-2."
Detection of Review Abuse via Semi-Supervised Binary Multi-Target Tensor Decomposition,"Product reviews and ratings on e-commerce websites provide customers with detailed insights about various aspects of the product such as quality, usefulness, etc. Since they influence customers' buying decisions, product reviews have become a fertile ground for abuse by sellers (colluding with reviewers) to promote their own products or to tarnish the reputation of competitor's products. In this paper, our focus is on detecting such abusive entities (both sellers and reviewers) by applying tensor decomposition on the product reviews data. While tensor decomposition is mostly unsupervised, we formulate our problem as a semi-supervised binary multi-target tensor decomposition, to take advantage of currently known abusive entities. We empirically show that our multi-target semi-supervised model achieves higher precision and recall in detecting abusive entities as compared to unsupervised techniques. Finally, we show that our proposed stochastic partial natural gradient inference for our model empirically achieves faster convergence than stochastic gradient and Online-EM with sufficient statistics."
Developing Measures of Cognitive Impairment in the Real World from Consumer-Grade Multimodal Sensor Streams,"The ubiquity and remarkable technological progress of wearable consumer devices and mobile-computing platforms (smart phone, smart watch, tablet), along with the multitude of sensor modalities available, have enabled continuous monitoring of patients and their daily activities. Such rich, longitudinal information can be mined for physiological and behavioral signatures of cognitive impairment and provide new avenues for detecting MCI in a timely and cost-effective manner. In this work, we present a platform for remote and unobtrusive monitoring of symptoms related to cognitive impairment using several consumer-grade smart devices. We demonstrate how the platform has been used to collect a total of 16TB of data during the Lilly Exploratory Digital Assessment Study, a 12-week feasibility study which monitored 31 people with cognitive impairment and 82 without cognitive impairment in free living conditions. We describe how careful data unification, time-alignment, and imputation techniques can handle missing data rates inherent in real-world settings and ultimately show utility of these disparate data in differentiating symptomatics from healthy controls based on features computed purely from device data."
Diagnosing Sample Ratio Mismatch in Online Controlled Experiments: A Taxonomy and Rules of Thumb for Practitioners,"Accurately learning what delivers value to customers is difficult. Online Controlled Experiments (OCEs), aka A/B tests, are becoming a standard operating procedure in software companies to address this challenge as they can detect small causal changes in user behavior due to product modifications (e.g. new features). However, like any data analysis method, OCEs are sensitive to trustworthiness and data quality issues which, if go unaddressed or unnoticed, may result in making wrong decisions. One of the most useful indicators of a variety of data quality issues is a Sample Ratio Mismatch (SRM) ? the situation when the observed sample ratio in the experiment is different from the expected. Just like fever is a symptom for multiple types of illness, an SRM is a symptom for a variety of data quality issues. While a simple statistical check is used to detect an SRM, correctly identifying the root cause and preventing it from happening in the future is often extremely challenging and time consuming. Ignoring the SRM without knowing the root cause may result in a bad product modification appearing to be good and getting shipped to users, or vice versa. The goal of this paper is to make diagnosing, fixing, and preventing SRMs easier. Based on our experience of running OCEs in four different software companies in over 25 different products used by hundreds of millions of users worldwide, we have derived a taxonomy for different types of SRMs. We share examples, detection guidelines, and best practices for preventing SRMs of each type. We hope that the lessons and practical tips we describe in this paper will speed up SRM investigations and prevent some of them. Ultimately, this should lead to improved decision making based on trustworthy experiment analysis."
DuerQuiz: A Personalized Question Recommender System for Intelligent Job Interview,"In talent recruitment, the job interview aims at selecting the right candidates for the right jobs through assessing their skills and experiences in relation to the job positions. While tremendous efforts have been made in improving job interviews, a long-standing challenge is how to design appropriate interview questions for comprehensively assessing the competencies that may be deemed relevant and representative for person-job fit. To this end, in this research, we focus on the development of a personalized question recommender system, namely DuerQuiz, for enhancing the job interview assessment. DuerQuiz is a fully deployed system, in which a knowledge graph of job skills, Skill-Graph, has been built for comprehensively modeling the relevant competencies that should be assessed in the job interview. Specifically, we first develop a novel skill entity extraction approach based on a bidirectional Long Short-Term Memory (LSTM) with a Conditional Random Field (CRF) layer (LSTM-CRF) neural network enhanced with adapted gate mechanism. In particular, to improve the reliability of extracted skill entities, we design a label propagation method based on more than 10 billion click-through data from the large-scale Baidu query logs. Furthermore, we discover the hypernym-hyponym relations between skill entities and construct the Skill-Graph by leveraging the classifier trained with extensive contextual features. Finally, we design a personalized question recommendation algorithm based on the Skill-Graph for improving the efficiency and effectiveness of job interview assessment. Extensive experiments on real-world recruitment data clearly validate the effectiveness of DuerQuiz, which had been deployed for generating written exercises in the 2018 Baidu campus recruitment event and received remarkable performances in terms of efficiency and effectiveness for selecting outstanding talents compared with a traditional non-personalized human-only assessment approach."
Dynamic Pricing for Airline Ancillaries with Customer Context,"Ancillaries have become a major source of revenue and profitability in the travel industry. Yet, conventional pricing strategies are based on business rules that are poorly optimized and do not respond to changing market conditions. This paper describes the dynamic pricing model developed by Deepair solutions, an AI technology provider for travel suppliers. We present a pricing model that provides dynamic pricing recommendations specific to each customer interaction and optimizes expected revenue per customer. The unique nature of personalized pricing provides the opportunity to search over the market space to find the optimal price-point of each ancillary for each customer, without violating customer privacy.In this paper, we present and compare three approaches for dynamic pricing of ancillaries, with increasing levels of sophistication: (1) a two-stage forecasting and optimization model using a logistic mapping function; (2) a two-stage model that uses a deep neural network for forecasting, coupled with a revenue maximization technique using discrete exhaustive search; (3) a single-stage end-to-end deep neural network that recommends the optimal price. We describe the performance of these models based on both offline and online evaluations. We also measure the real-world business impact of these approaches by deploying them in an A/B test on an airline's internet booking website. We show that traditional machine learning techniques outperform human rule-based approaches in an online setting by improving conversion by 36% and revenue per offer by 10%. We also provide results for our offline experiments which show that deep learning algorithms outperform traditional machine learning techniques for this problem. Our end-to-end deep learning model is currently being deployed by the airline in their booking system."
E.T.-RNN: Applying Deep Learning to Credit Loan Applications,"In this paper we present a novel approach to credit scoring of retail customers in the banking industry based on deep learning methods. We used RNNs on fine grained transnational data to compute credit scores for the loan applicants. We demonstrate that our approach significantly outperforms the baselines based on the customer data of a large European bank. We also conducted a pilot study on loan applicants of the bank, and the study produced significant financial gains for the organization. In addition, our method has several other advantages described in the paper that are very significant for the bank."
Enabling Onboard Detection of Events of Scientific Interest for the Europa Clipper Spacecraft,"Data analysis and machine learning methods have great potential to aid in planetary exploration. Spacecraft often operate at great distances from the Earth, and the ability to autonomously detect features of interest onboard can enable content-sensitive downlink prioritization to increase mission science return. We describe algorithms that we designed to assist in three specific scientific investigations to be conducted during flybys of Jupiter's moon Europa: the detection of thermal anomalies, compositional anomalies, and plumes of icy matter from Europa's subsurface ocean. We also share the unique constraints imposed by the onboard computing environment and several lessons learned in our collaboration with planetary scientists and mission designers."
Estimating Cellular Goals from High-Dimensional Biological Data,"Optimization-based models have been used to predict cellular behavior for over 25 years. The constraints in these models are derived from genome annotations, measured macromolecular composition of cells, and by measuring the cell's growth rate and metabolism in different conditions. The cellular goal (the optimization problem that the cell is trying to solve) can be challenging to derive experimentally for many organisms, including human or mammalian cells, which have complex metabolic capabilities and are not well understood. Existing approaches to learning goals from data include (a) estimating a linear objective function, or (b) estimating linear constraints that model complex biochemical reactions and constrain the cell's operation. The latter approach is important because often the known reactions are not enough to explain observations; therefore, there is a need to extend automatically the model complexity by learning new reactions. However, this leads to nonconvex optimization problems, and existing tools cannot scale to realistically large metabolic models. Hence, constraint estimation is still used sparingly despite its benefits for modeling cell metabolism, which is important for developing novel antimicrobials against pathogens, discovering cancer drug targets, and producing value-added chemicals. Here, we develop the first approach to estimating constraint reactions from data that can scale to realistically large metabolic models. Previous tools were used on problems having less than 75 reactions and 60 metabolites, which limits real-life-size applications. We perform extensive experiments using 75 large-scale metabolic network models for different organisms (including bacteria, yeasts, and mammals) and show that our algorithm can recover cellular constraint reactions. The recovered constraints enable accurate prediction of metabolic states in hundreds of growth environments not seen in training data, and we recover useful cellular goals even when some measurements are missing."
Fairness in Recommendation Ranking through Pairwise Comparisons,"Recommender systems are one of the most pervasive applications of machine learning in industry, with many services using them to match users to products or information. As such it is important to ask: what are the possible fairness risks, how can we quantify them, and how should we address them? In this paper we offer a set of novel metrics for evaluating algorithmic fairness concerns in recommender systems. In particular we show how measuring fairness based on pairwise comparisons from randomized experiments provides a tractable means to reason about fairness in rankings from recommender systems. Building on this metric, we offer a new regularizer to encourage improving this metric during model training and thus improve fairness in the resulting rankings. We apply this pairwise regularization to a large-scale, production recommender system and show that we are able to significantly improve the system's pairwise fairness."
Fairness-Aware Ranking in Search & Recommendation Systems with Application to LinkedIn Talent Search,"We present a framework for quantifying and mitigating algorithmic bias in mechanisms designed for ranking individuals, typically used as part of web-scale search and recommendation systems. We first propose complementary measures to quantify bias with respect to protected attributes such as gender and age. We then present algorithms for computing fairness-aware re-ranking of results. For a given search or recommendation task, our algorithms seek to achieve a desired distribution of top ranked results with respect to one or more protected attributes. We show that such a framework can be tailored to achieve fairness criteria such as equality of opportunity and demographic parity depending on the choice of the desired distribution. We evaluate the proposed algorithms via extensive simulations over different parameter choices, and study the effect of fairness-aware ranking on both bias and utility measures. We finally present the online A/B testing results from applying our framework towards representative ranking in LinkedIn Talent Search, and discuss the lessons learned in practice. Our approach resulted in tremendous improvement in the fairness metrics (nearly three fold increase in the number of search queries with representative results) without affecting the business metrics, which paved the way for deployment to 100% of LinkedIn Recruiter users worldwide. Ours is the first large-scale deployed framework for ensuring fairness in the hiring domain, with the potential positive impact for more than 630M LinkedIn members."
FDML: A Collaborative Machine Learning Framework for Distributed Features,"Most current distributed machine learning systems try to scale up model training by using a data-parallel architecture that divides the computation for different samples among workers. We study distributed machine learning from a different motivation, where the information about the same samples, e.g., users and objects, are owned by several parities that wish to collaborate but do not want to share raw data with each other.We propose an asynchronous stochastic gradient descent (SGD) algorithm for such a feature distributed machine learning (FDML) problem, to jointly learn from distributed features, with theoretical convergence guarantees under bounded asynchrony. Our algorithm does not require sharing the original features or even local model parameters between parties, thus preserving the data locality. The system can also easily incorporate differential privacy mechanisms to preserve a higher level of privacy. We implement the FDML system in a parameter server architecture and compare our system with fully centralized learning (which violates data locality) and learning based on only local features, through extensive experiments performed on both a public data set a9a, and a large dataset of 5,000,000 records and 8700 decentralized features from three collaborating apps at Tencent including Tencent MyApp, Tecent QQ Browser and Tencent Mobile Safeguard. Experimental results have demonstrated that the proposed FDML system can be used to significantly enhance app recommendation in Tencent MyApp by leveraging user and item features from other apps, while preserving the locality and privacy of features in each individual app to a high degree."
