Large-scale User Visits Understanding and Forecasting with Deep Spatial-Temporal Tensor Factorization Framework,"Understanding and forecasting user visits is of great importance for a variety of tasks, e.g., online advertising, which is one of the most profitable business models for Internet services. Publishers sell advertising spaces in advance with user visit volume and attributes guarantees. There are usually tens of thousands of attribute combinations in an online advertising system. The key problem is how to accurately forecast the number of user visits for each attribute combination. Many traditional work characterizing temporal trends of every single time series are quite inefficient for large-scale time series. Recently, a number of models based on deep learning or matrix factorization have been proposed for high-dimensional time series forecasting. However, most of them neglect correlations among attribute combinations, or are tailored for specific applications, resulting in poor adaptability for different business scenarios.Besides, sophisticated deep learning models usually cause high time and space complexity. There is still a lack of an efficient highly scalable and adaptable solution for accurate high-dimensional time series forecasting. To address this issue, in this work, we conduct a thorough analysis on large-scale user visits data and propose a novel deep spatial-temporal tensor factorization framework, which provides a general design for high-dimensional time series forecasting. We deployed the proposed framework in Tencent online guaranteed delivery advertising system, and extensively evaluated the effectiveness and efficiency of the framework in two different large-scale application scenarios. The results show that our framework outperforms existing methods in prediction accuracy. Meanwhile, it significantly reduces the parameter number and is resistant to incomplete data with up to 20% missing values."
Learning a Unified Embedding for Visual Search at Pinterest,"At Pinterest, we utilize image embeddings throughout our search and recommendation systems to help our users navigate through visual content by powering experiences like browsing of related content and searching for exact products for shopping. In this work we describe a multi-task deep metric learning system to learn a single unified image embedding which can be used to power our multiple visual search products. The solution we present not only allows us to train for multiple application objectives in a single deep neural network architecture, but takes advantage of correlated information in the combination of all training data from each application to generate a unified embedding that outperforms all specialized embeddings previously deployed for each product.We discuss the challenges of handling images from different domains such as camera photos, high quality web images, and clean product catalog images. We also detail how to jointly train for multiple product objectives and how to leverage both engagement data and human labeled data. In addition, our trained embeddings can also be binarized for efficient storage and retrieval without compromising precision and recall. Through comprehensive evaluations on offline metrics, user studies, and online A/B experiments, we demonstrate that our proposed unified embedding improves both relevance and engagement of our visual search products for both browsing and searching purposes when compared to existing specialized embeddings. Finally, the deployment of the unified embedding at Pinterest has drastically reduced the operation and engineering cost of maintaining multiple embeddings while improving quality."
Learning Sleep Quality from Daily Logs,"Precision psychiatry is a new research field that uses advanced data mining over a wide range of neural, behavioral, psychological, and physiological data sources for classification of mental health conditions. This study presents a computational framework for predicting sleep efficiency of insomnia sufferers. A smart band experiment is conducted to collect heterogeneous data, including sleep records, daily activities, and demographics, whose missing values are imputed via Improved Generative Adversarial Imputation Networks (Imp-GAIN). Equipped with the imputed data, we predict sleep efficiency of individual users with a proposed interpretable LSTM-Attention (LA Block) neural network model. We also propose a model, Pairwise Learning-based Ranking Generation (PLRG), to rank users with high insomnia potential in the next day. We discuss implications of our findings from the perspective of a psychiatric practitioner. Our computational framework can be used for other applications that analyze and handle noisy and incomplete time-series human activity data in the domain of precision psychiatry."
Learning to Prescribe Interventions for Tuberculosis Patients Using Digital Adherence Data,"Digital Adherence Technologies (DATs) are an increasingly popular method for verifying patient adherence to many medications. We analyze data from one city served by 99DOTS, a phone-call-based DAT deployed for Tuberculosis (TB) treatment in India where nearly 3 million people are afflicted with the disease each year. The data contains nearly 17,000 patients and 2.1M dose records. We lay the groundwork for learning from this real-world data, including a method for avoiding the effects of unobserved interventions in training data used for machine learning. We then construct a deep learning model, demonstrate its interpretability, and show how it can be adapted and trained in three different clinical scenarios to better target and improve patient care. In the real-time risk prediction setting our model could be used to proactively intervene with 21% more patients and before 76% more missed doses than current heuristic baselines. For outcome prediction, our model performs 40% better than baseline methods, allowing cities to target more resources to clinics with a heavier burden of patients at risk of failure. Finally, we present a case study demonstrating how our model can be trained in an end-to-end decision focused learning setting to achieve 15% better solution quality in an example decision problem faced by health workers."
LightNet: A Dual Spatiotemporal Encoder Network Model for Lightning Prediction,"Lightning as a natural phenomenon poses serious threats to human life, aviation and electrical infrastructures. Lightning prediction plays a vital role in lightning disaster reduction. Existing prediction methods, usually based on numerical weather models, rely on lightning parameterization schemes for forecasting. These methods, however, have two drawbacks. Firstly, simulations of the numerical weather models usually have deviations in space and time domains, which introduces irreparable biases to subsequent parameterization processes. Secondly, the lightning parameterization schemes are designed manually by experts in meteorology, which means these schemes can hardly benefit from abundant historical data. In this work, we propose a data-driven model based on neural networks, referred to as LightNet, for lightning prediction. Unlike the conventional prediction methods which are fully based on numerical weather models, LightNet introduces recent lightning observations in an attempt to calibrate the simulations and assist the prediction. LightNet first extracts spatiotemporal features of the simulations and observations via dual encoders. These features are then combined by a fusion module. Finally, the fused features are fed into a spatiotemporal decoder to make forecasts. We conduct experimental evaluations on a real-world North China lightning dataset, which shows that LightNet achieves a threefold improvement in equitable threat score for six-hour prediction compared with three established forecast methods."
Machine Learning at Microsoft with ML.NET,"Machine Learning is transitioning from an art and science into a technology available to every developer. In the near future, every application on every platform will incorporate trained models to encode data-based decisions that would be impossible for developers to author. This presents a significant engineering challenge, since currently data science and modeling are largely decoupled from standard software development processes. This separation makes incorporating machine learning capabilities inside applications unnecessarily costly and difficult, and furthermore discourage developers from embracing ML in first place. In this paper we present ML.NET, a framework developed at Microsoft over the last decade in response to the challenge of making it easy to ship machine learning models in large software applications. We present its architecture, and illuminate the application demands that shaped it. Specifically, we introduce DataView, the core data abstraction of ML.NET which allows it to capture full predictive pipelines efficiently and consistently across training and inference lifecycles. We close the paper with a surprisingly favorable performance study of ML.NET compared to more recent entrants, and a discussion of some lessons learned."
Mathematical Notions vs. Human Perception of Fairness: A Descriptive Approach to Fairness for Machine Learning,"Fairness for Machine Learning has received considerable attention, recently. Various mathematical formulations of fairness have been proposed, and it has been shown that it is impossible to satisfy all of them simultaneously. The literature so far has dealt with these impossibility results by quantifying the tradeoffs between different formulations of fairness. Our work takes a different perspective on this issue. Rather than requiring all notions of fairness to (partially) hold at the same time, we ask which one of them is the most appropriate given the societal domain in which the decision-making model is to be deployed. We take a descriptive approach and set out to identify the notion of fairness that best captures lay people's perception of fairness. We run adaptive experiments designed to pinpoint the most compatible notion of fairness with each participant's choices through a small number of tests. Perhaps surprisingly, we find that the most simplistic mathematical definition of fairness---namely, demographic parity---most closely matches people's idea of fairness in two distinct application scenarios. This conclusion remains intact even when we explicitly tell the participants about the alternative, more complicated definitions of fairness, and we reduce the cognitive burden of evaluating those notions for them. Our findings have important implications for the Fair ML literature and the discourse on formalizing algorithmic fairness."
MediaRank: Computational Ranking of Online News Sources,"In the recent political climate, the topic of news quality has drawn attention both from the public and the academic communities. The growing distrust of traditional news media makes it harder to find a common base of accepted truth. In this work, we design and build MediaRank (urlwww.media-rank.com ), a fully automated system to rank over 50,000 online news sources around the world. MediaRank collects and analyzes one million news webpages and two million related tweets everyday. We base our algorithmic analysis on four properties journalists have established to be associated with reporting quality: peer reputation, reporting bias/breadth, bottomline financial pressure, and popularity. Our major contributions of this paper include: (i) Open, interpretable quality rankings for over 50,000 of the world's major news sources. Our rankings are validated against 35 published news rankings, including French, German, Russian, and Spanish language sources. MediaRank scores correlate positively with 34 of 35 of these expert rankings. (ii) New computational methods for measuring influence and bottomline pressure. To the best of our knowledge, we are the first to study the large-scale news reporting citation graph in-depth. We also propose new ways to measure the aggressiveness of advertisements and identify social bots, establishing a connection between both types of bad behavior. (iii) Analyzing the effect of media source bias and significance. We prove that news sources cite others despite different political views in accord with quality measures. However, in four English-speaking countries (US, UK, Canada, and Australia), the highest ranking sources all disproportionately favor left-wing parties, even when the majority of news sources exhibited conservative slants."
Metapath-guided Heterogeneous Graph Neural Network for Intent Recommendation,"With the prevalence of mobile e-commerce nowadays, a new type of recommendation services, called intent recommendation, is widely used in many mobile e-commerce Apps, such as Taobao and Amazon. Different from traditional query recommendation and item recommendation, intent recommendation is to automatically recommend user intent according to user historical behaviors without any input when users open the App. Intent recommendation becomes very popular in the past two years, because of revealing user latent intents and avoiding tedious input in mobile phones. Existing methods used in industry usually need laboring feature engineering. Moreover, they only utilize attribute and statistic information of users and queries, and fail to take full advantage of rich interaction information in intent recommendation, which may result in limited performances. In this paper, we propose to model the complex objects and rich interactions in intent recommendation as a Heterogeneous Information Network. Furthermore, we present a novel M etapath-guided E mbedding method for I ntent Rec ommendation~(called MEIRec). In order to fully utilize rich structural information, we design a metapath-guided heterogeneous Graph Neural Network to learn the embeddings of objects in intent recommendation. In addition, in order to alleviate huge learning parameters in embeddings, we propose a uniform term embedding mechanism, in which embeddings of objects are made up with the same term embedding space. Offline experiments on real large-scale data show the superior performance of the proposed MEIRec, compared to representative methods.Moreover, the results of online experiments on Taobao e-commerce platform show that MEIRec not only gains a performance improvement of 1.54% on CTR metric, but also attracts up to 2.66% of new users to search queries."
MetaPred: Meta-Learning for Clinical Risk Prediction with Limited Patient Electronic Health Records,"In recent years, large amounts of health data, such as patient Electronic Health Records (EHR), are becoming readily available. This provides an unprecedented opportunity for knowledge discovery and data mining algorithms to dig insights from them, which can, later on, be helpful to the improvement of the quality of care delivery. Predictive modeling of clinical risks, including in-hospital mortality, hospital readmission, chronic disease onset, condition exacerbation, etc., from patient EHR, is one of the health data analytic problems that attract lots of the interests. The reason is not only because the problem is important in clinical settings, but also is challenging when working with EHR such as sparsity, irregularity, temporality, etc. Different from applications in other domains such as computer vision and natural language processing, the data samples in medicine (patients) are relatively limited, which creates lots of troubles for building effective predictive models, especially for complicated ones such as deep learning. In this paper, we propose~\textttMetaPred, a meta-learning framework for clinical risk prediction from longitudinal patient EHR. In particular, in order to predict the target risk with limited data samples, we train a meta-learner from a set of related risk prediction tasks which learns how a good predictor is trained. The meta-learned can then be directly used in target risk prediction, and the limited available samples in the target domain can be used for further fine-tuning the model performance. The effectiveness of \textttMetaPred is tested on a real patient EHR repository from Oregon Health & Science University. We are able to demonstrate that with Convolutional Neural Network (CNN) and Recurrent Neural Network (RNN) as base predictors, \textttMetaPred can achieve much better performance for predicting target risk with low resources comparing with the predictor trained on the limited samples available for this risk alone."
MOBIUS: Towards the Next Generation of Query-Ad Matching in Baidu's Sponsored Search,"Baidu runs the largest commercial web search engine in China, serving hundreds of millions of online users every day in response to a great variety of queries. In order to build a high-efficiency sponsored search engine, we used to adopt a three-layer funnel-shaped structure to screen and sort hundreds of ads from billions of ad candidates subject to the requirement of low response latency and the restraints of computing resources. Given a user query, the top matching layer is responsible for providing semantically relevant ad candidates to the next layer, while the ranking layer at the bottom concerns more about business indicators (e.g., CPM, ROI, etc.) of those ads. The clear separation between the matching and ranking objectives results in a lower commercial return. The Mobius project has been established to address this serious issue. It is our first attempt to train the matching layer to consider CPM as an additional optimization objective besides the query-ad relevance, via directly predicting CTR (click-through rate) from billions of query-ad pairs. Specifically, this paper will elaborate on how we adopt active learning to overcome the insufficiency of click history at the matching layer when training our neural click networks offline, and how we use the SOTA ANN search technique for retrieving ads more efficiently (Here ""ANN'' stands for approximate nearest neighbor search). We contribute the solutions to Mobius-V1 as the first version of our next generation query-ad matching system."
MSURU: Large Scale E-commerce Image Classification with Weakly Supervised Search Data,"In this paper we present a deployed image recognition system used in a large scale commerce search engine, which we call MSURU. It is designed to process product images uploaded daily to Facebook Marketplace. Social commerce is a growing area within Facebook and understanding visual representations of product content is important for search and recommendation applications on Marketplace. In this paper, we present techniques we used to develop efficient large-scale image classifiers using weakly supervised search log data. We perform extensive evaluation of presented techniques, explain practical experience of developing large-scale classification systems and discuss challenges we faced. Our system, MSURU out-performed current state of the art system developed at Facebook [23] by 16% in e-commerce domain. MSURU is deployed to production with significant improvements in search success rate and active interactions on Facebook Marketplace."
Multi-Horizon Time Series Forecasting with Temporal Attention Learning,"We propose a novel data-driven approach for solving multi-horizon probabilistic forecasting tasks that predicts the full distribution of a time series on future horizons. We illustrate that temporal patterns hidden in historical information play an important role in accurate forecasting of long time series. Traditional methods rely on setting up temporal dependencies manually to explore related patterns in historical data, which is unrealistic in forecasting long-term series on real-world data. Instead, we propose to explicitly learn constructing hidden patterns' representations with deep neural networks and attending to different parts of the history for forecasting the future.In this paper, we propose an end-to-end deep-learning framework for multi-horizon time series forecasting, with temporal attention mechanisms to better capture latent patterns in historical data which are useful in predicting the future. Forecasts of multiple quantiles on multiple future horizons can be generated simultaneously based on the learned latent pattern features. We also propose a multimodal fusion mechanism which is used to combine features from different parts of the history to better represent the future. Experiment results demonstrate our approach achieves state-of-the-art performance on two large-scale forecasting datasets in different domains."
MVAN: Multi-view Attention Networks for Real Money Trading Detection in Online Games,"Online gaming is a multi-billion dollar industry that entertains a large, global population. However, one unfortunate phenomenon known as real money trading harms the competition and the fun. Real money trading is an interesting economic activity used to exchange assets in a virtual world with real world currencies, leading to imbalance of game economy and inequality of wealth and opportunity. Game operation teams have been devoting much efforts on real money trading detection, however, it still remains a challenging task. To overcome the limitation from traditional methods conducted by game operation teams, we propose, MVAN, the first multi-view attention networks for detecting real money trading with multi-view data sources. We present a multi-graph attention network (MGAT) in the graph structure view, a behavior attention network (BAN) in the vertex content view, a portrait attention network (PAN) in the vertex attribute view and a data source attention network (DSAN) in the data source view. Experiments conducted on real-world game logs from a commercial NetEase MMORPG( JusticePC) show that our method consistently performs promising results compared with other competitive methods over time and verifiy the importance and rationality of attention mechanisms. MVAN is deployed to several MMORPGs in NetEase in practice and achieving remarkable performance improvement and acceleration. Our method can easily generalize to other types of related tasks in real world, such as fraud detection, drug tracking and money laundering tracking etc."
Naranjo Question Answering using End-to-End Multi-task Learning Model,"In the clinical domain, it is important to understand whether an adverse drug reaction (ADR) is caused by a particular medication. Clinical judgement studies help judge the causal relation between a medication and its ADRs. In this study, we present the first attempt to automatically infer the causality between a drug and an ADR from electronic health records (EHRs) by answering the Naranjo questionnaire, the validated clinical question answering set used by domain experts for ADR causality assessment. Using physicians' annotation as the gold standard, our proposed joint model, which uses multi-task learning to predict the answers of a subset of the Naranjo questionnaire, significantly outperforms the baseline pipeline model with a good margin, achieving a macro-weighted f-score between 0.3652-0.5271 and micro-weighted f-score between 0.9523-0.9918."
Nonparametric Mixture of Sparse Regressions on Spatio-Temporal Data -- An Application to Climate Prediction,"Climate prediction is a very challenging problem. Many institutes around the world try to predict climate variables by building climate models called General Circulation Models (GCMs), which are based on mathematical equations that describe the physical processes. The prediction abilities of different GCMs may vary dramatically across different regions and time. Motivated by the need of identifying which GCMs are more useful for a particular region and time, we introduce a clustering model combining Dirichlet Process (DP) mixture of sparse linear regression with Markov Random Fields (MRFs). This model incorporates DP to automatically determine the number of clusters, imposes MRF constraints to guarantee spatio-temporal smoothness, and selects a subset of GCMs that are useful for prediction within each spatio-temporal cluster with a spike-and-slab prior. We derive an effective Gibbs sampling method for this model. Experimental results are provided for both synthetic and real-world climate data."
Nostalgin: Extracting 3D City Models from Historical Image Data,"What did it feel like to walk through a city from the past? In this work, we describe Nostalgin (Nostalgia Engine), a method that can faithfully reconstruct cities from historical images. Unlike existing work in city reconstruction, we focus on the task of reconstructing 3D cities from historical images. Working with historical image data is substantially more difficult, as there are significantly fewer buildings available and the details of the camera parameters which captured the images are unknown. Nostalgin can generate a city model even if there is only a single image per facade, regardless of viewpoint or occlusions. To achieve this, our novel architecture combines image segmentation, rectification, and inpainting. We motivate our design decisions with experimental analysis of individual components of our pipeline, and show that we can improve on baselines in both speed and visual realism. We demonstrate the efficacy of our pipeline by recreating two 1940s Manhattan city blocks. We aim to deploy Nostalgin as an open source platform where users can generate immersive historical experiences from their own photos."
