"Raise to Speak: An Accurate, Low-power Detector for Activating Voice Assistants on Smartwatches","The two most common ways to activate intelligent voice assistants (IVAs) are button presses and trigger phrases. This paper describes a new way to invoke IVAs on smartwatches: simply raise your hand and speak naturally. To achieve this experience, we designed an accurate, low-power detector that works on a wide range of environments and activity scenarios with minimal impact to battery life, memory footprint, and processor utilization. The raise to speak (RTS) detector consists of four main compo- nents: an on-device gesture convolutional neural network (CNN) that uses accelerometer data to detect specific poses; an on-device speech CNN to detect proximal human speech; a policy model to combine signals from the motion and speech detector; and an off-device false trigger mitigation (FTM) system to reduce unin- tentional invocations trigged by the on-device detector. Majority of the components of the detector run on-device to preserve user privacy. The RTS detector was released in watchOS 5.0 and is running on millions of devices worldwide."
Randomized Experimental Design via Geographic Clustering,"Web-based services often run randomized experiments to improve their products. A popular way to run these experiments is to use geographical regions as units of experimentation, since this does not require tracking of individual users or browser cookies. Since users may issue queries from multiple geographical locations, geo-regions cannot be considered independent and interference may be present in the experiment. In this paper, we study this problem, and first present GeoCUTS, a novel algorithm that forms geographical clusters to minimize interference while preserving balance in cluster size. We use a random sample of anonymized traffic from Google Search to form a graph representing user movements, then construct a geographically coherent clustering of the graph. Our main technical contribution is a statistical framework to measure the effectiveness of clusterings. Furthermore, we perform empirical evaluations showing that the performance of GeoCUTS is comparable to hand-crafted geo-regions with respect to both novel and existing metrics."
Ranking in Genealogy: Search Results Fusion at Ancestry,"Genealogy research is the study of family history using available resources such as historical records. Ancestry provides its customers with one of the world's largest online genealogical index with billions of records from a wide range of sources, including vital records such as birth and death certificates, census records, court and probate records among many others. Search at Ancestry aims to return relevant records from various record types, allowing our subscribers to build their family trees, research their family history, and make meaningful discoveries about their ancestors from diverse perspectives.In a modern search engine designed for genealogical study, the appropriate ranking of search results to provide highly relevant information represents a daunting challenge. In particular, the disparity in historical records makes it inherently difficult to score records in an equitable fashion. Herein, we provide an overview of our solutions to overcome such record disparity problems in the Ancestry search engine. Specifically, we introduce customized coordinate ascent (customized CA) to speed up ranking within a specific record type. We then propose stochastic search (SS) that linearly combines ranked results federated across contents from various record types. Furthermore, we propose a novel information retrieval metric, normalized cumulative entropy (NCE), to measure the diversity of results. We demonstrate the effectiveness of these two algorithms in terms of relevance (by NDCG) and diversity (by NCE) if applicable in the offline experiments using real customer data at Ancestry."
Real-time Attention Based Look-alike Model for Recommender System,"Recently, deep learning models play more and more important roles in contents recommender systems. However, although the performance of recommendations is greatly improved, the ""Matthew effect"" becomes increasingly evident. While the head contents get more and more popular, many competitive long-tail contents are difficult to achieve timely exposure because of lacking behavior features. This issue has badly impacted the quality and diversity of recommendations. To solve this problem, look-alike algorithm is a good choice to extend audience for high quality long-tail contents. But the traditional look-alike models which widely used in online advertising are not suitable for recommender systems because of the strict requirement of both real-time and effectiveness. This paper introduces a real-time attention based look-alike model (RALM) for recommender systems, which tackles the challenge of conflict between real-time and effectiveness. RALM realizes real-time look-alike audience extension benefiting from seeds-to-user similarity prediction and improves the effectiveness through optimizing user representation learning and look-alike learning modeling. For user representation learning, we propose a novel neural network structure named attention merge layer to replace the concatenation layer, which significantly improves the expressive ability of multi-fields feature learning. On the other hand, considering the various members of seeds, we design global attention unit and local attention unit to learn robust and adaptive seeds representation with respect to a certain target user. At last, we introduce seeds clustering mechanism which not only reduces the time complexity of attention units prediction but also minimizes the loss of seeds information at the same time. According to our experiments, RALM shows superior effectiveness and performance than popular look-alike models. RALM has been successfully deployed in ""Top Stories"" Recommender System of WeChat, leading to great improvement on diversity and quality of recommendations. As far as we know, this is the first real-time look-alike model applied in recommender systems."
Real-time Event Detection on Social Data Streams,"Social networks are quickly becoming the primary medium for discussing what is happening around real-world events. The information that is generated on social platforms like Twitter can produce rich data streams for immediate insights into ongoing matters and the conversations around them. To tackle the problem of event detection, we model events as a list of clusters of trending entities over time. We describe a real-time system for discovering events that is modular in design and novel in scale and speed: it applies clustering on a large stream with millions of entities per minute and produces a dynamically updated set of events. In order to assess clustering methodologies, we build an evaluation dataset derived from a snapshot of the full Twitter Firehose and propose novel metrics for measuring clustering quality. Through experiments and system profiling, we highlight key results from the offline and online pipelines. Finally, we visualize a high profile event on Twitter to show the importance of modeling the evolution of events, especially those detected from social data streams."
Real-time On-Device Troubleshooting Recommendation for Smartphones,"Billions of people are using smartphones everyday and they often face problems and troubles with both the hardware as well as the software. Such problems lead to frustrated users and low customer satisfaction. Developing an automatic machine learning-based solution that would detect that the user has a problem and would engage in troubleshooting has the potential to significantly improve customer satisfaction and retention. Here, we design and implement a system that based on the user's smartphone activity detects that the user has a problem and requires help. Our system automatically detects a user has a problem and then helps with the troubleshooting by recommending possible solutions to the identified problem. We train our system based on large-scale customer support center data and show that it can both detect that a user has a problem as well as predict the category of the problem (89.7% accuracy) and quickly provide a solution (in 10.4ms). Our system has been deployed in commercial service since January, 2019. Online evaluation result showed that machine learning based approach outperforms the existing method by approximately 30% regarding the user problem solving rate."
Real-World Product Deployment of Adaptive Push Notification Scheduling on Smartphones,"The limited attentional resource of users is a bottleneck to delivery of push notifications in today's mobile and ubiquitous computing environments. Adaptive mobile notification scheduling, which detects opportune timings based on mobile sensing and machine learning, has been proposed as a way of alleviating this problem. However, it is still not clear if such adaptive notifications are effective in a large-scale product deployment with real-world situations and configurations, such as users' context changes, personalized content in notifications, and sudden external factors that users commonly experience (such as breaking news). In this paper, we construct a new interruptibility estimation and adaptive notification scheduling with redesigned technical components. From the deploy study of the system to the real product stack of Yahoo! JAPAN Android application and evaluation with 382,518 users for 28 days, we confirmed several significant results, including the maximum 60.7% increase in the users' click rate, 10 times more gain compared to the previous system, significantly better gain in the personalized notification content, and unexpectedly better performance in a situation with exceptional breaking news notifications. With these results, the proposed system has officially been deployed and enabled to all the users of Yahoo! JAPAN product environment where more than 10 million Android app users are enjoying its benefit."
Recurrent Neural Networks for Stochastic Control in Real-Time Bidding,"Bidding in real-time auctions can be a difficult stochastic control task; especially in a very uncertain market and if underdelivery incurs strong penalties. Most current works and implementations focus on optimally delivering a campaign given a reasonable forecast of the market. Practical implementations have a feedback loop to adjust and be robust to forecasting errors, but no implementation, to the best of our knowledge, uses a model of market risk and actively anticipates market shifts. Solving such stochastic control problems in practice is actually very challenging and an approximate solution based on a Recurrent Neural Network (RNN) architecture is both effective and practical for implementation in a production environment. The RNN bidder provisions everything it needs to avoid underdelivery. It also deliberately falls short of its goal when buying the missing impressions would cost more than the penalty for not reaching it."
Reinforcement Learning to Optimize Long-term User Engagement in Recommender Systems,"Recommender systems play a crucial role in our daily lives. Feed streaming mechanism has been widely used in the recommender system, especially on the mobile Apps. The feed streaming setting provides users the interactive manner of recommendation in never-ending feeds. In such a manner, a good recommender system should pay more attention to user stickiness, which is far beyond classical instant metrics and typically measured by long-term user engagement. Directly optimizing long-term user engagement is a non-trivial problem, as the learning target is usually not available for conventional supervised learning methods. Though reinforcement learning~(RL) naturally fits the problem of maximizing the long term rewards, applying RL to optimize long-term user engagement is still facing challenges: user behaviors are versatile to model, which typically consists of both instant feedback (eg. clicks) and delayed feedback (eg. dwell time, revisit); in addition, performing effective off-policy learning is still immature, especially when combining bootstrapping and function approximation. To address these issues, in this work, we introduce a RL framework --- FeedRec to optimize the long-term user engagement. FeedRec includes two components: 1)~a Q-Network which designed in hierarchical LSTM takes charge of modeling complex user behaviors, and 2)~a S-Network, which simulates the environment, assists the Q-Network and voids the instability of convergence in policy learning. Extensive experiments on synthetic data and a real-world large scale data show that FeedRec effectively optimizes the long-term user engagement and outperforms state-of-the-arts."
Reserve Price Failure Rate Prediction with Header Bidding in Display Advertising,"The revenue of online display advertising in the U.S. is projected to be 7.9 billion U.S. dollars by 2022. One main way of display advertising is through real-time bidding (RTB). In RTB, an ad exchange runs a second price auction among multiple advertisers to sell each ad impression. Publishers usually set up a reserve price, the lowest price acceptable for an ad impression. If there are bids higher than the reserve price, then the revenue is the higher price between the reserve price and the second highest bid; otherwise, the revenue is zero. Thus, a higher reserve price can potentially increase the revenue, but with higher risks associated. In this paper, we study the problem of estimating the failure rate of a reserve price, i.e., the probability that a reserve price fails to be outbid. The solution to this problem have managerial implications to publishers to set appropriate reserve prices in order to minimizes the risks and optimize the expected revenue. This problem is highly challenging since most publishers do not know the historical highest bidding prices offered by RTB advertisers. To address this problem, we develop a parametric survival model for reserve price failure rate prediction. The model is further improved by considering user and page interactions, and header bidding information. The experimental results demonstrate the effectiveness of the proposed approach."
Robust Anomaly Detection for Multivariate Time Series through Stochastic Recurrent Neural Network,"Industry devices (i.e., entities) such as server machines, spacecrafts, engines, etc., are typically monitored with multivariate time series, whose anomaly detection is critical for an entity's service quality management. However, due to the complex temporal dependence and stochasticity of multivariate time series, their anomaly detection remains a big challenge. This paper proposes OmniAnomaly, a stochastic recurrent neural network for multivariate time series anomaly detection that works well robustly for various devices. Its core idea is to capture the normal patterns of multivariate time series by learning their robust representations with key techniques such as stochastic variable connection and planar normalizing flow, reconstruct input data by the representations, and use the reconstruction probabilities to determine anomalies. Moreover, for a detected entity anomaly, OmniAnomaly can provide interpretations based on the reconstruction probabilities of its constituent univariate time series. The evaluation experiments are conducted on two public datasets from aerospace and a new server machine dataset (collected and released by us) from an Internet company. OmniAnomaly achieves an overall F1-Score of 0.86 in three real-world datasets, signicantly outperforming the best performing baseline method by 0.09. The interpretation accuracy for OmniAnomaly is up to 0.89."
Robust Gaussian Process Regression for Real-Time High Precision GPS Signal Enhancement,"Satellite-based positioning system such as GPS often suffers from large amount of noise that degrades the positioning accuracy dramatically especially in real-time applications. In this work, we consider a data-mining approach to enhance the GPS signal. We build a large-scale high precision GPS receiver grid system to collect real-time GPS signals for training. The Gaussian Process (GP) regression is chosen to model the vertical Total Electron Content (vTEC) distribution of the ionosphere of the Earth. Our experiments show that the noise in the real-time GPS signals often exceeds the breakdown point of the conventional robust regression methods resulting in sub-optimal system performance. We propose a three-step approach to address this challenge. In the first step we perform a set of signal validity tests to separate the signals into clean and dirty groups. In the second step, we train an initial model on the clean signals and then reweigting the dirty signals based on the residual error. A final model is retrained on both the clean signals and the reweighted dirty signals. In the theoretical analysis, we prove that the proposed three-step approach is able to tolerate much higher noise level than the vanilla robust regression methods if two reweighting rules are followed. We validate the superiority of the proposed method in our real-time high precision positioning system against several popular state-of-the-art robust regression methods. Our method achieves centimeter positioning accuracy in the benchmark region with probability $78.4%$ , outperforming the second best baseline method by a margin of $8.3%$. The benchmark takes 6 hours on 20,000 CPU cores or 14 years on a single CPU."
Sample Adaptive Multiple Kernel Learning for Failure Prediction of Railway Points,"Railway points are among the key components of railway infrastructure. As a part of signal equipment, points control the routes of trains at railway junctions, having a significant impact on the reliability, capacity, and punctuality of rail transport. Meanwhile, they are also one of the most fragile parts in railway systems. Points failures cause a large portion of railway incidents. Traditionally, maintenance of points is based on a fixed time interval or raised after the equipment failures. Instead, it would be of great value if we could forecast points' failures and take action beforehand, minimising any negative effect. To date, most of the existing prediction methods are either lab-based or relying on specially installed sensors which makes them infeasible for large-scale implementation. Besides, they often use data from only one source. We, therefore, explore a new way that integrates multi-source data which are ready to hand to fulfil this task. We conducted our case study based on Sydney Trains rail network which is an extensive network of passenger and freight railways. Unfortunately, the real-world data are usually incomplete due to various reasons, e.g., faults in the database, operational errors or transmission faults. Besides, railway points differ in their locations, types and some other properties, which means it is hard to use a unified model to predict their failures. Aiming at this challenging task, we firstly constructed a dataset from multiple sources and selected key features with the help of domain experts. In this paper, we formulate our prediction task as a multiple kernel learning problem with missing kernels. We present a robust multiple kernel learning algorithm for predicting points failures. Our model takes into account the missing pattern of data as well as the inherent variance on different sets of railway points. Extensive experiments demonstrate the superiority of our algorithm compared with other state-of-the-art methods."
Seasonal-adjustment Based Feature Selection Method for Predicting Epidemic with Large-scale Search Engine Logs,"Search engine logs have a great potential in tracking and predicting outbreaks of infectious disease. More precisely, one can use the search volume of some search terms to predict the infection rate of an infectious disease in nearly real-time. However, conducting accurate and stable prediction of outbreaks using search engine logs is a challenging task due to the following two-way instability characteristics of the search logs. First, the search volume of a search term may change irregularly in the short-term, for example, due to environmental factors such as the amount of media or news. Second, the search volume may also change in the long-term due to the demographic change of the search engine. That is to say, if a model is trained with such search logs with ignoring such characteristic, the resulting prediction would contain serious mispredictions when these changes occur. In this work, we proposed a novel feature selection method to overcome this instability problem. In particular, we employ a seasonal-adjustment method that decomposes each time series into three components: seasonal, trend and irregular component and build prediction models for each component individually. We also carefully design a feature selection method to select proper search terms to predict each component. We conducted comprehensive experiments on ten different kinds of infectious diseases. The experimental results show that the proposed method outperforms all comparative methods in prediction accuracy for seven of ten diseases, in both now-casting and forecasting setting. Also, the proposed method is more successful in selecting search terms that are semantically related to target diseases."
Seeker: Real-Time Interactive Search,"This paper introduces Seeker, a system that allows users to adaptively refine search rankings in real time, through a series of feedbacks in the form of likes and dislikes. When searching online, users may not know how to accurately describe their product of choice in words. An alternative approach is to search an embedding space, allowing the user to query using a representation of the item (like a tune for a song, or a picture for an object). However, this approach requires the user to possess an example representation of their desired item. Additionally, most current search systems do not allow the user to dynamically adapt the results with further feedback. On the other hand, users often have a mental picture of the desired item and are able to answer ordinal questions of the form: ""Is this item similar to what you have in mind?"" With this assumption, our algorithm allows for users to provide sequential feedback on search results to adapt the search feed. We show that our proposed approach works well both qualitatively and quantitatively. Unlike most previous representation-based search systems, we can quantify the quality of our algorithm by evaluating humans-in-the-loop experiments."
Semantic Product Search,"We study the problem of semantic matching in product search, that is, given a customer query, retrieve all semantically related products from the catalog. Pure lexical matching via an inverted index falls short in this respect due to several factors: a) lack of understanding of hypernyms, synonyms, and antonyms, b) fragility to morphological variants (e.g. ""woman"" vs. ""women""), and c) sensitivity to spelling errors. To address these issues, we train a deep learning model for semantic matching using customer behavior data. Much of the recent work on large-scale semantic search using deep learning focuses on ranking for web search. In contrast, semantic matching for product search presents several novel challenges, which we elucidate in this paper. We address these challenges by a) developing a new loss function that has an inbuilt threshold to differentiate between random negative examples, impressed but not purchased examples, and positive examples (purchased items), b) using average pooling in conjunction with n-grams to capture short-range linguistic patterns, c) using hashing to handle out of vocabulary tokens, and d) using a model parallel training architecture to scale across 8 GPUs. We present compelling offline results that demonstrate at least 4.7% improvement in [email protected] and 14.5% improvement in mean average precision (MAP) over baseline state-of-the-art semantic search methods using the same tokenization method. Moreover, we present results and discuss learnings from online A/B tests which demonstrate the efficacy of our method."
