150 Successful Machine Learning Models: 6 Lessons Learned at Booking.com,"Booking.com is the world's largest online travel agent where millions of guests find their accommodation and millions of accommodation providers list their properties including hotels, apartments, bed and breakfasts, guest houses, and more. During the last years we have applied Machine Learning to improve the experience of our customers and our business. While most of the Machine Learning literature focuses on the algorithmic or mathematical aspects of the field, not much has been published about how Machine Learning can deliver meaningful impact in an industrial environment where commercial gains are paramount. We conducted an analysis on about 150 successful customer facing applications of Machine Learning, developed by dozens of teams in Booking.com, exposed to hundreds of millions of users worldwide and validated through rigorous Randomized Controlled Trials. Following the phases of a Machine Learning project we describe our approach, the many challenges we found, and the lessons we learned while scaling up such a complex technology across our organization. Our main conclusion is that an iterative, hypothesis driven process, integrated with other disciplines was fundamental to build 150 successful products enabled by Machine Learning."
A Collaborative Learning Framework to Tag Refinement for Points of Interest,"Tags of a Point of Interest (POI) can facilitate location-based services from many aspects like location search and place recommendation. However, many POI tags are often incomplete or imprecise, which may lead to performance degradation of tag-dependent applications. In this paper, we study the POI tag refinement problem which aims to automatically fill in the missing tags as well as correct noisy tags for POIs. We propose a tri-adaptive collaborative learning framework to search for an optimal POI-tag score matrix. The framework integrates three components to collaboratively (i) model the similarity matching between POI and tag, (ii) recover the POI-tag pattern via matrix factorization and (iii) learn to infer the most possible tags by maximum likelihood estimation. We devise an adaptively joint training process to optimize the model and regularize each component simultaneously. And the final refinement results are the consensus of multiple views from different components. We also discuss how to utilize various data sources to construct features for tag refinement, including user profile data, query data on Baidu Maps and basic properties of POIs. Finally, we conduct extensive experiments to demonstrate the effectiveness of our framework. And we further present a case study of the deployment of our framework on Baidu Maps."
A Data-Driven Approach for Multi-level Packing Problems in Manufacturing Industry,"The bin packing problem is one of the most fundamental optimization problems. Owing to its hardness as a combinatorial optimization problem class and its wide range of applications in different domains, different variations of the problem are emerged and many heuristics have been proposed for obtaining approximate solutions.In this paper, we solve a Multi-Level Bin Packing (MLBP) problem in the real make-to-order industry scenario. Existing solutions are not applicable to the problem due to: 1. the final packing may consist multiple levels of sub-packings; 2. the geometry shapes of objects as well as the packing constraints may be unknown. We design an automatic packing framework which extracts the packing knowledge from historical records to support packing without geometry shape and constraint information. Furthermore, we propose a dynamic programming approach to find the optimal solution for normal size problems; and a heuristic multi-level fuzzy-matching algorithm for large size problems. An inverted index is used to accelerate strategy search. The proposed auto packing framework has been deployed in Huawei Process & Engineering System to assist the packing engineers. It achieves a performance of accelerating the execution time of processing 5,000 packing orders to about $8$ minutes with an average successful packing rate as $80.54%$, which releases at least $30%$ workloads of packing workers."
A Deep Generative Approach to Search Extrapolation and Recommendation,"Related search query recommendation is a standard feature in many modern search engines. Interesting and relevant queries often increase the active time of users and improve the overall search experience. However, conventional approaches based on tag extraction, keywords matching or click graph link analysis suffer from the common problem of limited coverage and generalizability, which means the system could only make suggestions for a small portion of well-formed search queries. In this work, we propose a deep generative approach to construct a related search query for recommendation in a word-by-word fashion, given either an input query or the title of a document. We propose a novel two-stage learning framework that partitions the task into two simpler sub-problems, namely, relevant context words discovery and context-dependent query generation. We carefully design a Relevant Words Generator (RWG) based on recurrent neural networks and a Dual-Vocabulary Sequence-to-Sequence (DV-Seq2Seq) model to address these problems. We also propose automated strategies that have retrieved three large datasets with $500$K to $1$ million instances, from a search click graph constructed based on $8$ days of search histories in Tencent QQ Browser, for model training. By leveraging the dynamically discovered context words, our proposed framework outperforms other Seq2Seq generative baselines on a wide range of BLEU, ROUGE and Exact Match (EM) metrics."
A Deep Value-network Based Approach for Multi-Driver Order Dispatching,"Recent works on ride-sharing order dispatching have highlighted the importance of taking into account both the spatial and temporal dynamics in the dispatching process for improving the transportation system efficiency. At the same time, deep reinforcement learning has advanced to the point where it achieves superhuman performance in a number of fields. In this work, we propose a deep reinforcement learning based solution for order dispatching and we conduct large scale online A/B tests on DiDi's ride-dispatching platform to show that the proposed method achieves significant improvement on both total driver income and user experience related metrics.In particular, we model the ride dispatching problem as a Semi Markov Decision Process to account for the temporal aspect of the dispatching actions. To improve the stability of the value iteration with nonlinear function approximators like neural networks, we propose Cerebellar Value Networks (CVNet) with a novel distributed state representation layer. We further derive a regularized policy evaluation scheme for CVNet that penalizes large Lipschitz constant of the value network for additional robustness against adversarial perturbation and noises. Finally, we adapt various transfer learning methods to CVNet for increased learning adaptability and efficiency across multiple cities. We conduct extensive offline simulations based on real dispatching data as well as online AB tests through the DiDi's platform. Results show that CVNet consistently outperforms other recently proposed dispatching methods. We finally show that the performance can be further improved through the efficient use of transfer learning."
A Generalized Framework for Population Based Training,"Population Based Training (PBT) is a recent approach that jointly optimizes neural network weights and hyperparameters which periodically copies weights of the best performers and mutates hyperparameters during training. Previous PBT implementations have been synchronized glass-box systems. We propose a general, black-box PBT framework that distributes many asynchronous ""trials"" (a small number of training steps with warm-starting) across a cluster, coordinated by the PBT controller. The black-box design does not make assumptions on model architectures, loss functions or training procedures. Our system supports dynamic hyperparameter schedules to optimize both differentiable and non-differentiable metrics. We apply our system to train a state-of-the-art WaveNet generative model for human voice synthesis. We show that our PBT system achieves better accuracy and faster convergence compared to existing methods, given the same computational resource."
A Robust Framework for Accelerated Outcome-driven Risk Factor Identification from EHR,"Electronic Health Records (EHR) containing longitudinal information about millions of patient lives are increasingly being utilized by organizations across the healthcare spectrum. Studies on EHR data have enabled real world applications like understanding of disease progression, outcomes analysis, and comparative effectiveness research. However, often every study is independently commissioned, data is gathered by surveys or specifically purchased per study by a long and often painful process. This is followed by an arduous repetitive cycle of analysis, model building, and generation of insights. This process can take anywhere between 1 - 3 years. In this paper, we present a robust end-to-end machine learning based SaaS system to perform analysis on a very large EHR dataset. The framework consists of a proprietary EHR datamart spanning ~55 million patient lives in USA and over ~20 billion data points. To the best of our knowledge, this framework is the largest in the industry to analyze medical records at this scale, with such efficacy and ease. We developed an end-to-end ML framework with carefully chosen components to support EHR analysis at scale and suitable for further downstream clinical analysis. Specifically, it consists of a ridge regularized Survival Support Vector Machine (SSVM) with a clinical kernel, coupled with Chi-square distance-based feature selection, to uncover relevant risk factors by exploiting the weak correlations in EHR. Our results on multiple real use cases indicate that the framework identifies relevant factors effectively without expert supervision. The framework is stable, generalizable over outcomes, and also found to contribute to better out-of-bound prediction over known expert features. Importantly, the ML methodologies used are interpretable which is critical for acceptance of our system in the targeted user base. With the system being operational, all of these studies were completed within a time frame of 3-4 weeks compared to the industry standard 12-36 months. As such our system can accelerate analysis and discovery, result in better ROI due to reduced investments as well as quicker turn around of studies."
A Severity Score for Retinopathy of Prematurity,"Retinopathy of Prematurity (ROP) is a leading cause for childhood blindness worldwide. An automated ROP detection system could significantly improve the chance of a child receiving proper diagnosis and treatment. We propose a means of producing a continuous severity score in an automated fashion, regressed from both (a) diagnostic class labels as well as (b) comparison outcomes. Our generative model combines the two sources, and successfully addresses inherent variability in diagnostic outcomes. In particular, our method exhibits an excellent predictive performance of both diagnostic and comparison outcomes over a broad array of metrics, including AUC, precision, and recall."
A Unified Framework for Marketing Budget Allocation,"While marketing budget allocation has been studied for decades in traditional business, nowadays online business brings much more challenges due to the dynamic environment and complex decision-making process. In this paper, we present a novel unified framework for marketing budget allocation. By leveraging abundant data, the proposed data-driven approach can help us to overcome the challenges and make more informed decisions. In our approach, a semi-black-box model is built to forecast the dynamic market response and an efficient optimization method is proposed to solve the complex allocation task. First, the response in each market-segment is forecasted by exploring historical data through a semi-black-box model, where the capability of logit demand curve is enhanced by neural networks. The response model reveals relationship between sales and marketing cost. Based on the learned model, budget allocation is then formulated as an optimization problem, and we design efficient algorithms to solve it in both continuous and discrete settings. Several kinds of business constraints are supported in one unified optimization paradigm, including cost upper bound, profit lower bound, or ROI lower bound. The proposed framework is easy to implement and readily to handle large-scale problems. It has been successfully applied to many scenarios in Alibaba Group. The results of both offline experiments and online A/B testing demonstrate its effectiveness."
A User-Centered Concept Mining System for Query and Document Understanding at Tencent,"Concepts embody the knowledge of the world and facilitate the cognitive processes of human beings. Mining concepts from web documents and constructing the corresponding taxonomy are core research problems in text understanding and support many downstream tasks such as query analysis, knowledge base construction, recommendation, and search. However, we argue that most prior studies extract formal and overly general concepts from Wikipedia or static web pages, which are not representing the user perspective.In this paper, we describe our experience of implementing and deploying ConcepT in Tencent QQ Browser. It discovers user-centered concepts at the right granularity conforming to user interests, by mining a large amount of user queries and interactive search click logs. The extracted concepts have the proper granularity, are consistent with user language styles and are dynamically updated. We further present our techniques to tag documents with user-centered concepts and to construct a topic-concept-instance taxonomy, which has helped to improve search as well as news feeds recommendation in Tencent QQ Browser. We performed extensive offline evaluation to demonstrate that our approach could extract concepts of higher quality compared to several other existing methods.Our system has been deployed in Tencent QQ Browser. Results from online A/B testing involving a large number of real users suggest that the Impression Efficiency of feeds users increased by 6.01% after incorporating the user-centered concepts into the recommendation framework of Tencent QQ Browser."
AccuAir: Winning Solution to Air Quality Prediction for KDD Cup 2018,"Since air pollution seriously affects human heath and daily life, the air quality prediction has attracted increasing attention and become an active and important research topic. In this paper, we present AccuAir, our winning solution to the KDD Cup 2018 of Fresh Air, where the proposed solution has won the 1st place in two tracks, and the 2nd place in the other one. Our solution got the best accuracy on average in all the evaluation days. The task is to accurately predict the air quality (as indicated by the concentration of PM2.5, PM10 or O3) of the next 48 hours for each monitoring station in Beijing and London. Aiming at a cutting-edge solution, we first presents an analysis of the air quality data, identifying the fundamental challenges, such as the long-term but suddenly changing air quality, and complex spatial-temporal correlations in different stations. To address the challenges, we carefully design both global and local air quality features, and develop three prediction models including LightGBM, Gated-DNN and Seq2Seq, each with novel ingredients developed for better solving the problem. Specifically, a spatial-temporal gate is proposed in our Gated-DNN model, to effectively capture the spatial-temporal correlations as well as temporal relatedness, making the prediction more sensitive to spatial and temporal signals. In addition, the Seq2Seq model is adapted in such a way that the encoder summarizes useful historical features while the decoder concatenate weather forecast as input, which significantly improves prediction accuracy. Assembling all these components together, the ensemble of three models outperforms all competing methods in terms of the prediction accuracy of 31 days average, 10 days average and 24-48 hours."
Actions Speak Louder than Goals: Valuing Player Actions in Soccer,"Assessing the impact of the individual actions performed by soccer players during games is a crucial aspect of the player recruitment process. Unfortunately, most traditional metrics fall short in addressing this task as they either focus on rare actions like shots and goals alone or fail to account for the context in which the actions occurred. This paper introduces (1) a new language for describing individual player actions on the pitch and (2) a framework for valuing any type of player action based on its impact on the game outcome while accounting for the context in which the action happened. By aggregating soccer players' action values, their total offensive and defensive contributions to their team can be quantified. We show how our approach considers relevant contextual information that traditional player evaluation metrics ignore and present a number of use cases related to scouting and playing style characterization in the 2016/2017 and 2017/2018 seasons in Europe's top competitions."
Active Deep Learning for Activity Recognition with Context Aware Annotator Selection,"Machine learning models are bounded by the credibility of ground truth data used for both training and testing. Regardless of the problem domain, this ground truth annotation is objectively manual and tedious as it needs considerable amount of human intervention. With the advent of Active Learning with multiple annotators, the burden can be somewhat mitigated by actively acquiring labels of most informative data instances. However, multiple annotators with varying degrees of expertise poses new set of challenges in terms of quality of the label received and availability of the annotator. Due to limited amount of ground truth information addressing the variabilities of Activity of Daily Living (ADLs), activity recognition models using wearable and mobile devices are still not robust enough for real-world deployment. In this paper, we first propose an active learning combined deep model which updates its network parameters based on the optimization of a joint loss function. We then propose a novel annotator selection model by exploiting the relationships among the users while considering their heterogeneity with respect to their expertise, physical and spatial context. Our proposed model leverages model-free deep reinforcement learning in a partially observable environment setting to capture the action-reward interaction among multiple annotators. Our experiments in real-world settings exhibit that our active deep model converges to optimal accuracy with fewer labeled instances and achieves ~8% improvement in accuracy in fewer iterations."
Adversarial Matching of Dark Net Market Vendor Accounts,"Many datasets feature seemingly disparate entries that actually refer to the same entity. Reconciling these entries, or ""matching,"" is challenging, especially in situations where there are errors in the data. In certain contexts, the situation is even more complicated: an active adversary may have a vested interest in having the matching process fail. By leveraging eight years of data, we investigate one such adversarial context: matching different online anonymous marketplace vendor handles to unique sellers. Using a combination of random forest classifiers and hierarchical clustering on a set of features that would be hard for an adversary to forge or mimic, we manage to obtain reasonable performance (over 75% precision and recall on labels generated using heuristics), despite generally lacking any ground truth for training. Our algorithm performs particularly well for the top 30% of accounts by sales volume, and hints that 22,163 accounts with at least one confirmed sale map to 15,652 distinct sellers---of which 12,155 operate only one account, and the remainder between 2 and 11 different accounts. Case study analysis further confirms that our algorithm manages to identify non-trivial matches, as well as impersonation attempts."
AiAds: Automated and Intelligent Advertising System for Sponsored Search,"Sponsored search has more than 20 years of history, and it has been proven to be a successful business model for online advertising. Based on the pay-per-click pricing model and the keyword targeting technology, the sponsored system runs online auctions to determine the allocations and prices of search advertisements. In the traditional setting, advertisers should manually create lots of ad creatives and bid on some relevant keywords to target their audience. Due to the huge amount of search traffic and a wide variety of ad creations, the limits of manual optimizations from advertisers become the main bottleneck for improving the efficiency of this market. Moreover, as many emerging advertising forms and supplies are growing, it's crucial for sponsored search platform to pay more attention to the ROI metrics of ads for getting the marketing budgets of advertisers. In this paper, we present the AiAds system developed at Baidu, which use machine learning techniques to build an automated and intelligent advertising system. By designing and implementing the automated bidding strategy, the intelligent targeting and the intelligent creation models, the AiAds system can transform the manual optimizations into multiple automated tasks and optimize these tasks in advanced methods. AiAds is a brand-new architecture of sponsored search system which changes the bidding language and allocation mechanism, breaks the limit of keyword targeting with end-to-end ad retrieval framework and provides global optimization of ad creation. This system can increase the advertiser's campaign performance, the user experience and the revenue of the advertising platform simultaneously and significantly. We present the overall architecture and modeling techniques for each module of the system and share our lessons learned in solving several of key challenges. Finally, online A/B test and long-term grouping experiment demonstrate the advancement and effectiveness of this system."
AKUPM: Attention-Enhanced Knowledge-Aware User Preference Model for Recommendation,"Recently, much attention has been paid to the usage of knowledge graph within the context of recommender systems to alleviate the data sparsity and cold-start problems. However, when incorporating entities from a knowledge graph to represent users, most existing works are unaware of the relationships between these entities and users. As a result, the recommendation results may suffer a lot from some unrelated entities.In this paper, we investigate how to explore these relationships which are essentially determined by the interactions among entities. Firstly, we categorize the interactions among entities into two types: inter-entity-interaction and intra-entity-interaction. Inter-entity-interaction is the interactions among entities that affect their importances to represent users. And intra-entity-interaction is the interactions within an entity that describe the different characteristics of this entity when involved in different relations.Then, considering these two types of interactions, we propose a novel model named Attention-enhanced Knowledge-aware User Preference Model (AKUPM) for click-through rate (CTR) prediction. More specifically, a self-attention network is utilized to capture the inter-entity-interaction by learning appropriate importance of each entity w.r.t the user. Moreover, the intra-entity-interaction is modeled by projecting each entity into its connected relation spaces to obtain the suitable characteristics. By doing so, AKUPM is able to figure out the most related part of incorporated entities (i.e., filter out the unrelated entities). Extensive experiments on two real-world public datasets demonstrate that AKUPM achieves substantial gains in terms of common evaluation metrics (e.g., AUC, ACC and [email protected]) over several state-of-the-art baselines."
