StreamScope: Continuous Reliable Distributed Processing of Big Data Streams,"STREAMSCOPE (or STREAMS) is a reliable distributed stream computation engine that has been deployed in shared 20,000-server production clusters at Microsoft. STREAMS provides a continuous temporal stream model that allows users to express complex stream processing logic naturally and declaratively. STREAMS supports business-critical streaming applications that can process tens of billions (or tens of terabytes) of input events per day continuously with complex logic involving tens of temporal joins, aggregations, and sophisticated userdefined functions, while maintaining tens of terabytes in-memory computation states on thousands of machines."
Social Hash: An Assignment Framework for Optimizing Distributed Systems Operations on Social Networks,"How objects are assigned to components in a distributed
system can have a significant impact on performance
and resource usage. Social Hash is a framework for
producing, serving, and maintaining assignments of objects
to components so as to optimize the operations
of large social networks, such as Facebook’s Social
Graph. The framework uses a two-level scheme to decouple
compute-intensive optimization from relatively
low-overhead dynamic adaptation. The optimization at
the first level occurs on a slow timescale, and in our applications
is based on graph partitioning in order to leverage
the structure of the social network. The dynamic
adaptation at the second level takes place frequently to
adapt to changes in access patterns and infrastructure,
with the goal of balancing component loads."
The Design and Implementation of the Warp Transactional Filesystem,"This paper introduces the Warp Transactional Filesystem
(WTF), a novel, transactional, POSIX-compatible
filesystem based on a new file slicing API that enables
efficient zero-copy file transformations. WTF provides
transactional access spanning multiple files in a distributed
filesystem. Further, the file slicing API enables
applications to construct files from the contents of other
files without having to rewrite or relocate data. Combined,
these enable a new class of high-performance
applications. Experiments show that WTF can qualitatively
outperform the industry-standard HDFS distributed
filesystem, up to a factor of four in a sorting
benchmark, by reducing I/O costs. Microbenchmarks indicate
that the new features of WTF impose only a modest
overhead on top of the POSIX-compatible API."
BlowFish: Dynamic Storage-Performance Tradeoff in Data Stores,"We present BlowFish, a distributed data store that admits
a smooth tradeoff between storage and performance for
point queries. What makes BlowFish unique is its ability
to navigate along this tradeoff curve efficiently at finegrained
time scales with low computational overhead.
Achieving a smooth and dynamic storage-performance
tradeoff enables a wide range of applications. We apply
BlowFish to several such applications from real-world
production clusters: (i) as a data recovery mechanism during
failures: in practice, BlowFish requires 5.4× lower
bandwidth and 2.5× lower repair time compared to stateof-the-art
erasure codes, while reducing the storage cost
of replication from 3× to 1.9×; and (ii) data stores with
spatially-skewed and time-varying workloads (e.g., due
to object popularity and/or transient failures): we show
that navigating the storage-performance tradeoff achieves
higher system-wide utility (e.g., throughput) than selectively
caching hot objects."
Universal Packet Scheduling,"In this paper we address a seemingly simple question:
Is there a universal packet scheduling algorithm? More
precisely, we analyze (both theoretically and empirically)
whether there is a single packet scheduling algorithm that,
at a network-wide level, can perfectly match the results of
any given scheduling algorithm. We find that in general
the answer is “no”. However, we show theoretically that
the classical Least Slack Time First (LSTF) scheduling algorithm
comes closest to being universal and demonstrate
empirically that LSTF can closely replay a wide range of
scheduling algorithms. We then evaluate whether LSTF
can be used in practice to meet various network-wide objectives
by looking at popular performance metrics (such as
average FCT, tail packet delays, and fairness); we find that
LSTF performs comparable to the state-of-the-art for each
of them. We also discuss how LSTF can be used in conjunction
with active queue management schemes (such as
CoDel and ECN) without changing the core of the network."
Maglev: A Fast and Reliable Software Network Load Balancer,"Maglev is Google’s network load balancer. It is a
large distributed software system that runs on commodity
Linux servers. Unlike traditional hardware network load
balancers, it does not require a specialized physical rack
deployment, and its capacity can be easily adjusted by
adding or removing servers. Network routers distribute
packets evenly to the Maglev machines via Equal Cost
Multipath (ECMP); each Maglev machine then matches
the packets to their corresponding services and spreads
them evenly to the service endpoints. To accommodate
high and ever-increasing traffic, Maglev is specifically
optimized for packet processing performance. A single
Maglev machine is able to saturate a 10Gbps link with
small packets. Maglev is also equipped with consistent
hashing and connection tracking features, to minimize
the negative impact of unexpected faults and failures on
connection-oriented protocols. Maglev has been serving
Google’s traffic since 2008. It has sustained the rapid
global growth of Google services, and it also provides
network load balancing for Google Cloud Platform."
Enabling ECN in Multi-Service Multi-Queue Data Centers,"Recent proposals have leveraged Explicit Congestion
Notification (ECN) to achieve high throughput low latency
data center network (DCN) transport. However,
most of them implicitly assume each switch port has one
queue, making the ECN schemes they designed inapplicable
to production DCNs where multiple service queues
per port are employed to isolate different traffic classes
through weighted fair sharing."
DFC: Accelerating String Pattern Matching for Network Applications,"Middlebox services that inspect packet payloads have become
commonplace. Today, anyone can sign up for cloudbased
Web application firewall with a single click. These
services typically look for known patterns that might appear
anywhere in the payload. The key challenge is that
existing solutions for pattern matching have become a
bottleneck because software packet processing technologies
have advanced. The popularization of cloud-based
services has made the problem even more critical."
Diplomat: Using Delegations to Protect Community Repositories,"Community repositories, such as Docker Hub, PyPI,
and RubyGems, are bustling marketplaces that distribute
software. Even though these repositories use common
software signing techniques (e.g., GPG and TLS), attackers
can still publish malicious packages after a server
compromise. This is mainly because a community repository
must have immediate access to signing keys in order
to certify the large number of new projects that are
registered each day."
AnonRep: Towards Tracking-Resistant Anonymous Reputation,"Reputation systems help users evaluate information quality
and incentivize civilized behavior, often by tallying
feedback from other users such as ""likes"" or votes and
linking these scores to a user’s long-term identity. This
identity linkage enables user tracking, however, and appears
at odds with strong privacy or anonymity. This
paper presents AnonRep, a practical anonymous reputation
system offering the benefits of reputation without enabling
long-term tracking. AnonRep users anonymously
post messages, which they can verifiably tag with their
reputation scores without leaking sensitive information.
AnonRep reliably tallies other users’ feedback (e.g., likes
or votes) without revealing the user’s identity or exact
score to anyone, while maintaining security against score
tampering or duplicate feedback. A working prototype
demonstrates that AnonRep scales linearly with the number
of participating users. Experiments show that the latency
for a user to generate anonymous feedback is less
than ten seconds in a 10,000-user anonymity group"
Mind the Gap: Towards a Backpressure-Based Transport Protocol for the Tor Network,"Tor has become the prime example for anonymous communication
systems. With increasing popularity, though,
Tor is also faced with increasing load. In this paper,
we tackle one of the fundamental problems in today’s
anonymity networks: network congestion. We show that
the current Tor design is not able to adjust the load appropriately,
and we argue that finding good solutions to
this problem is hard for anonymity overlays in general.
This is due to the long end-to-end delay in such networks,
combined with limitations on the allowable feedback due
to anonymity requirements. We introduce a design for
a tailored transport protocol. It combines latency-based
congestion control per overlay hop with a backpressure-based
flow control mechanism for inter-hop signalling.
The resulting overlay is able to react locally and thus
rapidly to varying network conditions. It allocates available
resources more evenly than the current Tor design;
this is beneficial in terms of both fairness and anonymity.
We show that it yields superior performance and improved
fairness—between circuits, and also between the
anonymity overlay and concurrent applications."
Sieve: Cryptographically Enforced Access Control for User Data in Untrusted Clouds,"Modern web services rob users of low-level control over
cloud storage—a user’s single logical data set is scattered
across multiple storage silos whose access controls are
set by web services, not users. The consequence is that
users lack the ultimate authority to determine how their
data is shared with other web services."
"Earp: Principled Storage, Sharing, and Protection for Mobile Apps","Modern mobile apps need to store and share structured
data, but the coarse-grained access-control mechanisms in
existing mobile operating systems are inadequate to help
apps express and enforce their protection requirements."
iCellular: Device-Customized Cellular Network Access on Commodity Smartphones,"Exploiting multi-carrier access offers a promising direction
to boost access quality in mobile networks. However,
our experiments show that, the current practice
does not achieve the full potential of this approach because
it has not utilized fine-grained, cellular-specific domain
knowledge. In this work, we propose iCellular,
which exploits low-level cellular information at the device
to improve multi-carrier access. Specifically, iCellular
is proactive and adaptive in its multi-carrier selection
by leveraging existing end-device mechanisms and
standards-complaint procedures. It performs adaptive
monitoring to ensure responsive selection and minimal
service disruption, and enhances carrier selection with
online learning and runtime decision fault prevention. It
is readily deployable on smartphones without infrastructure/hardware
modifications. We implement iCellular on
commodity phones and harness the efforts of Project Fi
to assess multi-carrier access over two US carriers: TMobile
and Sprint. Our evaluation shows that, iCellular
boosts the devices with up to 3.74x throughput improvement,
6.9x suspension reduction, and 1.9x latency decrement
over the state-of-the-art selection scheme, with
moderate CPU, memory and energy overheads."
Diamond: Nesting the Data Center Network with Wireless Rings in 3D Space,"The introduction of wireless transmissions into the data
center has been shown to be promising in improving
the performance of data center networks (DCN) cost effectively.
For high transmission flexibility and performance,
a fundamental challenge is to increase the wireless
availability and enable fully hybrid and seamless
transmissions over both wired and wireless DCN components.
Rather than limiting the number of wireless radios
by the size of top-of-rack (ToR) switches, we propose
a novel DCN architecture, Diamond, which nests
the wired DCN with radios equipped on all servers. To
harvest the gain allowed by the rich reconfigurable wireless
resources, we propose the low-cost deployment of
scalable 3D Ring Reflection Spaces (RRSs) which are interconnected
with streamlined wired herringbone to enable
large number of concurrent wireless transmissions
through high-performance multi-reflection of radio signals
over metal. To increase the number of concurrent
wireless transmissions within each RRS, we propose a
precise reflection method to reduce the wireless interference.
We build a 60GHz-based testbed to demonstrate
the function and transmission ability of our proposed architecture.
We further perform extensive simulations to
show the significant performance gain of Diamond, in
supporting up to five times higher server-to-server capacity,
enabling network-wide load balancing, and ensuring
high fault tolerance."
Ripple II: Faster Communication through Physical Vibration,"We envision physical vibration as a new modality of
data communication. In NSDI 2015, our paper reported
the feasibility of modulating the vibration of a smartphone’s
vibra-motor. When in physical contact with another
smartphone, the accelerometer of the second phone
was able to decode the vibrations at around 200 bits/s.
This paper builds on our first prototype, but redesigns
the entire radio stack to now achieve 30 kbps. The core
redesign includes (1) a new OFDM-based physical layer
that uses the microphone as a receiver (instead of the accelerometer),
and (2) a MAC layer that detects collision
at the transmitter and performs proactive symbol retransmissions.
We also develop two example applications on
top of the vibratory radio: (1) a finger ring that transmits
vibratory passwords through the finger bone to enable
touch based authentication, and (2) surface communication
between devices placed on the same table. The
overall system entails unique challenges and opportunities,
including ambient sound cancellation, OFDM over
vibrations, back-EMF based carrier sensing, predictive
retransmissions, bone conduction, etc. We call our system
Ripple II to suggest the continuity from the NSDI
2015 paper. We close the paper with a video demo that
streams music as OFDM packets through vibrations and
plays it in real time through the receiver’s speaker."
PhyCloak: Obfuscating Sensing from Communication Signals,"Recognition of human activities and gestures using preexisting WiFi signals has been shown to be feasible in recent studies. Given the pervasiveness of WiFi signals, this emerging sort of sensing poses a serious privacy threat. This paper is the first to counter the threat of unwanted or even malicious communication based sensing: it proposes a blackbox sensor obfuscation technique PhyCloak which distorts only the physical information in the communication signal that leaks privacy. The data in the communication signal is preserved and, in fact, the throughput of the link is increased with careful design. Moreover, the design allows coupling of the PhyCloak module with legitimate sensors, so that their sensing is preserved, while that of illegitimate sensors is obfuscated. The effectiveness of the design is validated via a prototype implementation on an SDR platform"
