An Industrial-Scale Software Defined Internet Exchange Point,"Software-Defined Internet Exchange Points (SDXes) promise to significantly increase the flexibility and function of interdomain traffic delivery on the Internet. Unfortunately, current SDX designs cannot yet achieve the scale required for large Internet exchange points (IXPs), which can host hundreds of participants exchanging traffic for hundreds of thousands of prefixes. Existing platforms are indeed too slow and inefficient to operate at this scale, typically requiring minutes to compile policies and millions of forwarding rules in the data plane."
XFabric: A Reconfigurable In-Rack Network for Rack-Scale Computers,"Rack-scale computers are dense clusters with hundreds of micro-servers per rack. Designed for data center workloads, they can have significant power, cost and performance benefits over current racks. The rack network can be distributed, with small packet switches embedded on each processor as part of a system-on-chip (SoC) design. Ingress/egress traffic is forwarded by SoCs that have direct uplinks to the data center. Such fabrics are not fully provisioned and the chosen topology and uplink placement impacts performance for different workloads."
"Be Fast, Cheap and in Control with SwitchKV","SwitchKV is a new key-value store system design that combines high-performance cache nodes with resourceconstrained backend nodes to provide load balancing in the face of unpredictable workload skew. The cache nodes absorb the hottest queries so that no individual backend node is over-burdened. Compared with previous designs, SwitchKV exploits SDN techniques and deeply optimized switch hardware to enable efficient contentbased routing. Programmable network switches keep track of cached keys and route requests to the appropriate nodes at line speed, based on keys encoded in packet headers. A new hybrid caching strategy keeps cache and switch forwarding rules updated with low overhead and ensures that system load is always well-balanced under rapidly changing workloads. Our evaluation results demonstrate that SwitchKV can achieve up to 5× throughput and 3× latency improvements over traditional system designs."
Bitcoin-NG: A Scalable Blockchain Protocol,"Cryptocurrencies, based on and led by Bitcoin, have shown promise as infrastructure for pseudonymous online payments, cheap remittance, trustless digital asset exchange, and smart contracts. However, Bitcoin-derived blockchain protocols have inherent scalability limits that trade off between throughput and latency, which withhold the realization of this potential."
Exploring Cross-Application Cellular Traffic Optimization with Baidu TrafficGuard,"As mobile cellular devices and traffic continue their rapid growth, providers are taking larger steps to optimize traffic, with the hopes of improving user experiences while reducing congestion and bandwidth costs. This paper presents the design, deployment, and experiences with Baidu TrafficGuard, a cloud-based mobile proxy that reduces cellular traffic using a network-layer VPN. The VPN connects a client-side proxy to a centralized traffic processing cloud. TrafficGuard works transparently across heterogeneous applications, and effectively reduces cellular traffic by 36% and overage instances by 10.7 times for roughly 10 million Android users in China. We discuss a large-scale cellular traffic analysis effort, how the resulting insights guided the design of TrafficGuard, and our experiences with a variety of traffic optimization techniques over one year of deployment."
Efficiently Delivering Online Services over Integrated Infrastructure,"We present Footprint, a system for delivering online services in the ""integrated"" setting, where the same provider operates multiple elements of the infrastructure (e.g., proxies, data centers, and the wide area network). Such integration can boost system efficiency and performance by finely modulating how traffic enters and traverses the infrastructure. But fully realizing its benefits requires managing complex dynamics of service workloads. For instance, when a group of users are directed to a new proxy, their ongoing sessions continue to arrive at the old proxy, and this load at the old proxy declines gradually. Footprint harnesses such dynamics using a high-fidelity model that is also efficient to solve. Simulations based on a partial deployment of Footprint in Microsoft’s infrastructure show that, compared to the current method, it can carry at least 50% more traffic and reduce user delays by at least 30%."
Scalable and Private Media Consumption with Popcorn,"We describe the design, implementation, and evaluation of Popcorn, a media delivery system that hides clients’ consumption (even from the content distributor). Popcorn relies on a powerful cryptographic primitive: private information retrieval (PIR). With novel refinements that leverage the properties of PIR protocols and media streaming, Popcorn scales to the size of Netflix’s library (8000 movies) and respects current controls on media dissemination. The dollar cost to serve a media object in Popcorn is 3.87× that of a non-private system."
Speeding up Web Page Loads with Shandian,"Web page loads are slow due to intrinsic inefficiencies in the page load process. Our study shows that the inefficiencies are attributable not only to the contents and structure of the Web pages (e.g., three-fourths of the CSS resources are not used during the initial page load) but also the way that pages are loaded (e.g., 15% of page load times are spent waiting for parsing-blocking resources to be loaded)."
Polaris: Faster Page Loads Using Fine-grained Dependency Tracking,"To load a web page, a browser must fetch and evaluate objects like HTML files and JavaScript source code. Evaluating an object can result in additional objects being fetched and evaluated. Thus, loading a web page requires a browser to resolve a dependency graph; this partial ordering constrains the sequence in which a browser can process individual objects. Unfortunately, many edges in a page’s dependency graph are unobservable by today’s browsers. To avoid violating these hidden dependencies, browsers make conservative assumptions about which objects to process next, leaving the network and CPU underutilized."
CFA: A Practical Prediction System for Video QoE Optimization,"Many prior efforts have suggested that Internet video Quality of Experience (QoE) could be dramatically improved by using data-driven prediction of video quality for different choices (e.g., CDN or bitrate) to make optimal decisions. However, building such a prediction system is challenging on two fronts. First, the relationships between video quality and observed session features can be quite complex. Second, video quality changes dynamically. Thus, we need a prediction model that is (a) expressive enough to capture these complex relationships and (b) capable of updating quality predictions in near real-time. Unfortunately, several seemingly natural solutions (e.g., simple machine learning approaches and simple network models) fail on one or more fronts. Thus, the potential benefits promised by these prior efforts remain unrealized. We address these challenges and present the design and implementation of Critical Feature Analytics (CFA). The design of CFA is driven by domain-specific insights that video quality is typically determined by a small subset of critical features whose criticality persists over several tens of minutes. This enables a scalable and accurate workflow where we automatically learn critical features for different sessions on coarse-grained timescales, while updating quality predictions in near real-time. Using a combination of a real-world pilot deployment and trace-driven analysis, we demonstrate that CFA leads to significant improvements in video quality; e.g., 32% less buffering time and 12% higher bitrate than a random decision maker."
Passive Wi-Fi: Bringing Low Power to Wi-Fi Transmissions,"Wi-Fi has traditionally been considered a power-consuming communication system and has not been widely adopting in the sensor network and IoT space. We introduce Passive Wi-Fi that demonstrates for the first time that one can generate 802.11b transmissions using backscatter communication, while consuming 3–4 orders of magnitude lower power than existing Wi-Fi chipsets. Passive Wi-Fi transmissions can be decoded on any Wi-Fi device including routers, mobile phones and tablets. Building on this, we also present a network stack design that enables passive Wi-Fi transmitters to coexist with other devices in the ISM band, without incurring the power consumption of carrier sense and medium access control operations. We build prototype hardware and implement all four 802.11b bit rates on an FPGA platform. Our experimental evaluation shows that passive Wi-Fi transmissions can be decoded on off-the-shelf smartphones and Wi-Fi chipsets over distances of 30–100 feet in various line-of-sight and through-the-wall scenarios. Finally, we design a passive Wi-Fi IC that shows that 1 and 11 Mbps transmissions consume 14.5 and 59.2 µW respectively. This translates to 10000x lower power than existing Wi-Fi chipsets and 1000x lower power than Bluetooth LTE and ZigBee."
Decimeter-Level Localization with a Single WiFi Access Point,"We present Chronos, a system that enables a single WiFi access point to localize clients to within tens of centimeters. Such a system can bring indoor positioning to homes and small businesses which typically have a single access point."
A Scalable Multi-User Uplink for Wi-Fi,"Mobile devices have fewer antennas than APs due to size and energy constraints. This antenna asymmetry restricts uplink capacity to the client antenna array size rather than the AP’s. To overcome antenna asymmetry, multiple clients can be grouped into a simultaneous multiuser transmission to achieve a full rank transmission that matches the number of antennas at the AP. In this paper, we design, implement, and experimentally evaluate MUSE, the first distributed and scalable system to achieve full-rank uplink multi-user capacity without control signaling for channel estimation, channel reporting, or user selection. Our experiments demonstrate full-rank multiplexing gains in the evaluated scenarios that show linear gains as the number of users increase while maintaining constant overhead."
BeamSpy: Enabling Robust 60 GHz Links Under Blockage,"Due to high directionality and small wavelengths, 60 GHz links are highly vulnerable to human blockage. To overcome blockage, 60 GHz radios can use a phased-array antenna to search for and switch to unblocked beam directions. However, these techniques are reactive, and only trigger after the blockage has occurred, and hence, they take time to recover the link. In this paper, we propose BeamSpy, that can instantaneously predict the quality of 60 GHz beams, even under blockage, without the costly beam searching. BeamSpy captures unique spatial and blockage-invariant correlation among beams through a novel prediction model, exploiting which we can immediately select the best alternative beam direction whenever the current beam’s quality degrades. We apply BeamSpy to a run-time fast beam adaptation protocol, and a blockage-risk assessment scheme that can guide blockage-resilient link deployment. Our experiments on a reconfigurable 60 GHz platform demonstrate the effectiveness of BeamSpy's prediction framework, and its usefulness in enabling robust 60 GHz links."
Compiling Path Queries,"Measuring the flow of traffic along network paths is crucial for many management tasks, including traffic engineering, diagnosing congestion, and mitigating DDoS attacks. We introduce a declarative query language for efficient path-based traffic monitoring. Path queries are specified as regular expressions over predicates on packet locations and header values, with SQLlike “groupby” constructs for aggregating results anywhere along a path. A run-time system compiles queries into a deterministic finite automaton. The automaton’s transition function is then partitioned, compiled into match-action rules, and distributed over the switches. Switches stamp packets with automaton states to track the progress towards fulfilling a query. Only when packets satisfy a query are the packets counted, sampled, or sent to collectors for further analysis. By processing queries in the data plane, users “pay as they go”, as data-collection overhead is limited to exactly those packets that satisfy the query. We implemented our system on top of the Pyretic SDN controller and evaluated its performance on a campus topology. Our experiments indicate that the system can enable “interactive debugging”— compiling multiple queries in a few seconds—while fitting rules comfortably in modern switch TCAMs and the automaton state into two bytes (e.g., a VLAN header)."
Simplifying Software-Defined Network Optimization Using SOL,"Realizing the benefits of SDN for many network management applications (e.g., traffic engineering, service chaining, topology reconfiguration) involves addressing complex optimizations that are central to these problems. Unfortunately, such optimization problems require (a) significant manual effort and expertise to express and (b) non-trivial computation and/or carefully crafted heuristics to solve. Our goal is to simplify the deployment of SDN applications using general high-level abstractions for capturing optimization requirements from which we can efficiently generate optimal solutions. To this end, we present SOL, a framework that demonstrates that it is possible to simultaneously achieve generality and efficiency. The insight underlying SOL is that many SDN applications can be recast within a unifying path-based optimization abstraction. Using this, SOL can efficiently generate near-optimal solutions and device configurations to implement them. We show that SOL provides comparable or better scalability than custom optimization solutions for diverse applications, allows a balancing of optimality and route churn per reconfiguration, and interfaces with modern SDN controllers."
Paving the Way for NFV: Simplifying Middlebox Modifications Using StateAlyzr,"Important Network Functions Virtualization (NFV) scenarios such as ensuring middlebox fault tolerance or elasticity require redistribution of internal middlebox state. While many useful frameworks exist today for migrating/cloning internal state, they require modications to middlebox code to identify needed state. is process is tedious and manual, hindering the adoption of such frameworks. We present a framework-independent system, StateAlyzr, that embodies novel algorithms adapted from program analysis to provably and automatically identify all state that must be migrated/cloned to ensure consistent middlebox output in the face of redistribution. We find that StateAlyzr reduces man-hours required for code modication by nearly 20✕. We apply StateAlyzr to four open source middleboxes and find its algorithms to be highly precise. We find that a large amount of, but not all, live state matters toward packet processing in these middleboxes. StateAlyzr’s algorithms can reduce the amount of state that needs redistribution by 600- 8000✕ compared to naive schemes."
Embark: Securely Outsourcing Middleboxes to the Cloud,"It is increasingly common for enterprises and other organizations to outsource network processing to the cloud. For example, enterprises may outsource firewalling, caching, and deep packet inspection, just as they outsource compute and storage. However, this poses a threat to enterprise confidentiality because the cloud provider gains access to the organization’s traffic."
BUZZ: Testing Context-Dependent Policies in Stateful Networks,"Checking whether a network correctly implements intended policies is challenging even for basic reachability policies (Can X talk to Y?) in simple stateless networks with L2/L3 devices. In practice, operators implement more complex context-dependent policies by composing stateful network functions; e.g., if the IDS flags X for sending too many failed connections, then subsequent packets from X must be sent to a deep-packet inspection device. Unfortunately, existing approaches in network verification have fundamental expressiveness and scalability challenges in handling such scenarios. To bridge this gap, we present BUZZ, a practical model-based testing framework. BUZZ’s design makes two key contributions: (1) Expressive and scalable models of the data plane, using a novel high-level traffic unit abstraction and by modeling complex network functions as an ensemble of finite-state machines; and (2) A scalable application of symbolic execution to tackle state-space explosion. We show that BUZZ generates test cases for a network with hundreds of network functions within two minutes (five orders of magnitude faster than alternative designs). We also show that BUZZ uncovers a range of both new and known policy violations in SDN/NFV systems."
Minimizing Faulty Executions of Distributed Systems,"When troubleshooting buggy executions of distributed
systems, developers typically start by manually separating
out events that are responsible for triggering the
bug (signal) from those that are extraneous (noise). We
present DEMi, a tool for automatically performing this
minimization. We apply DEMi to buggy executions of two
very different distributed systems, Raft and Spark, and
find that it produces minimized executions that are between
1X and 4.6X the size of optimal executions."
FlowRadar: A Better NetFlow for Data Centers,"NetFlow has been a widely used monitoring tool with
a variety of applications. NetFlow maintains an active
working set of flows in a hash table that supports flow
insertion, collision resolution, and flow removing. This
is hard to implement in merchant silicon at data center
switches, which has limited per-packet processing
time. Therefore, many NetFlow implementations and
other monitoring solutions have to sample or select a
subset of packets to monitor. In this paper, we observe
the need to monitor all the flows without sampling in
short time scales. Thus, we design FlowRadar, a new
way to maintain flows and their counters that scales to a
large number of flows with small memory and bandwidth
overhead. The key idea of FlowRadar is to encode per-
flow counters with a small memory and constant insertion
time at switches, and then to leverage the computing
power at the remote collector to perform network-wide
decoding and analysis of the flow counters. Our evaluation
shows that the memory usage of FlowRadar is
close to traditional NetFlow with perfect hashing. With
FlowRadar, operators can get better views into their networks
as demonstrated by two new monitoring applications
we build on top of FlowRadar."
Sibyl: A Practical Internet Route Oracle,"Network operators measure Internet routes to troubleshoot problems, and researchers measure routes to characterize the Internet. However, they still rely on decades-old tools like traceroute, BGP route collectors, and Looking Glasses, all of which permit only a single query about Internet routes—what is the path from here to there? This limited interface complicates answering queries about routes such as ""find routes traversing the Level3/AT&T peering in Atlanta,"" to understand the scope of a reported problem there."
VAST: A Unified Platform for Interactive Network Forensics,"Network forensics and incident response play a vital role in
site operations, but for large networks can pose daunting dif-
ficulties to cope with the ever-growing volume of activity and
resulting logs. On the one hand, logging sources can generate
tens of thousands of events per second, which a system supporting
comprehensive forensics must somehow continually ingest.
On the other hand, operators greatly benefit from interactive
exploration of disparate types of activity when analyzing an
incident."
Ernest: Efficient Performance Prediction for Large-Scale Advanced Analytics,"Recent workload trends indicate rapid growth in the
deployment of machine learning, genomics and scientific
workloads on cloud computing infrastructure. However,
efficiently running these applications on shared infrastructure
is challenging and we find that choosing the right
hardware configuration can significantly improve performance
and cost. The key to address the above challenge
is having the ability to predict performance of applications
under various resource configurations so that we
can automatically choose the optimal configuration."
Cliffhanger: Scaling Performance Cliffs in Web Memory Caches,"Web-scale applications are heavily reliant on memory cache systems such as Memcached to improve throughput and reduce user latency. Small performance improvements in these systems can result in large end-to-end gains. For example, a marginal increase in hit rate of 1% can reduce the application layer latency by over 35%. However, existing web cache resource allocation policies are workload oblivious and first-come-first-serve. By analyzing measurements from a widely used caching service, Memcachier, we demonstrate that existing cache allocation techniques leave significant room for improvement. We develop Cliffhanger, a lightweight iterative algorithm that runs on memory cache servers, which incrementally optimizes the resource allocations across and within applications based on dynamically changing workloads. It has been shown that cache allocation algorithms underperform when there are performance cliffs, in which minor changes in cache allocation cause large changes in the hit rate. We design a novel technique for dealing with performance cliffs incrementally and locally. We demonstrate that for the Memcachier applications, on average, Cliffhanger increases the overall hit rate 1.2%, reduces the total number of cache misses by 36.7% and achieves the same hit rate with 45% less memory capacity."
"FairRide: Near-Optimal, Fair Cache Sharing","Memory caches continue to be a critical component to many systems. In recent years, there has been larger amounts of data into main memory, especially in shared environments such as the cloud. The nature of such environments requires resource allocations to provide both performance isolation for multiple users/applications and high utilization for the systems. We study the problem of fair allocation of memory cache for multiple users with shared files. We find that, surprisingly, no memory allocation policy can provide all three desirable properties (isolation-guarantee, strategy-proofness and Paretoefficiency) that are typically achievable by other types of resources, e.g., CPU or network. We also show that there exist policies that achieve any two of the three properties. We find that the only way to achieve both isolation-guarantee and strategy-proofness is through blocking, which we efficiently adapt in a new policy called FairRide. We implement FairRide in a popular memorycentric storage system using an efficient form of blocking, named as expected delaying, and demonstrate that FairRide can lead to better cache efficiency (2.6× over isolated caches) and fairness in many scenarios."
HUG: Multi-Resource Fairness for Correlated and Elastic Demands,"In this paper, we study how to optimally provide isolation guarantees in multi-resource environments, such as public clouds, where a tenant’s demands on different resources (links) are correlated. Unlike prior work such as Dominant Resource Fairness (DRF) that assumes static and fixed demands, we consider elastic demands. Our approach generalizes canonical max-min fairness to the multi-resource setting with correlated demands, and extends DRF to elastic demands. We consider two natural optimization objectives: isolation guarantee from a tenant’s viewpoint and system utilization (work conservation) from an operator’s perspective. We prove that in non-cooperative environments like public cloud networks, there is a strong tradeoff between optimal isolation guarantee and work conservation when demands are elastic. Even worse, work conservation can even decrease network utilization instead of improving it when demands are inelastic. We identify the root cause behind the tradeoff and present a provably optimal allocation algorithm, High Utilization with Guarantees (HUG), to achieve maximum attainable network utilization without sacrificing the optimal isolation guarantee, strategyproofness, and other useful properties of DRF. In cooperative environments like private datacenter networks, HUG achieves both the optimal isolation guarantee and work conservation. Analyses, simulations, and experiments show that HUG provides better isolation guarantees, higher system utilization, and better tenant-level performance than its counterparts."
Consensus in a Box: Inexpensive Coordination in Hardware,"Consensus mechanisms for ensuring consistency are some of the most expensive operations in managing large amounts of data. Often, there is a trade off that involves reducing the coordination overhead at the price of accepting possible data loss or inconsistencies. As the demand for more efficient data centers increases, it is important to provide better ways of ensuring consistency without affecting performance."
