Ground-to-Aerial Image Geo-Localization With a Hard Exemplar Reweighting Triplet Loss,"The task of ground-to-aerial image geo-localization can be achieved by matching a ground view query image to a reference database of aerial/satellite images. It is highly challenging due to the dramatic viewpoint changes and unknown orientations. In this paper, we propose a novel in-batch reweighting triplet loss to emphasize the positive effect of hard exemplars during end-to-end training. We also integrate an attention mechanism into our model using feature-level contextual information. To analyze the difficulty level of each triplet, we first enforce a modified logistic regression to triplets with a distance rectifying factor. Then, the reference negative distances for corresponding anchors are set, and the relative weights of triplets are computed by comparing their difficulty to the corresponding references. To reduce the influence of extreme hard data and less useful simple exemplars, the final weights are pruned using upper and lower bound constraints. Experiments on two benchmark datasets show that the proposed approach significantly outperforms the state-of-the-art methods."
Learning to Discover Novel Visual Categories via Deep Transfer Clustering,"We consider the problem of discovering novel object categories in an image collection. While these images are unlabelled, we also assume prior knowledge of related but different image classes. We use such prior knowledge to reduce the ambiguity of clustering, and improve the quality of the newly discovered classes. Our contributions are twofold. The first contribution is to extend Deep Embedded Clustering to a transfer learning setting; we also improve the algorithm by introducing a representation bottleneck, temporal ensembling, and consistency. The second contribution is a method to estimate the number of classes in the unlabelled data. This also transfers knowledge from the known classes, using them as probes to diagnose different choices for the number of classes in the unlabelled subset. We thoroughly evaluate our method, substantially outperforming state-of-the-art techniques in a large number of benchmarks, including ImageNet, OmniGlot, CIFAR-100, CIFAR-10, and SVHN."
AM-LFS: AutoML for Loss Function Search,"Designing an effective loss function plays an important role in visual analysis. Most existing loss function designs rely on hand-crafted heuristics that require domain experts to explore the large design space, which is usually sub-optimal and time-consuming. In this paper, we propose AutoML for Loss Function Search (AM-LFS) which leverages REINFORCE to search loss functions during the training process. The key contribution of this work is the design of search space which can guarantee the generalization and transferability on different vision tasks by including a bunch of existing prevailing loss functions in a unified formulation. We also propose an efficient optimization framework which can dynamically optimize the parameters of loss function's distribution during training. Extensive experimental results on four benchmark datasets show that, without any tricks, our method outperforms existing hand-crafted loss functions in various computer vision tasks."
Few-Shot Object Detection via Feature Reweighting,"Conventional training of a deep CNN based object detector demands a large number of bounding box annotations, which may be unavailable for rare categories. In this work we develop a few-shot object detector that can learn to detect novel objects from only a few annotated examples. Our proposed model leverages fully labeled base classes and quickly adapts to novel classes, using a meta feature learner and a reweighting module within a one-stage detection architecture. The feature learner extracts meta features that are generalizable to detect novel object classes, using training data from base classes with sufficient samples. The reweighting module transforms a few support examples from the novel classes to a global vector that indicates the importance or relevance of meta features for detecting the corresponding objects. These two modules, together with a detection prediction module, are trained end-to-end based on an episodic few-shot learning scheme and a carefully designed loss function. Through extensive experiments we demonstrate that our model outperforms well-established baselines by a large margin for few-shot object detection, on multiple datasets and settings. We also present analysis on various aspects of our proposed model, aiming to provide some inspiration for future few-shot detection works."
"Objects365: A Large-Scale, High-Quality Dataset for Object Detection","In this paper, we introduce a new large-scale object detection dataset, Objects365, which has 365 object categories over 600K training images. More than 10 million, high-quality bounding boxes are manually labeled through a three-step, carefully designed annotation pipeline. It is the largest object detection dataset (with full annotation) so far and establishes a more challenging benchmark for the community. Objects365 can serve as a better feature learning dataset for localization-sensitive tasks like object detection and semantic segmentation. The Objects365 pre-trained models significantly outperform ImageNet pre-trained models with 5.6 points gain (42 vs 36.4) based on the standard setting of 90K iterations on COCO benchmark. Even compared with much long training time like 540K iterations, our Objects365 pretrained model with 90K iterations still have 2.7 points gain (42 vs 39.3). Meanwhile, the finetuning time can be greatly reduced (up to 10 times) when reaching the same accuracy. Better generalization ability of Object365 has also been verified on CityPersons, VOC segmentation, and ADE tasks. The dataset as well as the pretrained-models have been released at www.objects365.org."
Efficient and Accurate Arbitrary-Shaped Text Detection With Pixel Aggregation Network,"Scene text detection, an important step of scene text reading systems, has witnessed rapid development with convolutional neural networks. Nonetheless, two main challenges still exist and hamper its deployment to real-world applications. The first problem is the trade-off between speed and accuracy. The second one is to model the arbitrary-shaped text instance. Recently, some methods have been proposed to tackle arbitrary-shaped text detection, but they rarely take the speed of the entire pipeline into consideration, which may fall short in practical applications. In this paper, we propose an efficient and accurate arbitrary-shaped text detector, termed Pixel Aggregation Network (PAN), which is equipped with a low computational-cost segmentation head and a learnable post-processing. More specifically, the segmentation head is made up of Feature Pyramid Enhancement Module (FPEM) and Feature Fusion Module (FFM). FPEM is a cascadable U-shaped module, which can introduce multi-level information to guide the better segmentation. FFM can gather the features given by the FPEMs of different depths into a final feature for segmentation. The learnable post-processing is implemented by Pixel Aggregation (PA), which can precisely aggregate text pixels by predicted similarity vectors. Experiments on several standard benchmarks validate the superiority of the proposed PAN. It is worth noting that our method can achieve a competitive F-measure of 79.9% at 84.2 FPS on CTW1500."
Foreground-Aware Pyramid Reconstruction for Alignment-Free Occluded Person Re-Identification,"Re-identifying a person across multiple disjoint camera views is important for intelligent video surveillance, smart retailing and many other applications. However, existing person re-identification methods are challenged by the ubiquitous occlusion over persons and suffer performance degradation. This paper proposes a novel occlusion-robust and alignment-free model for occluded person ReID and extends its application to realistic and crowded scenarios. The proposed model first leverages the fully convolution network (FCN) and pyramid pooling to extract spatial pyramid features. Then an alignment-free matching approach namely Foreground-aware Pyramid Reconstruction (FPR) is developed to accurately compute matching scores between occluded persons, regardless of their different scales and sizes. FPR uses the error from robust reconstruction over spatial pyramid features to measure similarities between two persons. More importantly, we design a occlusion-sensitive foreground probability generator that focuses more on clean human body parts to robustify the similarity computation with less contamination from occlusion. The FPR is easily embedded into any end-to-end person ReID models. The effectiveness of the proposed method is clearly demonstrated by the experimental results (Rank-1 accuracy) on three occluded person datasets: Partial REID (78.30%), Partial iLIDS (68.08%), Occluded REID (81.00%), and three benchmark person datasets: Market1501 (95.42%), DukeMTMC (88.64%), CUHK03 (76.08%)."
Collect and Select: Semantic Alignment Metric Learning for Few-Shot Learning,"Few-shot learning aims to learn latent patterns from few training examples and has shown promises in practice. However, directly calculating the distances between the query image and support image in existing methods may cause ambiguity because dominant objects can locate anywhere on images. To address this issue, this paper proposes a Semantic Alignment Metric Learning (SAML) method for few-shot learning that aligns the semantically relevant dominant objects through a ""collect-and-select"" strategy. Specifically, we first calculate a relation matrix (RM) to ""collect"" the distances of each local region pairs of the 3D tensor extracted from a query image and the mean tensor of the support images. Then, the attention technique is adapted to ""select"" the semantically relevant pairs and put more weights on them. Afterwards, a multi-layer perceptron (MLP) is utilized to map the reweighted RMs to their corresponding similarity scores. Theoretical analysis demonstrates the generalization ability of SAML and gives a theoretical guarantee. Empirical results demonstrate that semantic alignment is achieved. Extensive experiments on benchmark datasets validate the strengths of the proposed approach and demonstrate that SAML significantly outperforms the current state-of-the-art methods. The source code is available at https://github.com/haofusheng/SAML."
Bayesian Adaptive Superpixel Segmentation,"Superpixels provide a useful intermediate image representation. Existing superpixel methods, however, suffer from at least some of the following drawbacks: 1) topology is handled heuristically; 2) the number of superpixels is either predefined or estimated at a prohibitive cost; 3) lack of adaptiveness. As a remedy, we propose a novel probabilistic model, self-coined Bayesian Adaptive Superpixel Segmentation (BASS), together with an efficient inference. BASS is a Bayesian nonparametric mixture model that also respects topology and favors spatial coherence. The optimizationbased and topology-aware inference is parallelizable and implemented in GPU. Quantitatively, BASS achieves results that are either better than the state-of-the-art or close to it, depending on the performance index and/or dataset. Qualitatively, we argue it achieves the best results; we demonstrate this by not only subjective visual inspection but also objective quantitative performance evaluation of the downstream application of face detection. Our code is available at https://github.com/uzielroy/BASS."
CapsuleVOS: Semi-Supervised Video Object Segmentation Using Capsule Routing,"In this work we propose a capsule-based approach for semi-supervised video object segmentation. Current video object segmentation methods are frame-based and often require optical flow to capture temporal consistency across frames which can be difficult to compute. To this end, we propose a video based capsule network, CapsuleVOS, which can segment several frames at once conditioned on a reference frame and segmentation mask. This conditioning is performed through a novel routing algorithm for attention-based efficient capsule selection. We address two challenging issues in video object segmentation: 1) segmentation of small objects and 2) occlusion of objects across time. The issue of segmenting small objects is addressed with a zooming module which allows the network to process small spatial regions of the video. Apart from this, the framework utilizes a novel memory module based on recurrent networks which helps in tracking objects when they move out of frame or are occluded. The network is trained end-to-end and we demonstrate its effectiveness on two benchmark video object segmentation datasets; it outperforms current offline approaches on the Youtube-VOS dataset while having a run-time that is almost twice as fast as competing methods. The code is publicly available at https://github.com/KevinDuarte/CapsuleVOS."
BAE-NET: Branched Autoencoder for Shape Co-Segmentation,"We treat shape co-segmentation as a representation learning problem and introduce BAE-NET, a branched autoencoder network, for the task. The unsupervised BAE-NET is trained with a collection of un-segmented shapes, using a shape reconstruction loss, without any ground-truth labels. Specifically, the network takes an input shape and encodes it using a convolutional neural network, whereas the decoder concatenates the resulting feature code with a point coordinate and outputs a value indicating whether the point is inside/outside the shape. Importantly, the decoder is branched: each branch learns a compact representation for one commonly recurring part of the shape collection, e.g., airplane wings. By complementing the shape reconstruction loss with a label loss, BAE-NET is easily tuned for one-shot learning. We show unsupervised, weakly supervised, and one-shot learning results by BAE-NET, demonstrating that using only a couple of exemplars, our network can generally outperform state-of-the-art supervised methods trained on hundreds of segmented shapes. Code is available at https://github.com/czq142857/BAE-NET."
VV-Net: Voxel VAE Net With Group Convolutions for Point Cloud Segmentation,"We present a novel algorithm for point cloud segmentation.Our approach transforms unstructured point clouds into regular voxel grids, and further uses a kernel-based interpolated variational autoencoder (VAE) architecture to encode the local geometry within each voxel.Traditionally, the voxel representation only comprises Boolean occupancy information, which fails to capture the sparsely distributed points within voxels in a compact manner. In order to handle sparse distributions of points, we further employ radial basis functions (RBF) to compute a local, continuous representation within each voxel. Our approach results in a good volumetric representation that effectively tackles noisy point cloud datasets and is more robust for learning. Moreover, we further introduce group equivariant CNN to 3D, by defining the convolution operator on a symmetry group acting on  Z ^3 and its isomorphic sets. This improves the expressive capacity without increasing parameters, leading to more robust segmentation results.We highlight the performance on standard benchmarks and show that our approach outperforms state-of-the-art segmentation algorithms on the ShapeNet and S3DIS datasets."
Miss Detection vs. False Alarm: Adversarial Learning for Small Object Segmentation in Infrared Images,"A key challenge of infrared small object segmentation (ISOS) is to balance miss detection (MD) and false alarm (FA). This usually needs ""opposite"" strategies to suppress the two terms, and has not been well resolved in the literature. In this paper, we propose a deep adversarial learning framework to improve this situation. Departing from the tradition of jointly reducing MD and FA via a single objective, we decompose this difficult task into two sub-tasks handled by two models trained adversarially, with each focusing on reducing either MD or FA. Such a new design brings forth at least three advantages. First, as each model focuses on a relatively simpler sub-task, the overall difficulty of ISOS is somehow decreased. Second, the adversarial training of the two models naturally produces a delicate balance of MD and FA, and low rates for both MD and FA could be achieved at Nash equilibrium. Third, this MD-FA detachment gives us more flexibility to develop specific models dedicated to each sub-task. To realize the above design, we propose a conditional Generative Adversarial Network comprising of two generators and one discriminator. Each generator strives for one sub-task, while the discriminator differentiates the three segmentation results from the two generators and the ground truth. Moreover, in order to better serve the sub-tasks, the two generators, based on context aggregation networks, utilzse different size of receptive fields, providing both local and global views of objects for segmentation. As verified on multiple infrared image data sets, our method consistently achieves better segmentation than many state-of-the-art ISOS methods."
Group-Wise Deep Object Co-Segmentation With Co-Attention Recurrent Neural Network,"Effective feature representations which should not only express the images individual properties, but also reflect the interaction among group images are essentially crucial for real-world co-segmentation. This paper proposes a novel end-to-end deep learning approach for group-wise object co-segmentation with a recurrent network architecture. Specifically, the semantic features extracted from a pre-trained CNN of each image are first processed by single image representation branch to learn the unique properties. Meanwhile, a specially designed Co-Attention Recurrent Unit (CARU) recurrently explores all images to generate the final group representation by using the co-attention between images, and simultaneously suppresses noisy information. The group feature which contains synergetic information is broadcasted to each individual image and fused with multi-scale fine-resolution features to facilitate the inferring of co-segmentation. Moreover, we propose a groupwise training objective to utilize the co-object similarity and figure-ground distinctness as the additional supervision. The whole modules are collaboratively optimized in an end-to-end manner, further improving the robustness of the approach. Comprehensive experiments on three benchmarks can demonstrate the superiority of our approach in comparison with the state-of-the-art methods."
Human Attention in Image Captioning: Dataset and Analysis,"In this work, we present a novel dataset consisting of eye movements and verbal descriptions recorded synchronously over images. Using this data, we study the differences in human attention during free-viewing and image captioning tasks. We look into the relationship between human atten- tion and language constructs during perception and sen- tence articulation. We also analyse attention deployment mechanisms in the top-down soft attention approach that is argued to mimic human attention in captioning tasks, and investigate whether visual saliency can help image caption- ing. Our study reveals that (1) human attention behaviour differs in free-viewing and image description tasks. Hu- mans tend to fixate on a greater variety of regions under the latter task, (2) there is a strong relationship between de- scribed objects and attended objects (97% of the described objects are being attended), (3) a convolutional neural net- work as feature encoder accounts for human-attended re- gions during image captioning to a great extent (around 78%), (4) soft-attention mechanism differs from human at- tention, both spatially and temporally, and there is low correlation between caption scores and attention consis- tency scores. These indicate a large gap between humans and machines in regards to top-down attention, and (5) by integrating the soft attention model with image saliency, we can significantly improve the model's performance on Flickr30k and MSCOCO benchmarks. The dataset can be found at: https://github.com/SenHe/ Human-Attention-in-Image-Captioning."
Variational Uncalibrated Photometric Stereo Under General Lighting,"Photometric stereo (PS) techniques nowadays remain constrained to an ideal laboratory setup where modeling and calibration of lighting is amenable. To eliminate such restrictions, we propose an efficient principled variational approach to uncalibrated PS under general illumination. To this end, the Lambertian reflectance model is approximated through a spherical harmonic expansion, which preserves the spatial invariance of the lighting. The joint recovery of shape, reflectance and illumination is then formulated as a single variational problem. There the shape estimation is carried out directly in terms of the underlying perspective depth map, thus implicitly ensuring integrability and bypassing the need for a subsequent normal integration. To tackle the resulting nonconvex problem numerically, we undertake a two-phase procedure to initialize a balloon-like perspective depth map, followed by a ""lagged"" block coordinate descent scheme. The experiments validate efficiency and robustness of this approach. Across a variety of evaluations, we are able to reduce the mean angular error consistently by a factor of 2-3 compared to the state-of-the-art."
SPLINE-Net: Sparse Photometric Stereo Through Lighting Interpolation and Normal Estimation Networks,This paper solves the Sparse Photometric stereo through Lighting Interpolation and Normal Estimation using a generative Network (SPLINE-Net). SPLINE-Net contains a lighting interpolation network to generate dense lighting observations given a sparse set of lights as inputs followed by a normal estimation network to estimate surface normals. Both networks are jointly constrained by the proposed symmetric and asymmetric loss functions to enforce isotropic constrain and perform outlier rejection of global illumination effects. SPLINE-Net is verified to outperform existing methods for photometric stereo of general BRDFs by using only ten images of different lights instead of using nearly one hundred images.
Hyperspectral Image Reconstruction Using Deep External and Internal Learning,"To solve the low spatial and/or temporal resolution problem which the conventional hypelrspectral cameras often suffer from, coded snapshot hyperspectral imaging systems have attracted more attention recently. Recovering a hyperspectral image (HSI) from its corresponding coded image is an ill-posed inverse problem, and learning accurate prior of HSI is essential to solve this inverse problem. In this paper, we present an effective convolutional neural network (CNN) based method for coded HSI reconstruction, which learns the deep prior from the external dataset as well as the internal information of input coded image with spatial-spectral constraint. Our method can effectively exploit spatial-spectral correlation and sufficiently represent the variety nature of HSIs. Experimental results show our method outperforms the state-of-the-art methods under both comprehensive quantitative metrics and perceptive quality."
Gravity as a Reference for Estimating a Person's Height From Video,"Estimating the metric height of a person from monocular imagery without additional assumptions is ill-posed. Existing solutions either require manual calibration of ground plane and camera geometry, special cameras, or reference objects of known size. We focus on motion cues and exploit gravity on earth as an omnipresent reference 'object' to translate acceleration, and subsequently height, measured in image-pixels to values in meters. We require videos of motion as input, where gravity is the only external force. This limitation is different to those of existing solutions that recover a person's height and, therefore, our method opens up new application fields. We show theoretically and empirically that a simple motion trajectory analysis suffices to translate from pixel measurements to the person's metric height, reaching a MAE of up to 3.9 cm on jumping motions, and that this works without camera and ground plane calibration."
Shadow Removal via Shadow Image Decomposition,"We propose a novel deep learning method for shadow removal. Inspired by physical models of shadow formation, we use a linear illumination transformation to model the shadow effects in the image that allows the shadow image to be expressed as a combination of the shadow-free image, the shadow parameters, and a matte layer. We use two deep networks, namely SP-Net and M-Net, to predict the shadow parameters and the shadow matte respectively. This system allows us to remove the shadow effects on the images. We train and test our framework on the most challenging shadow removal dataset (ISTD). Compared to the state-of-the-art method, our model achieves a 40% error reduction in terms of root mean square error (RMSE) for the shadow area, reducing RMSE from 13.3 to 7.9. Moreover, we create an augmented ISTD dataset based on an image decomposition system by modifying the shadow parameters to generate new synthetic shadow images. Training our model on this new augmented ISTD dataset further lowers the RMSE on the shadow area to 7.4."
