Hierarchical Encoding of Sequential Data With Compact and Sub-Linear Storage Cost,"Snapshot-based visual localization is an important problem in several computer vision and robotics applications such as Simultaneous Localization And Mapping (SLAM). To achieve real-time performance in very large-scale environments with massive amounts of training and map data, techniques such as approximate nearest neighbor search (ANN) algorithms are used. While several state-of-the-art variants of quantization and indexing techniques have demonstrated to be efficient in practice, their theoretical memory cost still scales at least linearly with the training data (i.e., O(n) where n is the number of instances in the database), since each data point must be associated with at least one code vector. To address these limitations, in this paper we present a totally new hierarchical encoding approach that enables a sub-linear storage scale. The algorithm exploits the widespread sequential nature of sensor information streams in robotics and autonomous vehicle applications and achieves, both theoretically and experimentally, sub-linear scalability in storage required for a given environment size. Furthermore, the associated query time of our algorithm is also of sub-linear complexity. We benchmark the performance of the proposed algorithm on several real-world benchmark datasets and experimentally validate the theoretical sub-linearity of our approach, while also showing that our approach yields competitive absolute storage performance as well."
C-MIDN: Coupled Multiple Instance Detection Network With Segmentation Guidance for Weakly Supervised Object Detection,"Weakly supervised object detection (WSOD) that only needs image-level annotations has obtained much attention recently. By combining convolutional neural network with multiple instance learning method, Multiple Instance Detection Network (MIDN) has become the most popular method to address the WSOD problem and been adopted as the initial model in many works. We argue that MIDN inclines to converge to the most discriminative object parts, which limits the performance of methods based on it. In this paper, we propose a novel Coupled Multiple Instance Detection Network (C-MIDN) to address this problem. Specifically, we use a pair of MIDNs, which work in a complementary manner with proposal removal. The localization information of the MIDNs is further coupled to obtain tighter bounding boxes and localize multiple objects. We also introduce a Segmentation Guided Proposal Removal (SGPR) algorithm to guarantee the MIL constraint after the removal and ensure the robustness of C-MIDN. Through a simple implementation of the C-MIDN with online detector refinement, we obtain 53.6% and 50.3% mAP on the challenging PASCAL VOC 2007 and 2012 benchmarks respectively, which significantly outperform the previous state-of-the-arts."
Learning Feature-to-Feature Translator by Alternating Back-Propagation for Generative Zero-Shot Learning,"We investigate learning feature-to-feature translator networks by alternating back-propagation as a general-purpose solution to zero-shot learning (ZSL) problems. It is a generative model-based ZSL framework. In contrast to models based on generative adversarial networks (GAN) or variational autoencoders (VAE) that require auxiliary networks to assist the training, our model consists of a single conditional generator that maps class-level semantic features and Gaussian white noise vectors accounting for instance-level latent factors to visual features, and is trained by maximum likelihood estimation. The training process is a simple yet effective alternating back-propagation process that iterates the following two steps: (i) the inferential back-propagation to infer the latent noise vector of each observed example, and (ii) the learning back-propagation to update the model parameters. We show that, with slight modifications, our model is capable of learning from incomplete visual features for ZSL. We conduct extensive comparisons with existing generative ZSL methods on five benchmarks, demonstrating the superiority of our method in not only ZSL performance but also convergence speed and computational cost. Specifically, our model outperforms the existing state-of-the-art methods by a remarkable margin up to 3.1% and 4.0% in ZSL and generalized ZSL settings, respectively."
Deep Constrained Dominant Sets for Person Re-Identification,"In this work, we propose an end-to-end constrained clustering scheme to tackle the person re-identification (re-id) problem. Deep neural networks (DNN) have recently proven to be effective on person re-identification task. In particular, rather than leveraging solely a probe-gallery similarity, diffusing the similarities among the gallery images in an end-to-end manner has proven to be effective in yielding a robust probe-gallery affinity. However, existing methods do not apply probe image as a constraint, and are prone to noise propagation during the similarity diffusion process. To overcome this, we propose an intriguing scheme which treats person-image retrieval problem as a constrained clustering optimization problem, called deep constrained dominant sets (DCDS). Given a probe and gallery images, we re-formulate person re-id problem as finding a constrained cluster, where the probe image is taken as a constraint (seed) and each cluster corresponds to a set of images corresponding to the same person. By optimizing the constrained clustering in an end-to-end manner, we naturally leverage the contextual knowledge of a set of images corresponding to the given person-images. We further enhance the performance by integrating an auxiliary net alongside DCDS, which employs a multi-scale ResNet. To validate the effectiveness of our method we present experiments on several benchmark datasets and show that the proposed method can outperform state-of-the-art methods."
Invariant Information Clustering for Unsupervised Image Classification and Segmentation,"We present a novel clustering objective that learns a neural network classifier from scratch, given only unlabelled data samples. The model discovers clusters that accurately match semantic classes, achieving state-of-the-art results in eight unsupervised clustering benchmarks spanning image classification and segmentation. These include STL10, an unsupervised variant of ImageNet, and CIFAR10, where we significantly beat the accuracy of our closest competitors by 6.6 and 9.5 absolute percentage points respectively. The method is not specialised to computer vision and operates on any paired dataset samples; in our experiments we use random transforms to obtain a pair from each image. The trained network directly outputs semantic labels, rather than high dimensional representations that need external processing to be usable for semantic clustering. The objective is simply to maximise mutual information between the class assignments of each pair. It is easy to implement and rigorously grounded in information theory, meaning we effortlessly avoid degenerate solutions that other clustering methods are susceptible to. In addition to the fully unsupervised mode, we also test two semi-supervised settings. The first achieves 88.8% accuracy on STL10 classification, setting a new global state-of-the-art over all existing methods (whether supervised, semi-supervised or unsupervised). The second shows robustness to 90% reductions in label coverage, of relevance to applications that wish to make use of small amounts of labels. github.com/xu-ji/IIC"
Subspace Structure-Aware Spectral Clustering for Robust Subspace Clustering,"Subspace clustering is the problem of partitioning data drawn from a union of multiple subspaces. The most popular subspace clustering framework in recent years is the graph clustering-based approach, which performs subspace clustering in two steps: graph construction and graph clustering. Although both steps are equally important for accurate clustering, the vast majority of work has focused on improving the graph construction step rather than the graph clustering step. In this paper, we propose a novel graph clustering framework for robust subspace clustering. By incorporating a geometry-aware term with the spectral clustering objective, we encourage our framework to be robust to noise and outliers in given affinity matrices. We also develop an efficient expectation-maximization-based algorithm for optimization. Through extensive experiments on four real-world datasets, we demonstrate that the proposed method outperforms existing methods."
Order-Preserving Wasserstein Discriminant Analysis,"Supervised dimensionality reduction for sequence data projects the observations in sequences onto a low-dimensional subspace to better separate different sequence classes. It is typically more challenging than conventional dimensionality reduction for static data, because measuring the separability of sequences involves non-linear procedures to manipulate the temporal structures. This paper presents a linear method, namely Order-preserving Wasserstein Discriminant Analysis (OWDA), which learns the projection by maximizing the inter-class distance and minimizing the intra-class scatter. For each class, OWDA extracts the order-preserving Wasserstein barycenter and constructs the intra-class scatter as the dispersion of the training sequences around the barycenter. The inter-class distance is measured as the order-preserving Wasserstein distance between the corresponding barycenters. OWDA is able to concentrate on the distinctive differences among classes by lifting the geometric relations with temporal constraints. Experiments show that OWDA achieves competitive results on three 3D action recognition datasets."
LayoutVAE: Stochastic Scene Layout Generation From a Label Set,"Recently there is an increasing interest in scene generation within the research community. However, models used for generating scene layouts from textual description largely ignore plausible visual variations within the structure dictated by the text. We propose LayoutVAE, a variational autoencoder based framework for generating stochastic scene layouts. LayoutVAE is a versatile modeling framework that allows for generating full image layouts given a label set, or per label layouts for an existing image given a new label. In addition, it is also capable of detecting unusual layouts, potentially providing a way to evaluate layout generation problem. Extensive experiments on MNIST-Layouts and challenging COCO 2017 Panoptic dataset verifies the effectiveness of our proposed framework."
Robust Variational Bayesian Point Set Registration,"In this work, we propose a hierarchical Bayesian network based point set registration method to solve missing correspondences and various massive outliers. We construct this network first using the finite Student s t latent mixture model (TLMM), in which distributions of latent variables are estimated by a tree-structured variational inference (VI) so that to obtain a tighter lower bound under the Bayesian framework. We then divide the TLMM into two different mixtures with isotropic and anisotropic covariances for correspondences recovering and outliers identification, respectively. Finally, the parameters of mixing proportion and covariances are both taken as latent variables, which benefits explaining of missing correspondences and heteroscedastic outliers. In addition, a cooling schedule is adopted to anneal prior on covariances and scale variables within designed two phases of transformation, it anneal priors on global and local variables to perform a coarse-to- fine registration. In experiments, our method outperforms five state-of-the-art methods in synthetic point set and realistic imaging registrations."
Is an Affine Constraint Needed for Affine Subspace Clustering?,"Subspace clustering methods based on expressing each data point as a linear combination of other data points have achieved great success in computer vision applications such as motion segmentation, face and digit clustering. In face clustering, the subspaces are linear and subspace clustering methods can be applied directly. In motion segmentation, the subspaces are affine and an additional affine constraint on the coefficients is often enforced. However, since affine subspaces can always be embedded into linear subspaces of one extra dimension, it is unclear if the affine constraint is really necessary. This paper shows, both theoretically and empirically, that when the dimension of the ambient space is high relative to the sum of the dimensions of the affine subspaces, the affine constraint has a negligible effect on clustering performance. Specifically, our analysis provides conditions that guarantee the correctness of affine subspace clustering methods both with and without the affine constraint, and shows that these conditions are satisfied for high-dimensional data. Underlying our analysis is the notion of affinely independent subspaces, which not only provides geometrically interpretable correctness conditions, but also clarifies the relationships between existing results for affine subspace clustering."
Meta-Learning to Detect Rare Objects,"Few-shot learning, i.e., learning novel concepts from few examples, is fundamental to practical visual recognition systems. While most of existing work has focused on few-shot classification, we make a step towards few-shot object detection, a more challenging yet under-explored task. We develop a conceptually simple but powerful meta-learning based framework that simultaneously tackles few-shot classification and few-shot localization in a unified, coherent way. This framework leverages meta-level knowledge about ""model parameter generation"" from base classes with abundant data to facilitate the generation of a detector for novel classes. Our key insight is to disentangle the learning of category-agnostic and category-specific components in a CNN based detection model. In particular, we introduce a weight prediction meta-model that enables predicting the parameters of category-specific components from few examples. We systematically benchmark the performance of modern detectors in the small-sample size regime. Experiments in a variety of realistic scenarios, including within-domain, cross-domain, and long-tailed settings, demonstrate the effectiveness and generality of our approach under different notions of novel classes."
New Convex Relaxations for MRF Inference With Unknown Graphs,"Treating graph structures of Markov random fields as unknown and estimating them jointly with labels have been shown to be useful for modeling human activity recognition and other related tasks. We propose two novel relaxations for solving this problem. The first is a linear programming (LP) relaxation, which is provably tighter than the existing LP relaxation. The second is a non-convex quadratic programming (QP) relaxation, which admits an efficient concave-convex procedure (CCCP). The CCCP algorithm is initialized by solving a convex QP relaxation of the problem, which is obtained by modifying the diagonal of the matrix that specifies the non-convex QP relaxation. We show that our convex QP relaxation is optimal in the sense that it minimizes the L1 norm of the diagonal modification vector. While the convex QP relaxation is not as tight as the existing and the new LP relaxations, when used in conjunction with the CCCP algorithm for the non-convex QP relaxation, it provides accurate solutions. We demonstrate the efficacy of our new relaxations for both synthetic data and human activity recognition."
Cluster Alignment With a Teacher for Unsupervised Domain Adaptation,"Deep learning methods have shown promise in unsupervised domain adaptation, which aims to leverage a labeled source domain to learn a classifier for the unlabeled target domain with a different distribution. However, such methods typically learn a domain-invariant representation space to match the marginal distributions of the source and target domains, while ignoring their fine-level structures. In this paper, we propose Cluster Alignment with a Teacher (CAT) for unsupervised domain adaptation, which can effectively incorporate the discriminative clustering structures in both domains for better adaptation. Technically, CAT leverages an implicit ensembling teacher model to reliably discover the class-conditional structure in the feature space for the unlabeled target domain. Then CAT forces the features of both the source and the target domains to form discriminative class-conditional clusters and aligns the corresponding clusters across domains. Empirical results demonstrate that CAT achieves state-of-the-art results in several unsupervised domain adaptation scenarios."
Analyzing the Variety Loss in the Context of Probabilistic Trajectory Prediction,"Trajectory or behavior prediction of traffic agents is an important component of autonomous driving and robot planning in general. It can be framed as a probabilistic future sequence generation problem and recent literature has studied the applicability of generative models in this context. The variety or Minimum over N (MoN) loss, which tries to minimize the error between the ground truth and the closest of N output predictions, has been used in these recent learning models to improve the diversity of predictions. In this work, we present a proof to show that the MoN loss does not lead to the ground truth probability density function, but approximately to its square root instead. We validate this finding with extensive experiments on both simulated toy as well as real world datasets. We also propose multiple solutions to compensate for the dilation to show improvement of log likelihood of the ground truth samples in the corrected probability density function."
Deep Mesh Reconstruction From Single RGB Images via Topology Modification Networks,"Reconstructing the 3D mesh of a general object from a single image is now possible thanks to the latest advances of deep learning technologies. However, due to the nontrivial difficulty of generating a feasible mesh structure, the state-of-the-art approaches often simplify the problem by learning the displacements of a template mesh that deforms it to the target surface. Though reconstructing a 3D shape with complex topology can be achieved by deforming multiple mesh patches, it remains difficult to stitch the results to ensure a high meshing quality. In this paper, we present an end-to-end single-view mesh reconstruction framework that is able to generate high-quality meshes with complex topologies from a single genus-0 template mesh. The key to our approach is a novel progressive shaping framework that alternates between mesh deformation and topology modification. While a deformation network predicts the per-vertex translations that reduce the gap between the reconstructed mesh and the ground truth, a novel topology modification network is employed to prune the error-prone faces, enabling the evolution of topology. By iterating over the two procedures, one can progressively modify the mesh topology while achieving higher reconstruction accuracy. Moreover, a boundary refinement network is designed to refine the boundary conditions to further improve the visual quality of the reconstructed mesh. Extensive experiments demonstrate that our approach outperforms the current state-of-the-art methods both qualitatively and quantitatively, especially for the shapes with complex topologies."
UprightNet: Geometry-Aware Camera Orientation Estimation From Single Images,"We introduce UprightNet, a learning-based approach for estimating 2DoF camera orientation from a single RGB image of an indoor scene. Unlike recent methods that leverage deep learning to perform black-box regression from image to orientation parameters, we propose an end-to-end framework that incorporates explicit geometric reasoning. In particular, we design a network that predicts two representations of scene geometry, in both the local camera and global reference coordinate systems, and solves for the camera orientation as the rotation that best aligns these two predictions via a differentiable least squares module. This network can be trained end-to-end, and can be supervised with both ground truth camera poses and intermediate representations of surface geometry. We evaluate UprightNet on the single-image camera orientation task on synthetic and real datasets, and show significant improvements over prior state-of-the-art approaches."
Escaping Plato's Cave: 3D Shape From Adversarial Rendering,"We introduce PlatonicGAN to discover the 3D structure of an object class from an unstructured collection of 2D images, i.e., where no relation between photos is known, except that they are showing instances of the same category. The key idea is to train a deep neural network to generate 3D shapes which, when rendered to images, are indistinguishable from ground truth images (for a discriminator) under various camera poses. Discriminating 2D images instead of 3D shapes allows tapping into unstructured 2D photo collections instead of relying on curated (e.g., aligned, annotated, etc.) 3D data sets. To establish constraints between 2D image observation and their 3D interpretation, we suggest a family of rendering layers that are effectively differentiable. This family includes visual hull, absorption-only (akin to x-ray), and emission-absorption. We can successfully reconstruct 3D shapes from unstructured 2D images and extensively evaluate PlatonicGAN on a range of synthetic and real data sets achieving consistent improvements over baseline methods. We further show that PlatonicGAN can be combined with 3D supervision to improve on and in some cases even surpass the quality of 3D-supervised methods."
Deep End-to-End Alignment and Refinement for Time-of-Flight RGB-D Module,"Recently, it is increasingly popular to equip mobile RGB cameras with Time-of-Flight (ToF) sensors for active depth sensing. However, for off-the-shelf ToF sensors, one must tackle two problems in order to obtain high-quality depth with respect to the RGB camera, namely 1) online calibration and alignment; and 2) complicated error correction for ToF depth sensing. In this work, we propose a framework for jointly alignment and refinement via deep learning. First, a cross-modal optical flow between the RGB image and the ToF amplitude image is estimated for alignment. The aligned depth is then refined via an improved kernel predicting network that performs kernel normalization and applies the bias prior to the dynamic convolution. To enrich our data for end-to-end training, we have also synthesized a dataset using tools from computer graphics. Experimental results demonstrate the effectiveness of our approach, achieving state-of-the-art for ToF refinement."
GEOBIT: A Geodesic-Based Binary Descriptor Invariant to Non-Rigid Deformations for RGB-D Images,"At the core of most three-dimensional alignment and tracking tasks resides the critical problem of point correspondence. In this context, the design of descriptors that efficiently and uniquely identifies keypoints, to be matched, is of central importance. Numerous descriptors have been developed for dealing with affine/perspective warps, but few can also handle non-rigid deformations. In this paper, we introduce a novel binary RGB-D descriptor invariant to isometric deformations. Our method uses geodesic isocurves on smooth textured manifolds. It combines appearance and geometric information from RGB-D images to tackle non-rigid transformations. We used our descriptor to track multiple textured depth maps and demonstrate that it produces reliable feature descriptors even in the presence of strong non-rigid deformations and depth noise. The experiments show that our descriptor outperforms different state-of-the-art descriptors in both precision-recall and recognition rate metrics. We also provide to the community a new dataset composed of annotated RGB-D images of different objects (shirts, cloths, paintings, bags), subjected to strong non-rigid deformations, to evaluate point correspondence algorithms."
CDTB: A Color and Depth Visual Object Tracking Dataset and Benchmark,"We propose a new color-and-depth general visual object tracking benchmark (CDTB). CDTB is recorded by several passive and active RGB-D setups and contains indoor as well as outdoor sequences acquired in direct sunlight. The CDTB dataset is the largest and most diverse dataset in RGB-D tracking, with an order of magnitude larger number of frames than related datasets. The sequences have been carefully recorded to contain significant object pose change, clutter, occlusion, and periods of long-term target absence to enable tracker evaluation under realistic conditions. Sequences are per-frame annotated with 13 visual attributes for detailed analysis. Experiments with RGB and RGB-D trackers show that CDTB is more challenging than previous datasets. State-of-the-art RGB trackers outperform the recent RGB-D trackers, indicating a large gap between the two fields, which has not been previously detected by the prior benchmarks. Based on the results of the analysis we point out opportunities for future research in RGB-D tracker design."
