Pushing the Frontiers of Unconstrained Crowd Counting: New Dataset and Benchmark Method,"In this work, we propose a novel crowd counting network that progressively generates crowd density maps via residual error estimation. The proposed method uses VGG16 as the backbone network and employs density map generated by the final layer as a coarse prediction to refine and generate finer density maps in a progressive fashion using residual learning. Additionally, the residual learning is guided by an uncertainty-based confidence weighting mechanism that permits the flow of only high-confidence residuals in the refinement path. The proposed Confidence Guided Deep Residual Counting Network (CG-DRCN) is evaluated on recent complex datasets, and it achieves significant improvements in errors. Furthermore, we introduce a new large scale unconstrained crowd counting dataset (JHU-CROWD) that is  2.8 larger than the most recent crowd counting datasets in terms of the number of images. It contains 4,250 images with 1.11 million annotations. In comparison to existing datasets, the proposed dataset is collected under a variety of diverse scenarios and environmental conditions. Specifically, the dataset includes several images with weather-based degradations and illumination variations in addition to many distractor images, making it a very challenging dataset. Additionally, the dataset consists of rich annotations at both image-level and head-level. Several recent methods are evaluated and compared on this dataset."
Spatial Correspondence With Generative Adversarial Network: Learning Depth From Monocular Videos,"Depth estimation from monocular videos has important applications in many areas such as autonomous driving and robot navigation. It is a very challenging problem without knowing the camera pose since errors in camera-pose estimation can significantly affect the video-based depth estimation accuracy. In this paper, we present a novel SC-GAN network with end-to-end adversarial training for depth estimation from monocular videos without estimating the camera pose and pose change over time. To exploit cross-frame relations, SC-GAN includes a spatial correspondence module which uses Smolyak sparse grids to efficiently match the features across adjacent frames, and an attention mechanism to learn the importance of features in different directions. Furthermore, the generator in SC-GAN learns to estimate depth from the input frames, while the discriminator learns to distinguish between the ground-truth and estimated depth map for the reference frame. Experiments on the KITTI and Cityscapes datasets show that the proposed SC-GAN can achieve much more accurate depth maps than many existing state-of-the-art methods on monocular videos."
Learning Single Camera Depth Estimation Using Dual-Pixels,"Deep learning techniques have enabled rapid progress in monocular depth estimation, but their quality is limited by the ill-posed nature of the problem and the scarcity of high quality datasets. We estimate depth from a single cam-era by leveraging the dual-pixel auto-focus hardware that is increasingly common on modern camera sensors. Classic stereo algorithms and prior learning-based depth estimation techniques underperform when applied on this dual-pixel data, the former due to too-strong assumptions about RGB image matching, and the latter due to not leveraging the understanding of optics of dual-pixel image formation. To allow learning based methods to work well on dual-pixel imagery, we identify an inherent ambiguity in the depth estimated from dual-pixel cues, and develop an approach to estimate depth up to this ambiguity. Using our approach, existing monocular depth estimation techniques can be effectively applied to dual-pixel data, and much smaller models can be constructed that still infer high quality depth. To demonstrate this, we capture a large dataset of in-the-wild 5-viewpoint RGB images paired with corresponding dual-pixel data, and show how view supervision with this data can be used to learn depth up to the unknown ambiguities. On our new task, our model is 30% more accurate than any prior work on learning-based monocular or stereoscopic depth estimation."
Domain-Adaptive Single-View 3D Reconstruction,"Single-view 3D shape reconstruction is an important but challenging problem, mainly for two reasons. First, as shape annotation is very expensive to acquire, current methods rely on synthetic data, in which ground-truth 3D annotation is easy to obtain. However, this results in domain adaptation problem when applied to natural images. The second challenge is that there are multiple shapes that can explain a given 2D image. In this paper, we propose a framework to improve over these challenges using adversarial training. On one hand, we impose domain confusion between natural and synthetic image representations to reduce the distribution gap. On the other hand, we impose the reconstruction to be `realistic' by forcing it to lie on a (learned) manifold of realistic object shapes. Our experiments show that these constraints improve performance by a large margin over baseline reconstruction models. We achieve results competitive with the state of the art with a much simpler architecture."
Transformable Bottleneck Networks,"We propose a novel approach to performing fine-grained 3D manipulation of image content via a convolutional neural network, which we call the Transformable Bottleneck Network (TBN). It applies given spatial transformations directly to a volumetric bottleneck within our encoder-bottleneck-decoder architecture. Multi-view supervision encourages the network to learn to spatially disentangle the feature space within the bottleneck. The resulting spatial structure can be manipulated with arbitrary spatial transformations. We demonstrate the efficacy of TBNs for novel view synthesis, achieving state-of-the-art results on a challenging benchmark. We demonstrate that the bottlenecks produced by networks trained for this task contain meaningful spatial structure that allows us to intuitively perform a variety of image manipulations in 3D, well beyond the rigid transformations seen during training. These manipulations include non-uniform scaling, non-rigid warping, and combining content from different images. Finally, we extract explicit 3D structure from the bottleneck, performing impressive 3D reconstruction from a single input image."
RIO: 3D Object Instance Re-Localization in Changing Indoor Environments,"In this work, we introduce the task of 3D object instance re-localization (RIO): given one or multiple objects in an RGB-D scan, we want to estimate their corresponding 6DoF poses in another 3D scan of the same environment taken at a later point in time. We consider RIO a particularly important task in 3D vision since it enables a wide range of practical applications, including AI-assistants or robots that are asked to find a specific object in a 3D scene. To address this problem, we first introduce 3RScan, a novel dataset and benchmark, which features 1482 RGB-D scans of 478 environments across multiple time steps. Each scene includes several objects whose positions change over time, together with ground truth annotations of object instances and their respective 6DoF mappings among re-scans. Automatically finding 6DoF object poses leads to a particular challenging feature matching task due to varying partial observations and changes in the surrounding context. To this end, we introduce a new data-driven approach that efficiently finds matching features using a fully-convolutional 3D correspondence network operating on multiple spatial scales. Combined with a 6DoF pose optimization, our method outperforms state-of-the-art baselines on our newly-established benchmark, achieving an accuracy of 30.58%."
Pix2Pose: Pixel-Wise Coordinate Regression of Objects for 6D Pose Estimation,"Estimating the 6D pose of objects using only RGB images remains challenging because of problems such as occlusion and symmetries. It is also difficult to construct 3D models with precise texture without expert knowledge or specialized scanning devices. To address these problems, we propose a novel pose estimation method, Pix2Pose, that predicts the 3D coordinates of each object pixel without textured models. An auto-encoder architecture is designed to estimate the 3D coordinates and expected errors per pixel. These pixel-wise predictions are then used in multiple stages to form 2D-3D correspondences to directly compute poses with the PnP algorithm with RANSAC iterations. Our method is robust to occlusion by leveraging recent achievements in generative adversarial training to precisely recover occluded parts. Furthermore, a novel loss function, the transformer loss, is proposed to handle symmetric objects by guiding predictions to the closest symmetric pose. Evaluations on three different benchmark datasets containing symmetric and occluded objects show our method outperforms the state of the art using only RGB images."
CDPN: Coordinates-Based Disentangled Pose Network for Real-Time RGB-Based 6-DoF Object Pose Estimation,"6-DoF object pose estimation from a single RGB image is a fundamental and long-standing problem in computer vision. Current leading approaches solve it by training deep networks to either regress both rotation and translation from image directly or to construct 2D-3D correspondences and further solve them via PnP indirectly. We argue that rotation and translation should be treated differently for their significant difference. In this work, we propose a novel 6-DoF pose estimation approach: Coordinates-based Disentangled Pose Network (CDPN), which disentangles the pose to predict rotation and translation separately to achieve highly accurate and robust pose estimation. Our method is flexible, efficient, highly accurate and can deal with texture-less and occluded objects. Extensive experiments on LINEMOD and Occlusion datasets are conducted and demonstrate the superiority of our approach. Concretely, our approach significantly exceeds the state-of-the- art RGB-based methods on commonly used metrics."
C3DPO: Canonical 3D Pose Networks for Non-Rigid Structure From Motion,"We propose C3DPO, a method for extracting 3D models of deformable objects from 2D keypoint annotations in unconstrained images. We do so by learning a deep network that reconstructs a 3D object from a single view at a time, accounting for partial occlusions, and explicitly factoring the effects of viewpoint changes and object deformations. In order to achieve this factorization, we introduce a novel regularization technique. We first show that the factorization is successful if, and only if, there exists a certain canonicalization function of the reconstructed shapes. Then, we learn the canonicalization function together with the reconstruction one, which constrains the result to be consistent. We demonstrate state-of-the-art reconstruction results for methods that do not use ground-truth 3D supervision for a number of benchmarks, including Up3D and PASCAL3D+."
Learning to Reconstruct 3D Manhattan Wireframes From a Single Image,"From a single view of an urban environment, we propose a method to effectively exploit the global structural regularities for obtaining a compact, accurate, and intuitive 3D wireframe representation. Our method trains a single convolutional neural network to simultaneously detect salient junctions and straight lines, as well as predict their 3D depth and vanishing points. Compared with state-of-the-art learning-based wireframe detection methods, our network is much simpler and more unified, leading to better 2D wireframe detection. With a global structural prior (such as Manhattan assumption), our method further reconstructs a full 3D wireframe model, a compact vector representation suitable for a variety of high-level vision tasks such as AR and CAD. We conduct extensive evaluations of our method on a large new synthetic dataset of urban scenes as well as real images. Our code and datasets will be published along with the paper."
Soft Rasterizer: A Differentiable Renderer for Image-Based 3D Reasoning,"Rendering bridges the gap between 2D vision and 3D scenes by simulating the physical process of image formation. By inverting such renderer, one can think of a learning approach to infer 3D information from 2D images. However, standard graphics renderers involve a fundamental discretization step called rasterization, which prevents the rendering process to be differentiable, hence able to be learned. Unlike the state-of-the-art differentiable renderers, which only approximate the rendering gradient in the back propagation, we propose a truly differentiable rendering framework that is able to (1) directly render colorized mesh using differentiable functions and (2) back-propagate efficient supervision signals to mesh vertices and their attributes from various forms of image representations, including silhouette, shading and color images. The key to our framework is a novel formulation that views rendering as an aggregation function that fuses the probabilistic contributions of all mesh triangles with respect to the rendered pixels. Such formulation enables our framework to flow gradients to the occluded and far-range vertices, which cannot be achieved by the previous state-of-the-arts. We show that by using the proposed renderer, one can achieve significant improvement in 3D unsupervised single-view reconstruction both qualitatively and quantitatively. Experiments also demonstrate that our approach is able to handle the challenging tasks in image-based shape fitting, which remain nontrivial to existing differentiable renderers. Code is available at https://github.com/ShichenLiu/SoftRas."
Learnable Triangulation of Human Pose,"We present two novel solutions for multi-view 3D human pose estimation based on new learnable triangulation methods that combine 3D information from multiple 2D views. The first (baseline) solution is a basic differentiable algebraic triangulation with an addition of confidence weights estimated from the input images. The second, more complex, solution is based on volumetric aggregation of 2D feature maps from the 2D backbone followed by refinement via 3D convolutions that produce final 3D joint heatmaps. Crucially, both of the approaches are end-to-end differentiable, which allows us to directly optimize the target metric. We demonstrate transferability of the solutions across datasets and considerably improve the multi-view state of the art on the Human3.6M dataset."
xR-EgoPose: Egocentric 3D Human Pose From an HMD Camera,"We present a new solution to egocentric 3D body pose estimation from monocular images captured from a downward looking fish-eye camera installed on the rim of a head mounted virtual reality device. This unusual viewpoint, just 2 cm. away from the user's face, leads to images with unique visual appearance, characterized by severe self-occlusions and strong perspective distortions that result in a drastic difference in resolution between lower and upper body. Our contribution is two-fold. Firstly, we propose a new encoder-decoder architecture with a novel dual branch decoder designed specifically to account for the varying uncertainty in the 2D joint locations. Our quantitative evaluation, both on synthetic and real-world datasets, shows that our strategy leads to substantial improvements in accuracy over state of the art egocentric pose estimation approaches. Our second contribution is a new large-scale photorealistic synthetic dataset -- xR-EgoPose -- offering 383K frames of high quality renderings of people with a diversity of skin tones, body shapes, clothing, in a variety of backgrounds and lighting conditions, performing a range of actions. Our experiments show that the high variability in our new synthetic training corpus leads to good generalization to real world footage and to state of the art results on real world datasets with ground truth. Moreover, an evaluation on the Human3.6M benchmark shows that the performance of our method is on par with top performing approaches on the more classic problem of 3D human pose from a third person viewpoint."
DeepHuman: 3D Human Reconstruction From a Single Image,"We propose DeepHuman, an image-guided volume-to-volume translation CNN for 3D human reconstruction from a single RGB image. To reduce the ambiguities associated with the reconstruction of invisible areas, our method leverages a dense semantic representation generated from SMPL model as an additional input. One key feature of our network is that it fuses different scales of image features into the 3D space through volumetric feature transformation, which helps to recover accurate surface geometry. The surface details are further refined through a normal refinement network, which can be concatenated with the volume generation network using our proposed volumetric normal projection layer. We also contribute THuman, a 3D real-world human model dataset containing approximately 7000 models. The network is trained using training data generated from the dataset. Overall, due to the specific design of our network and the diversity in our dataset, our method enables 3D human model estimation given only a single image and outperforms state-of-the-art approaches."
A Neural Network for Detailed Human Depth Estimation From a Single Image,"This paper presents a neural network to estimate a detailed depth map of the foreground human in a single RGB image. The result captures geometry details such as cloth wrinkles, which are important in visualization applications. To achieve this goal, we separate the depth map into a smooth base shape and a residual detail shape and design a network with two branches to regress them respectively. We design a training strategy to ensure both base and detail shapes can be faithfully learned by the corresponding network branches. Furthermore, we introduce a novel network layer to fuse a rough depth map and surface normals to further improve the final result. Quantitative comparison with fused `ground truth' captured by real depth cameras and qualitative examples on unconstrained Internet images demonstrate the strength of the proposed method."
DenseRaC: Joint 3D Pose and Shape Estimation by Dense Render-and-Compare,"We present DenseRaC, a novel end-to-end framework for jointly estimating 3D human pose and body shape from a monocular RGB image. Our two-step framework takes the body pixel-to-surface correspondence map (i.e., IUV map) as proxy representation and then performs estimation of parameterized human pose and shape. Specifically, given an estimated IUV map, we develop a deep neural network optimizing 3D body reconstruction losses and further integrating a render-and-compare scheme to minimize differences between the input and the rendered output, i.e., dense body landmarks, body part masks, and adversarial priors. To boost learning, we further construct a large-scale synthetic dataset (MOCA) utilizing web-crawled Mocap sequences, 3D scans and animations. The generated data covers diversified camera views, human actions and body shapes, and is paired with full ground truth. Our model jointly learns to represent the 3D human body from hybrid datasets, mitigating the problem of unpaired training data. Our experiments show that DenseRaC obtains superior performance against state of the art on public benchmarks of various human-related tasks."
Not All Parts Are Created Equal: 3D Pose Estimation by Modeling Bi-Directional Dependencies of Body Parts,"Not all the human body parts have the same degree of freedom (DOF) due to the physiological structure. For example, the limbs may move more flexibly and freely than the torso does. Most of the existing 3D pose estimation methods, despite the very promising results achieved, treat the body joints equally and consequently often lead to larger reconstruction errors on the limbs. In this paper, we propose a progressive approach that explicitly accounts for the distinct DOFs among the body parts. We model parts with higher DOFs like the elbows, as dependent components of the corresponding parts with lower DOFs like the torso, of which the 3D locations can be more reliably estimated. Meanwhile, the high-DOF parts may, in turn, impose a constraint on where the low-DOF ones lie. As a result, parts with different DOFs supervise one another, yielding physically constrained and plausible pose-estimation results. To further facilitate the prediction of the high-DOF parts, we introduce a pose-attribution estimation, where the relative location of a limb joint with respect to the torso, which has the least DOF of a human body, is explicitly estimated and further fed to the joint-estimation module. The proposed approach achieves very promising results, outperforming the state of the art on several benchmarks."
Extreme View Synthesis,"We present Extreme View Synthesis, a solution for novel view extrapolation that works even when the number of input images is small---as few as two. In this context, occlusions and depth uncertainty are two of the most pressing issues, and worsen as the degree of extrapolation increases. We follow the traditional paradigm of performing depth-based warping and refinement, with a few key improvements. First, we estimate a depth probability volume, rather than just a single depth value for each pixel of the novel view. This allows us to leverage depth uncertainty in challenging regions, such as depth discontinuities. After using it to get an initial estimate of the novel view, we explicitly combine learned image priors and the depth uncertainty to synthesize a refined image with less artifacts. Our method is the first to show visually pleasing results for baseline magnifications of up to 30x."
View Independent Generative Adversarial Network for Novel View Synthesis,"Synthesizing novel views from a 2D image requires to infer 3D structure and project it back to 2D from a new viewpoint. In this paper, we propose an encoder-decoder based generative adversarial network VI-GAN to tackle this problem. Our method is to let the network, after seeing many images of objects belonging to the same category in different views, obtain essential knowledge of intrinsic properties of the objects. To this end, an encoder is designed to extract view-independent feature that characterizes intrinsic properties of the input image, which includes 3D structure, color, texture etc. We also make the decoder hallucinate the image of a novel view based on the extracted feature and an arbitrary user-specific camera pose. Extensive experiments demonstrate that our model can synthesize high-quality images in different views with continuous camera poses, and is general for various applications."
Cascaded Context Pyramid for Full-Resolution 3D Semantic Scene Completion,"Semantic Scene Completion (SSC) aims to simultaneously predict the volumetric occupancy and semantic category of a 3D scene. It helps intelligent devices to understand and interact with the surrounding scenes. Due to the high-memory requirement, current methods only produce low-resolution completion predictions, and generally lose the object details. Furthermore, they also ignore the multi-scale spatial contexts, which play a vital role for the 3D inference. To address these issues, in this work we propose a novel deep learning framework, named Cascaded Context Pyramid Network (CCPNet), to jointly infer the occupancy and semantic labels of a volumetric 3D scene from a single depth image. The proposed CCPNet improves the labeling coherence with a cascaded context pyramid. Meanwhile, based on the low-level features, it progressively restores the fine-structures of objects with Guided Residual Refinement (GRR) modules. Our proposed framework has three outstanding advantages: (1) it explicitly models the 3D spatial context for performance improvement; (2) full-resolution 3D volumes are produced with structure-preserving details; (3) light-weight models with low-memory requirements are captured with a good extensibility. Extensive experiments demonstrate that in spite of taking a single-view depth map, our proposed framework can generate high-quality SSC results, and outperforms state-of-the-art approaches on both the synthetic SUNCG and real NYU datasets."
View-Consistent 4D Light Field Superpixel Segmentation,"Many 4D light field processing applications rely on superpixel segmentations, for which occlusion-aware view consistency is important. Yet, existing methods often enforce consistency by propagating clusters from a central view only, which can lead to inconsistent superpixels for non-central views. Our proposed approach combines an occlusion-aware angular segmentation in horizontal and vertical EPI spaces with an occlusion-aware clustering and propagation step across all views. Qualitative video demonstrations show that this helps to remove flickering and inconsistent boundary shapes versus the state-of-the-art approach, and quantitative metrics reflect these findings with improved boundary accuracy and view consistency scores."
